body,byline,description,title,url,topics,people,org,election_confidence,authors,date_written,orgs,article_id,date_access
"As 
Donald Trump
 and other 
Republicans
 talked tough on illegal immigration during last week's presidential debate, an exasperated 
Jeb Bush
 noted that 
Hillary Clinton
's campaign aides were, right then, exchanging high-fives.
He might have added: And Republican leaders in many states, like California, were once again despairing.
From the beginning of the summer of Trump, many Republicans here hoped he would disappear quickly, to limit damage to the party's image. Summer turned to fall, and Trump still dominates the presidential campaign. And so does the subject of illegal immigration, posing a mighty threat.
How mighty could be seen in a USC Dornsife/Los Angeles Times poll published last week. It demonstrated again what California sees in every election: The party's positions on immigration and other issues, like gay marriage, have cost Republicans a generation of good will and support. Here, the poll reminded, Republicans are limited mostly to older and white voters, religious voters and residents of inland California.
The current brouhaha over illegal immigration is important because new voters will carry their views of the political parties with them for a very long time.
""The experiences people have when they enter the political system do stay with them,"" said Jon Cohen, vice president of survey research for SurveyMonkey, the firm that conducted the poll. Political views ""can shift … but those initial moments are important and do frame how they see things.""
Republican difficulties can be seen in three key areas.
Young and minority voters
There's substantial overlap in the membership of these groups, and in their reasons for siding with Democrats and the party's candidates.
According to the poll, 36% of voters ages 18 to 29 strongly approve of 
President Obama
. Another 40% approve of him more mildly, meaning three-quarters of young California voters are on Obama's side. Asked whether the country was headed in the right direction, 40% said it was — not a majority but six points above the percentage for California voters overall.
Asked whether immigrants strengthened or weakened American society, 7 in 10 of the 18- to 29-year-olds said they represented a strength. (Among those age 65 and older, a slight majority felt the same way.)
Views among Latino, African American and Asian voters were similar. All told, three-quarters of black voters, almost two-thirds of Latino voters and 70% of Asian voters supported President Obama. By strong majorities, all said immigration was positive for the country. Latino and Asian voters were about as positive about the direction of the country as were young voters.
Those voters receive a contrary message from the Republican candidates for president. To hear them, the country is falling apart, President Obama is an abject failure and immigration is a threat. (The USC Dornsife/Times poll did not test views on the president's healthcare plan, but polls taken since the measure passed showed that it is broadly popular among minority voters. The GOP presidential candidates regularly scorn it and pledge to repeal it.)
Interestingly, young Republicans are not that different in some ways from their elders — their presidential selections were quite similar — but they, too, have more moderate positions on immigration, gay marriage and other cultural issues.
The state's coastal-inland split
The traditional California fight is between north and south. The political split is between west and east, coastal and inland.
Take the Obama support rating: Along the coast, 61% supported him. Inland, only 44% did. Two of the most conservative areas of the state, the Central Valley and Inland Empire, had only a 46% and 34% support rating for him, respectively. In both places, strong opposition was by far the dominant view.
Here's the problem: The Central Valley represents 19% of the state's voters, and the Inland Empire another 10%. The two largest Democratic areas, Los Angeles County and the Bay Area, make up 44% of the state's voters.
Even inland, demography is cutting into Republican unanimity. A majority of voters in the Central Valley said that immigrants strengthen this country, and 43% of Inland Empire voters agreed. (Growing Latino voting strength everywhere in the state has pushed many inland Republican members of Congress to support changes in immigration policy opposed by their leaders.)
Religion, or lack thereof
Religion has long been a dividing line in politics — the more common attendance at services, the greater the likelihood of political conservatism. It was true in the new poll as well.
About half of Republican candidate Ben Carson's supporters said they attend church at least once a week, the highest percentage for any candidate. Only 20% of Democrat Hillary Rodham Clinton's supporters reported that they attend services at least once a week.
The problem for Republicans? There aren't enough Californians who are that religious.
In California, 28% said they attend services at least once a week, and 44% said they attend seldom or never. Nationally, 35% were actively religious, while 38% seldom or never attended services.
Republicans might be tempted to write off California, but their problem is that trends that started here are spreading. In presidential elections, Nevada and New Mexico have become regularly Democratic and Colorado has turned into a toss-up state because of California-style demographic changes.
There would appear to be two solutions: a rapid influx of inland church-goers moving into the state, or a shift by the candidates toward moderation. At this early point of the presidential contest, the odds of the former seem greater than the odds of the latter.
cathleen.decker@latimes.com
Twitter: 
@cathleendecker 
For more on politics, go to
 
www.latimes.com/decker
 
and 
www.latimes.com/politics
.",,"<p>As Donald Trump and other Republicans talked tough on illegal immigration during last week's presidential debate, an exasperated Jeb Bush noted that Hillary Clinton's campaign aides were, right then, exchanging high-fives.</p> <p>He might have added: And Republican leaders in many states, like California,...</p>",Three key areas that give Republicans trouble in California,http://www.latimes.com/la-me-pol-ca-california-politics-poll-20151115-story.html,[u'immigration'],"[u'Donald Trump', u'Rodham Clinton', u'Jeb Bush', u'Hillary Clinton', u'Ben Carson']",latimes,0.9969839217021564,"[{u'author_id': 41997, u'fullname': u'cathleen decker', u'primary_org': u'latimes'}]",2015-11-15 08:05:00,"[u'GOP', u'Congress', u'Los Angeles County']",5bf4d8ad78d9540c95882d1c5942fa1e,2015-11-15 08:26:25.829957
"



Democratic U.S. presidential candidates Senator Bernie Sanders (L), former Secretary of State Hillary Clinton and former Maryland Governor Martin O'Malley pose on stage ahead of the second official 2016 U.S. Democratic presidential candidates debate in Des Moines, Iowa, November 14, 2015.   (REUTERS/Jim Young)


Hillary Clinton was put on the defensive at the opening of Saturday night’s Democratic presidential debate over military interventions she backed in countries now gripped by instability.
The debate in Des Moines, Iowa, came in the wake of the Paris terror attacks, which thrust the issues of national security and foreign policy back to the center of the 2016 campaign. The debate format was changed to focus anew on those issues.
But, citing the chaos in the Middle East and North Africa, Clinton’s rivals criticized her Senate vote for use of force before the Iraq war and appeared to criticize her support for toppling Libyan dictator Muammar Qaddafi.
Former Maryland Gov. Martin O’Malley said America’s role is not to roam the world “looking for new dictators to topple.”
He said it is also important to understand “secondary and third consequences” that come after removing a “single dictator.” O’Malley called Libya, Syria and other countries in the region a “mess.”

Clinton defended her support for toppling Qaddafi, saying he was threatening a “genocide” and America’s European and Arab allies asked for U.S. support.
She also said “it is imperative” that the U.S. do more to confront the “arc of instability” in the region. And to O’Malley’s critique, she said, “I don’t think you can paint with a broad brush,” and “This is an incredibly complicated region of the world.”
Vermont Sen. Bernie Sanders, meanwhile, referenced Clinton’s support for use of force in Iraq and said the “disastrous invasion” led “to the rise of Al Qaeda and to ISIS.”
Clinton again called her Iraq war vote a “mistake,” but disputed that the war is the only driver of modern terrorism.
The candidates also condemned the Paris terror attacks.
“Our prayers are with the people of France tonight, but that is not enough,” Clinton said.
She called for global “resolve” to “root out” the “radical jihadist ideology” that motivates groups like the Islamic State. Clinton, a former secretary of state, said she would coordinate efforts “against the scourge of terrorism.”
“It cannot be contained. It must be defeated,” she said of ISIS.
Sanders blasted ISIS as a “barbarous organization.”
O’Malley called this the “new face” of terror threats.
The attacks across multiple locations in Paris killed at least 129 people and wounded hundreds, officials said. 
In a primary race otherwise dominated by the economy, climate and front-runner Clinton’s personal record, the debate in Des Moines, Iowa, now is expected to focus heavily on security and foreign policy after debate host CBS News reworked the format.  
It is an area where Clinton, as former secretary of state, enters with the thickest resume – but also one that could prove problematic, given her involvement shaping the policies in increasingly unstable and chaotic nations like Libya and Syria.
Sanders, after appearing to give her a pass at the first debate over her personal email controversy, has in recent weeks shown a greater interest in criticizing her record. But his focus on issues like income inequality could be out of place in a discussion focused on global security challenges. Sanders’ campaign objected to some of the CBS News debate tweaks, sources said.
Clinton also enters this debate – hosted by CBS News, KCCI-TV and The Des Moines Register – facing a narrower field than at their first encounter in October. Since that debate, two candidates have dropped out, leaving only Sanders and O’Malley.
Clinton is seen to have otherwise strengthened her hand since that debate, making it through a lengthy hearing before the Benghazi congressional committee and seeing one of her biggest potential political threats – a late bid by Vice President Biden – disappear as the vice president announced he would not run.
Sanders remains Clinton’s biggest challenge, and has stirred an enthusiasm in the Democratic base that Clinton has struggled to evoke. But nationally and in Iowa, she continues to lead him by double digits in the polls.
Still, the FBI investigation over Clinton’s use of a personal email and server while secretary of state looms over her bid, with the probe said to be expanding. ",,Hillary Clinton was put on the defensive at the opening of Saturday night’s Democratic presidential debate over military interventions she backed in countries now gripped by instability. ,Clinton on defense over Middle East policies at Dem debate,http://feeds.foxnews.com/~r/foxnews/most-popular/~3/TEOgoe910VE/,[u'foreign policy/national security'],"[u'Bernie Sanders', u'Muammar Qaddafi', u'Hillary Clinton', u""Martin O'Malley"", u'Jim Young']",fox,0.9311865151561396,[],2015-11-15 02:02:16,"[u'Senate', u'Al Qaeda', u'FBI']",b06f7a0e9f9c60524f5011b3887f1e37,2015-11-15 03:00:12.671185
"The fight against global terrorism will take center stage Saturday night when Democrats gather in Iowa to debate after the gruesome attacks in Paris that laid bare the kinds of threats the next American president will face.

A month after the Democratic presidential candidates clashed on gun control and financial regulations in their first debate, which focused largely on domestic and economic issues, they are expected to face more questions on foreign policy and national security. Hours after the deadly attacks, CBS News, a co-host of the event, said it would refocus the debate to give candidates an opportunity to discuss how they would respond to such an international crisis.

Despite the tragic nature of the events, the new backdrop represents an opportunity for Hillary Rodham Clinton, the former secretary of state, to shine at a moment when her two remaining rivals, Senator Bernie Sanders of Vermont and Martin O’Malley — neither of whom has much foreign policy experience — will be under pressure to blunt her momentum.

Since Mrs. Clinton’s crisp debate performance in October, her poll numbers have surged, she weathered hours of congressional questioning about her handling of the Benghazi attacks, and three of her rivals for the nomination have dropped out.

“It will be interesting to see if Secretary Clinton can keep doing what she’s been doing,” said Brad Anderson, who was President Obama’s 2012 state director in Iowa. “Her steadiness is why you’re seeing her poll numbers continue to increase, especially when you look at what’s happening on the other side of the aisle.”

A New York Times/CBS News survey released this week showed Mrs. Clinton continuing to dominate the race, with more than half of Democratic primary voters backing her and 62 percent thinking she is the candidate who can bring about change in Washington. The shift in the debate’s emphasis to foreign affairs should allow Mrs. Clinton to highlight her deep experience on the international stage, providing an opportunity to extend her advantage.

For Mrs. Clinton’s opponents, the debate presents a chance to tell voters otherwise, and her Senate votes and handling of international crises as a senator and a diplomat could come under scrutiny.

Still, the event is not expected to resemble the free-for-all atmosphere that has marked Republican debates, which have featured sharp exchanges and personal attacks. While the Republican primary contest is a crowded affair, the Democrats will have considerably more time to make their cases and delve into more detailed policy arguments on Saturday with just three candidates on the stage. Since the last debate, Lincoln Chafee, the former governor of Rhode Island, and former Senator Jim Webb of Virginia have dropped out of the race. Lawrence Lessig, a Harvard professor who was running as a Democrat but was not included in the last debate, also stopped his campaign.

Mr. Sanders will get another opportunity to take a harder line against Mrs. Clinton, after he dismissed the controversy surrounding her use of a private email server as secretary of state and largely avoided attacking her directly in their first face-off. He has been preparing sharper lines against Mrs. Clinton on issues like trade, gun control and her emails, and his advisers say he has been studying her record more closely since their October meeting.

Democratic strategists say the debate will also be a significant moment for Mr. O’Malley, the former governor of Maryland, whose poll numbers lag in the low single digits. Facing Mrs. Clinton’s star power and the grass-roots support behind Mr. Sanders, Mr. O’Malley needs to find a way to capture some of the spotlight.

“It’s the play that he has left in his playbook right now, to come out swinging and let people know he’s not just this nice guy and that he can be tough,” said Kevin Geiken, a Democratic political consultant for Bluprint Strategies.

Still, it will be a challenge to rattle Mrs. Clinton, who has lurched to the left on issues like trade and the environment while showing a deft ability to repel criticism of her 2002 vote to authorize the Iraq war and her warm relationship with Wall Street.

One area on the domestic front that is likely to come up is the issue of criminal justice reform, which the three candidates have been struggling to address after continuing tension between the police and African-Americans.

DeRay Mckesson, a leader of the Black Lives Matter movement, said he had a good sense of the plans from Mr. Sanders and Mr. O’Malley, but had not heard a comprehensive proposal on the issue of criminal justice from Mrs. Clinton, despite her meetings with the group.

“She’s been eking it out literally one speech at a time,” Mr. McKesson said. “With Hillary, I only have a surface-level understanding. The debate is a chance to learn what she really thinks about the core issues.”

But voters will only learn if they tune in. Some political enthusiasts have complained that because of its Saturday night time slot, the two-hour debate, which will be hosted by CBS News and The Des Moines Register and begin at 9 p.m. Eastern time, may not have the audience of previous events that have drawn millions of viewers.

Mr. Anderson, the Iowa strategist, noted that the candidates would convene at the same time that the undefeated Iowa Hawkeyes take on the Minnesota Golden Gophers in college football.

“The majority of Iowans will be planning their day around that football game,” he said.",ALAN RAPPEPORT,The fight against global terrorism will take center stage after attacks in Paris that laid bare the kinds of threats the next American president will face.,Democratic Debate Has an Unplanned Theme: Terrorism,http://www.nytimes.com/2015/11/15/us/politics/democratic-debate-cbs.html,[u'racial issues'],"[u'Timothy Anderson', u'Lawrence Lessig', u""Martin O'Malley"", u'Hillary Rodham Clinton', u'Jim Webb', u'Brad Anderson', u'Bernie Sanders', u'Lincoln Chafee']",nyt,0.9148687153485446,"[{u'author_id': 8381, u'fullname': u'alan rappeport', u'primary_org': u'nyt'}]",2015-11-15 00:33:01,[u'Senate'],b770967da0ca9ceede7aa3742385563f,2015-11-15 01:00:52.953328
"
!--StartFragment-->
Jeb Bush has bought his struggling presidential campaign more time, even as Marco Rubio threatens to siphon off the financing that is the lifeblood of his 2016 aspirations.
The former Florida governor delivered a solid, issues-oriented performance Tuesday in the latest Republican debate, which calmed top Bush donors and bundlers who had become disenchanted with the direction of his campaign. Bush can't survive without the financial backing of his vast network of GOP insiders. Their support had wavered following Bush's disastrous showing in the previous debate 12 days earlier that included a bungled attempt to tear down Rubio.
""Everyone in Jeb World admitted that the third debate was a tough one, but he did very well this week,"" Jay Zeidman, a well-connected Bush donor from Houston, told the Washington Examiner on Friday. ""Raising money between the third and the fourth debates was certainly a challenge, but fortunately there was a short turn around.""

Read more on WashingtonExaminer.com

",,David M. Drucker,Bush donors eye Rubio,http://feeds.foxnews.com/~r/foxnews/politics/~3/fH-6kGS33_I/,[u'campaign_finance'],"[u'Marco Rubio', u'Jeb Bush']",fox,0.8441676514947335,"[{u'author_id': 24898, u'fullname': u'david m. drucker', u'primary_org': u'fox'}]",2015-11-15 08:08:48,"[u'Washington Examiner', u'GOP']",4122d8d022c41feaa7f26d65bb6b2f30,2015-11-15 17:00:27.186846
"



Democratic U.S. presidential candidates Senator Bernie Sanders (L), former Secretary of State Hillary Clinton and former Maryland Governor Martin O'Malley pose on stage ahead of the second official 2016 U.S. Democratic presidential candidates debate in Des Moines, Iowa, November 14, 2015.   (REUTERS/Jim Young)


Hillary Clinton was put on the defensive at the opening of Saturday night’s Democratic presidential debate over military interventions she backed in countries now gripped by instability.
The debate in Des Moines, Iowa, came in the wake of the Paris terror attacks, which thrust the issues of national security and foreign policy back to the center of the 2016 campaign. The debate format was changed to focus anew on those issues.
But, citing the chaos in the Middle East and North Africa, Clinton’s rivals criticized her Senate vote for use of force before the Iraq war and appeared to criticize her support for toppling Libyan dictator Muammar Qaddafi.
Former Maryland Gov. Martin O’Malley said America’s role is not to roam the world “looking for new dictators to topple.”
He said it is also important to understand “secondary and third consequences” that come after removing a “single dictator.” O’Malley called Libya, Syria and other countries in the region a “mess.”

Clinton defended her support for toppling Qaddafi, saying he was threatening a “genocide” and America’s European and Arab allies asked for U.S. support.
She also said “it is imperative” that the U.S. do more to confront the “arc of instability” in the region. And to O’Malley’s critique, she said, “I don’t think you can paint with a broad brush,” and “This is an incredibly complicated region of the world.”
Vermont Sen. Bernie Sanders, meanwhile, referenced Clinton’s support for use of force in Iraq and said the “disastrous invasion” led “to the rise of Al Qaeda and to ISIS.”
Clinton again called her Iraq war vote a “mistake,” but disputed that the war is the only driver of modern terrorism.
The candidates also condemned the Paris terror attacks.
“Our prayers are with the people of France tonight, but that is not enough,” Clinton said.
She called for global “resolve” to “root out” the “radical jihadist ideology” that motivates groups like the Islamic State. Clinton, a former secretary of state, said she would coordinate efforts “against the scourge of terrorism.”
“It cannot be contained. It must be defeated,” she said of ISIS.
Sanders blasted ISIS as a “barbarous organization.”
O’Malley called this the “new face” of terror threats.
The attacks across multiple locations in Paris killed at least 129 people and wounded hundreds, officials said. 
In a primary race otherwise dominated by the economy, climate and front-runner Clinton’s personal record, the debate in Des Moines, Iowa, now is expected to focus heavily on security and foreign policy after debate host CBS News reworked the format.  
It is an area where Clinton, as former secretary of state, enters with the thickest resume – but also one that could prove problematic, given her involvement shaping the policies in increasingly unstable and chaotic nations like Libya and Syria.
Sanders, after appearing to give her a pass at the first debate over her personal email controversy, has in recent weeks shown a greater interest in criticizing her record. But his focus on issues like income inequality could be out of place in a discussion focused on global security challenges. Sanders’ campaign objected to some of the CBS News debate tweaks, sources said.
Clinton also enters this debate – hosted by CBS News, KCCI-TV and The Des Moines Register – facing a narrower field than at their first encounter in October. Since that debate, two candidates have dropped out, leaving only Sanders and O’Malley.
Clinton is seen to have otherwise strengthened her hand since that debate, making it through a lengthy hearing before the Benghazi congressional committee and seeing one of her biggest potential political threats – a late bid by Vice President Biden – disappear as the vice president announced he would not run.
Sanders remains Clinton’s biggest challenge, and has stirred an enthusiasm in the Democratic base that Clinton has struggled to evoke. But nationally and in Iowa, she continues to lead him by double digits in the polls.
Still, the FBI investigation over Clinton’s use of a personal email and server while secretary of state looms over her bid, with the probe said to be expanding. ",,,DEMOCRATIC DEBATE  2016 candidates condemn Paris attacks at opening,http://www.foxnews.com/politics/2015/11/14/democratic-2016-candidates-face-off-for-2nd-debate/,[u'foreign policy/national security'],"[u'Bernie Sanders', u'Muammar Qaddafi', u'Hillary Clinton', u""Martin O'Malley"", u'Jim Young']",fox,0.9318134445268402,[],2015-11-15 02:32:43,"[u'Senate', u'Al Qaeda', u'FBI']",1e6c60a4b3334c751ae09ef925cc938d,2015-11-15 03:00:05.529453
