body,byline,description,title,url,topics,people,org,election_confidence,authors,date_written,orgs,article_id,date_access
"



i




            Hillary Rodham Clinton makes a point as Bernie Sanders listens during a Democratic presidential primary debate on Saturday in Des Moines, Iowa.
            
            
                
                Charlie Neibergall/AP
                
            
hide caption


itoggle caption

        
        Charlie Neibergall/AP
        
    








Hillary Rodham Clinton makes a point as Bernie Sanders listens during a Democratic presidential primary debate on Saturday in Des Moines, Iowa.

            
            Charlie Neibergall/AP
            
        



The second Democratic debate was a subdued affair, where even the slights felt polite. Sanders and O'Malley attacked Clinton's record on foreign policy — especially her vote on the Iraq war — but when it came time to talk about how to fight the Islamic State, the separation felt a matter of semantics. ""This cannot be an American fight, although American leadership is essential,"" said Clinton. O'Malley said he disagreed: ""This is America's fight, but not America's alone."" We'll leave you with the two must-watch moments — a confrontation between Sanders and Clinton over campaign finance and Sanders cracks a joke about socialism: 
VIDEO: Martin O'Malley & Bernie Sanders hammer Hillary of her close ties to Wall Street #DemDebate https://t.co/Asvuvlak18— NowThis (@nowthisnews) November 15, 2015




Sanders 'not that much of a socialist compared to Eisenhower' https://t.co/GglqthV2EN via @washingtonpost— Revolving Skull (@RevolvingSkull) November 15, 2015



That's the quickie version of what happened in the second Democratic presidential debate of the 2016 race Saturday night. Our friends at It's All Politics have wall-to-wall coverage.
",,"The second Democratic debate was for the most part a subdued affair, where even the slights felt polite.",The Second Democratic Debate In 100 Words (And Two Video Clips),http://www.npr.org/sections/thetwo-way/2015/11/14/456070049/the-second-democratic-debate-in-100-words-and-two-video-clips,"[u'foreign policy/national security', u'campaign_finance']","[u'Hillary Rodham Clinton', u'Charlie Neibergall', u""Martin O'Malley"", u'Bernie Sanders']",npr,0.9303216382048379,"[{u'author_id': 1, u'fullname': u'eyder peralta', u'primary_org': u'npr'}]",2015-11-15 04:13:00,[],6a4c39d380a6a70435d43e8f35dc4e5d,2015-11-15 04:24:56.059787
"
GREENVILLE, S.C.–Sen. Ted Cruz brought his presidential campaign to an evangelical bastion here Saturday, travelling to a Christian college to hold a religious liberty rally that was shadowed by anxiety about the terrorist attacks in Paris.
Mr. Cruz opened the rally at Bob Jones University with a moment of silence for the victims of the attacks and called for a decisive response to the Islamic militants who claimed responsibility.
“This is an evil that will not quietly slip away,” Mr. Cruz said in his opening prayer. “We will defeat radical Islamic terrorism. This evil will no longer walk the face of the earth.”
The focus of the rally, however, was the threat to religious freedom that many conservatives see in the U.S., an issue that is central to the Cruz campaign effort to win over evangelical voters. He is reaching out to people who believe their right to act on their religious beliefs is threatened by government actions supporting such social changes as the legalization of gay marriage and limits on public religious worship.
At the rally, similar one Mr. Cruz held in Iowa in August, he shared the stage with Christians who think their religious rights were violated, such as Joe Kennedy– a high school football coach in Washington state who was placed on leave recently for kneeling in silent prayer on the field after games.
“What kind of country have we become when kneeling in prayer is regarded as an act of civil disobedience,” Mr. Cruzsaid. “These threats are real and they are growing each and every day.”
Mr. Cruz’s staff estimated that 2,500 people attended the rally at Bob Jones, a college that has a stirred controversy in the past for its treatment of blacks and gays. The school’s ban on interracial dating sparked criticism of George W. Bush when he campaigned here during the 2000 presidential campaign. That ban subsequently ended, and the college is reemerging as a destination for GOP presidential candidates seeking evangelical support.
One of Mr. Cruz’s leading rivals for support of evangelical voters, retired neurosurgeon Ben Carson, appeared on the campus Friday for a town hall meeting with South Carolina GOP Sen. Tim Scott.
The two presidential candidates provided the community with a study in contrast: Mr. Cruz gave a fiery, emotional speech that filled an auditorium; Mr. Carson was more measured and low key.
For some in the audience, the violence in Paris led them to focus more acutely on the candidates’ ability to lead in a world crisis and prosecute a war on terrorism. For Janessa Fortner, a Greenville Republican who is inclined to support businessman Donald Trump, those developments raised new reservations in her mind about the low key Mr. Carson.
“He’s not going to strike fear in ISIS,” Mrs. Fortner said. “Who would you want handling what happened last night?’’
______________________________________________________
2016 Election Calendar | WSJ/NBC Polls   | 2016 Poll Standings


Politics Alerts: Get email alerts on breaking news and big scoops. 

Capital Journal Daybreak Newsletter: Sign up to get the latest on politics, policy and defense delivered to your inbox every morning.
For the latest Washington news, follow @wsjpolitics
For outside analysis, follow @wsjthinktank",,"Sen. Ted Cruz brought his presidential campaign to an evangelical bastion Saturday, travelling to Bob Jones University, a Christian college, to hold a religious liberty rally that was shadowed by anxiety about the terrorist attacks in Paris.",Ted Cruz Courts S.C. Evangelicals in Shadow of Paris Attacks,http://blogs.wsj.com/washwire/2015/11/15/ted-cruz-courts-s-c-evangelicals-in-shadow-of-paris-attacks/,[u'foreign policy/national security'],"[u'Joe Kennedy', u'Tim Scott', u'Donald Trump', u'George W. Bush', u'Ben Carson', u'Ted Cruz']",wsj,0.9153790655532964,"[{u'author_id': 1060, u'fullname': u'wsj staff', u'primary_org': u'wsj'}]",2015-11-15 12:47:04,"[u'Capital Journal', u'WSJ', u'GREENVILLE', u'GOP']",2973ad857e9a6b7e05c9760ccd634739,2015-11-15 12:52:43.397740
"DES MOINES, Iowa (AP) â With the country still reeling from deadly terrorist attacks in Paris, Hillary Rodham Clinton cast herself as America's strongest leader in a scary world, even as she found herself forced to defend her own role during the rise of the Islamic State militants.
""This election is not only about electing a president, it's also about choosing our next commander in chief,"" Clinton declared Saturday night in the Democrats' second debate of the presidential campaign. ""All of the other issues we want to deal with depend upon us being secure and strong.""
Amid the backdrop of global anxiety, Clinton found herself fending off questions about not only her foreign policy record but her economic ties, with both Vermont Sen. Bernie Sanders and former Maryland Gov. Martin O'Malley painting the former senator from New York as a lackey for Wall Street and corporate interests.
""Let's not be naive about it,"" said Sanders, noting that Clinton collected millions in campaign donations from Wall Street bankers. ""They expect to get something. Everybody knows that.""
Clinton defended her relationship with Wall Street, citing her work in the aftermath of the Sept. 11, 2001, attacks, but her statement met with criticism from Republicans who accused her of politicizing the terrorist assaults.
The barbs marked a far more aggressive shift in a primary race that has so far been notable for its civility. Democrats have spent months boasting about the substantive tone of their contest, attempting to set up a favorable early contrast with the ""carnival barker"" insults of the crowded Republican primary.
Since the Democrats' first debate a month ago, Clinton has built a lead in the early voting states, gains that have come amid other signs the party is coalescing behind her. But the nomination fight is far from over.
Saturday night, Clinton faced criticism of her national security record, when Sanders traced the current instability in the Middle East to the U.S. Senate's vote â including Clinton's â to authorize military action in Iraq in 2002. He said that U.S. invasion ""unraveled the region.""
The former secretary of state fought back, saying terrorism has been erupting for decades, specifically mentioning the Sept. 11 attacks. She said the recent unrest in Libya and other parts of the Middle East is symptomatic of an ""arc of instability from North Africa to Afghanistan.""
She rejected the idea that she and the rest of the Obama administration underestimated the growing threat of the Islamic State.
The back-and-forth revealed a foreign policy split within the Democratic Party, with Sanders playing to the anti-war activists who boosted then-Illinois Sen. Barack Obama to victory in 2008.
Sanders argued for a far more hands-off approach, advocating for Muslim countries to lead the fight and declaring that the war against Islamic State militants is about the ""soul of Islam.""
Clinton has a history of advocating for more robust involvement across the globe â both as a presidential candidate eight years ago and as Obama's secretary of state. In recent weeks, she has called for a more aggressive U.S. role in the Syrian conflict, including a no-fly zone over the area, a move the Obama administration opposes. But she stood by her opposition to seeking a formal declaration of war against the Islamic State.
All the candidates denounced the attacks, and the debate began on a solemn note with a moment of silence followed by the previously unplanned foreign policy questions.
They gave some fodder to their Republican critics, who coupled condemnation of the Paris attacks during the day with sharp criticism for Obama and his former secretary of state, Clinton.
""We are at war with violent extremism, we are at war with people who use their religion for purposes of power and oppression,"" said Clinton, arguing the U.S. is not at war with Islam or all Muslims. ""I don't want us to be painting with too broad a brush.""
Sanders and O'Malley agreed with her sentiments, saying the term ""radical Islam"" used by Florida Sen. Marco Rubio and other Republican presidential candidates, is unnecessarily offensive to American Muslims.
Republicans immediately seized on the remarks. ""Yes, we are at war with radical Islamic terrorism,"" tweeted former Florida Gov. Jeb Bush.
The conversation later pivoted to economic issues, with the candidates tangling over how to pay for their plans to expand college affordability, family leave and prescription drug coverage.
The conversation revealed how Sanders' message has helped shift the party to the left on some economic issues.
All three agreed that wealthy citizens and corporations should pay more in taxes to benefit the middle class. They tangled over how high to increase the minimum wage, with Clinton backing a $12-per-hour federal floor while Sanders and O'Malley said $15 an hour â the rate being pushed by a campaign of fast-food workers and labor unions. And they fought over the degree to which they would curtail large financial institutions, with Sanders describing Wall Street's business model as ""greed and fraud"" â a startling judgment for a major presidential candidate.
""I'm not that much of a socialist compared to Eisenhower,"" joked Sanders, saying the former president backed a 90 percent marginal tax rate.
While Clinton is wary of alienating Sanders backers whose support she'll need should she win the nomination, she did take a few shots. She attempted to cast some of Sanders major proposals, including a single payer health care system and free college, as politically unrealistic.
""The revolution never came,"" she said, in a knock on his call for a ""political revolution."" ''I waited and I got the scars to show for it.""
Sanders may have inadvertently helped her in the first debate, when he seemed to dismiss the controversy over her use of a private email account and server by saying Americans are tired of hearing about her ""damn emails.""
Saturday night, Sanders declined once again to attack:  ""I am still sick and tired of Hillary Clinton's email,"" he said.
""I agree completely,"" said Clinton, with a laugh.
___
Lisa Lerer reported from Washington. Follow her on Twitter at: http://twitter.com/llerer",,"DES MOINES, Iowa (AP) — With the country still reeling from deadly terrorist attacks in Paris, Hillary Rodham Clinton cast herself as America's strongest leader in a scary world, even as she found herself forced to defend her own role during the rise of the Islamic State militants.","After attacks, Democrats debate terrorism and economy",http://hosted2.ap.org/APDEFAULT/89ae8247abe8493fae24405546e9a1aa/Article_2015-11-14-US--DEM%202016-Debate/id-54ff7d116dc141cc843a297b38ba3711,"[u'foreign policy/national security', u'economy']","[u""Martin O'Malley"", u'Jeb Bush', u'Hillary Clinton', u'Lisa Lerer', u'Hillary Rodham Clinton', u'Marco Rubio', u'Barack Obama', u'Bernie Sanders']",ap,0.9774191167849893,"[{u'author_id': 39735, u'fullname': u'lisa lerer', u'primary_org': u'ap'}, {u'author_id': 39392, u'fullname': u'ken thomas', u'primary_org': u'ap'}]",2015-11-14 23:50:00,"[u'Democratic Party', u'DES MOINES']",82cfbe849aee77092d0ed4de6cf95139,2015-11-15 05:00:04.607918
"BUENOS AIRES Nov 15 Argentina's ruling party
presidential candidate, Daniel Scioli, lagging in the opinion
polls, will have to win points in Sunday night's debate against
his business-friendly rival if he hopes to revive his campaign
in time to win the Nov. 22 election.
Scioli, the governor of Buenos Aires province, has been
endorsed by outgoing President Cristina Fernandez. Barred by law
from running for a third term this year, Fernandez will leave
her successor to deal with double-digit inflation, scant central
bank reserves and a widening fiscal deficit.
At 9 p.m. (midnight GMT), in the campaign's only televised
debate, Scioli will square off against Mauricio Macri, a
free-markets proponent who is leading the polls by about 8
percentage points after a stronger-than-expected performance in
last month's first round of voting.
Macri promises to spur investment by quickly dismantling
Fernandez's trade and currency controls. Scioli's message of
gradual change toward more orthodox policies while preserving
Fernandez's generous welfare programs has failed to catch fire
with the middle-class swing voters who will decide the election.
""Scioli has to use the debate to show he is independent from
Fernandez and that he has a plan for change, concentrating on
economic issued like inflation and employment,"" said local
pollster Mariel Fornoni. ""He already has Fernandez's supporters
locked in. So he has to concentrate on undecided voters.""
Fernandez is revered by Argentina's poor for having
strengthened the social safety net during her eight years in
power. But inflation sparked by her policy of printing pesos to
finance an ever-wider fiscal deficit has pumped up household
expenses for families across the political spectrum.
Fernandez may return as a presidential candidate in 2019.
She and Scioli have never been close and her statements of
support for him have been tepid. She has given stirring speeches
in support of the continuance of her policies, but usually
without mentioning Scioli by name.  

 (Reporting by Hugh Bronstein; Editing by Leslie Adler)",,"BUENOS AIRES, Nov 15 (Reuters) - Argentina's ruling party presidential candidate, Daniel Scioli, lagging in the opinion polls, will have to win points in Sunday night's debate against his...",Argentine presidential TV debate may be ruling party's last chance,http://feeds.reuters.com/~r/reuters/USdollarreportNews/~3/WQSFjruJTn4/story01.htm,"[u'trade', u'jobs/employment']","[u'Cristina Fernandez', u'Daniel Scioli', u'Leslie Adler', u'Mauricio Macri', u'Hugh Bronstein']",reuters,0.6093048329059878,"[{u'author_id': 33346, u'fullname': u'reuters editorial', u'primary_org': u'reuters'}]",2015-11-15 15:42:58,[],c39e1ee7e6ae8edffa31302ec118d484,2015-11-15 16:44:50.331329
