body,byline,description,title,url,topics,people,org,election_confidence,authors,date_written,orgs,article_id,date_access
"{""body"": ""\n2016\n\n                        Like the voters they hope to represent", the drug epidemic has touched them too.\n\n            By \n                    Jeff Greenfield\n\nNovember 12, 2015\n\n                Getty\nThree Republican candidates, three surprising, highly personal revelations\u2014all within days of each other. \nGov. Chris Christie, well-known for his in-your-face, confrontational style, riveted a town meeting in New Hampshire with a double-barreled story that recounted the death of his tobacco-addicted mother and the death of a law school friend from a prescription drug overdose.\nStory Continued Below\n \u201cWhen I sat there as the governor of New Jersey at his funeral, and looked across the pew at [my friend\u2019s] three daughters, sobbing because their dad is gone\u2014there but for the grace of God go I,\u201d he said. \u201cIt can happen to anyone. And so we need to start treating people in this country, not jailing them.\u201d\n The video of Christie was well on its way to viral status when Jeb Bush, whose family is famously resistant to personal revelations, sat down with the Huffington Post on his campaign bus in New Hampshire to talk about the most painful part of his life: his daughter\u2019s drug addiction. \u201cI visited her in jail. Never expected to see my beautiful daughter in jail,\u201d he said. \u201cShe went through hell.\u201d\nWithin a day, Sen. Ted Cruz, as polished a wordsmith as anyone in politics, was telling CNN\u2019s Jake Tapper about the crippling drug habit of his half-sister and his futile efforts to persuade her to leave a crack house. \u201cI sometimes found it hard to reconcile the bright, fun and charismatic sister I adored with the person who would lie to me without hesitation and who stole money from her teenage brother to feed her various addictions.\u201d\nListening to these candidates, it\u2019s hard to detect the strident moralizing of the party that gave us \u201cJust say no.\u201d The GOP\u2019s softening on drug addiction has quickly become one of the most striking themes of the 2016 campaign, even if it gets less attention than illegal immigration or repealing Obamacare. Suddenly, in a crowded and topsy-turvy primary season that seems to be rewarding outsiders who have torn up the political script, a number of Republicans are dispensing with the antiseptic bios and have found that voters are engaging with the messiest episodes of their lives.\nWhat\u2019s going on here? This is not a coincidence, or parallel \u201cmessaging.\u201d In fact, if you look under the hood, you\u2019ll find this is a convergence of important trends in both political style and demographics that could signal a rewrite of the American playbook on drugs and crime.\nViolent crime, the urban kind that fixated voters in the 80s and 90s has dropped precipitously. But at the very same time a wave of drug crime driven by prescription drugs and now heroin has swept into every corner of American society, respecting now geographic, social or political boundaries. Hollow-eyed addicts were suddenly just as much a feature of red state back roads as they were on the boulevards of big cities. Heroin use has climbed among all demographic groups, but it has skyrocketed among whites; nearly 90 percent of those who tried heroin for the first time in the last decade were white. \nAll this has changed the way GOP politicians are engaging with their voters. Multimillionaires like the ones who make up most of the presidential field might not have a lot in common economically with most voters, but when it comes to addiction they are discovering points of empathy with a wide cross section of the electorate. \n***\nRemember when FDR told America that he would beat the Depression the way he beat polio? Remember when JFK told us how he learned to endure pain during his ordeal in the Pacific and his life-threatening surgeries? Remember when Reagan talked of putting his alcoholic father to bed?\n Of course you don\u2019t\u2014because they never said those things. In earlier days (and Reagan was very much a product of earlier times) that\u2019s not how politicians talked. Today, a personal \u201cnarrative\u201d is as crucial an element of a campaign as a super-PAC and a micro-targeter. \n \u201cI see it as one of the more positive movements in our political culture,\u201d says longtime Republican consultant Stu Stevens, who is unworried about the possibility of artifice on the part of candidates, \u201cPeople have a good bullshit detector to pick up whether people are being sincere or not.\u201d\n Maybe the seeds were planted in Nixon\u2019s 1952 \u201cCheckers\u201d speech when he answered charges of financial misconduct with a detailed account of his assets and debts, including his wife\u2019s \u201cgood Republican cloth coat.\u201d Maybe it was fed by Jimmy Carter\u2019s intensely personal case for his candidacy\u2014the peanut farmer/evangelical who would never lie to us. Maybe Bill Clinton\u2019s 1992 acceptance speech blazed a path (\u201cI never knew my father\u201d). Or Al Gore\u2019s two vice-presidential acceptance speeches-one invoking his son\u2019s near-fatal auto accident, the other his sister\u2019s harrowing death from lung cancer. Maybe it was Bush the father painting himself as a risk-taking entrepreneur or Bush the son\u2019s story of his meeting with juvenile offenders, or guardedly acknowledging his own struggles with substance abuse.\n Whatever the sources, the need for prospective presidents to connect on a visceral, personal level is profound. And there\u2019s no more effective tool than recounting some personal travail. Indeed, when linked to the policy proposals that accompany such testimonials, they act as enhancers of credibility: I know what drugs can do because I have seen it firsthand.\n Christie\u2019s viral video notwithstanding, the effectiveness of these personal revelations is hard to measure. Christie has fallen to the second-tier debate and Bush remains mired in the single digits in many polls. But there is no sign that they, or the rest of the crowded GOP field, are going to stop sharing. And that might say more about the electorate than it does the candidates.\n There was a time when it was possible for Middle America to think of drugs as something that happened to \u201cthem\u201d\u2014to the black and brown urban poor. Today, there is no \u201cthem.\u201d Drugs are in Our Town, Pleasantville, Farmville. \n The evidence is in the statistics. Drug overdoses are the leading cause of \u201cinjury death\u201d among Americans\u2014greater than from motor vehicle crashes and firearms. And of those overdoses, more than half were from heroin or prescription drugs. Substance abuse is one key reason why the death rate among less educated white Americans has risen over the last several years. The evidence is also anecdotal: In January 2014, Vermont Gov. Peter Shumlin devoted his entire State of the State address to the epidemic of addiction in the Green Mountain State. \u201cThe time has come for us to stop quietly averting our eyes from the growing heroin addiction in our front yards,\u201d Shumlin said," \u201cwhile we fear and fight treatment facilities in our backyards.\u201d\n\nJeff Greenfield is a five-time Emmy-winning network television analyst and author.\nWHAT WORKS\nPolitics\n\n                    By \n                            Jason Zengerle\n\nThe Big Idea\n\n                    By \n                            POLITICO Magazine\n\n \u00a9 2015 POLITICO LLC"""," ""byline"": """""," ""description"": ""Like the voters they hope to represent"," the drug epidemic has touched them too."""," ""title"": ""Why the GOP Candidates Are Hooked on Addiction Stories"""," ""url"": ""http://www.politico.com/magazine/story/2015/11/gop-2016-candidates-drug-addiction-213352"""," ""topics"": [""campaign_finance""]"," ""people"": [""Chris Christie"""," ""Jeb Bush"""," ""Bill Clinton"""," ""Peter Shumlin"""," ""Jeff Greenfield"""," ""Jake Tapper"""," ""Jason Zengerle"""," ""Al Gore"""," ""Jimmy Carter"""," ""Ted Cruz""]"," ""orgs"": [""FDR"""," ""GOP""]"," ""election_confidence"": 0.929837790868098"," ""authors"": [{""author_id"": 33762"," ""fullname"": ""jeff greenfield"""," ""primary_org"": ""politico""}]"," ""date_written"": ""2015-11-12 23:23:14"""," ""org"": ""politico"""," ""article_id"": ""8cf8c20a106f2ea98a1ea4cfbb7d1590"""," ""date_access"": ""2015-11-12 23:46:25.680972""}",
"{""body"": ""Democratic presidential front-runner Hillary Clinton announced a $30 billion plan Thursday to help coal mining towns hit hard by the shift to less polluting sources of energy.\nRepublicans bashed Clinton in response \u2013 accusing her of backing policies that hurt coal country in the first place.\nClinton\u2019s proposal calls for building new roads", bridges, water system and airports in coal areas, expanding Internet access, and helping finance projects that promise new uses for abandoned coal mines.\nClinton said she\u2019d help school districts struggling from the loss of coal revenue. She pledged to guarantee pension and health benefits to coal miners and power plant workers whose companies go bankrupt.\n\u201cAs President, I will make sure our country honors our commitments to coal miners and their families, who gave their careers, their health, and in some cases their lives to powering America\u2019s economy,\u201d Clinton said in a written statement. \u201cAnd I will invest for the future, by increasing federal investment to revitalize coal communities and partnering with the private sector to promote locally-driven business development and job creation.\u201d\nCoal is losing its competition with the cheap and cleaner natural gas produced in abundance by America\u2019s fracking boom. The coal industry complains that environmental regulations have also hurt by increasing the costs of mining and burning coal.\n\nWe shouldn't expect a fix from someone who has been part of the problem all along Sergio Gor, spokesman for Sen. Rand Paul of Kentucky, who is running for the Republican nomination for president.\nCentral Appalachia has been hit especially hard by coal\u2019s struggles, with the number of coal jobs in eastern Kentucky plummeting by half in recent years.\n\u201cHillary Clinton will continue President Obama's failed environmental policies which are killing jobs and destroying communities across the nation,\u201d said Sergio Gor, spokesman for Sen. Rand Paul of Kentucky, who is running for the Republican nomination for president. \u201cWe shouldn't expect a fix from someone who has been part of the problem all along.\u201d\nRepublican National Committee spokesman Michael Short said \u201cif Hillary Clinton were truly on the side of coal country, she would stand up to extreme anti-energy environmentalists that run the Democrat Party instead of embracing their agenda that is killing jobs and driving up costs.\u201d\nCoal will be an issue in 2016 presidential campaign, largely because of the importance of the coal state of Ohio, which is a swing state that could go for a Democrat or a Republican. Clinton has pushed a clean energy and climate change agenda as she campaigns. \n\u201cBuilding a 21st century clean energy economy in the United States will create new jobs and industries, deliver important health benefits, and reduce carbon pollution,\u201d the Clinton campaign said. \u201cBut we can\u2019t ignore the impact this transition is already having on mining communities, or the threat it poses to the healthcare and retirement security of coalfield workers and their families.\u201d\nSean Cockerham: 202-383-6016," @seancockerham"""," ""byline"": """""," ""description"": ""Clinton pledges $30 billion in aid for coal areas\nRepublicans say Clinton supports anti-coal environmental policies\nWith coal state Ohio in play"," coal will be a campaign issue\n\u2026\nClick to Continue \u00bb"""," ""title"": ""Hillary Clinton promises to help suffering coal country"""," ""url"": ""http://www.mcclatchydc.com/news/politics-government/election/article44483976.html"""," ""topics"": [""environment/energy""]"," ""people"": [""Rand Paul"""," ""Sergio Gor"""," ""Michael Short"""," ""Hillary Clinton"""," ""Sean Cockerham""]"," ""orgs"": [""Democrat Party"""," ""Republican National Committee""]"," ""election_confidence"": 0.8135602155694774"," ""authors"": [{""author_id"": 33906"," ""fullname"": ""sean cockerham"""," ""primary_org"": ""mcclatchy""}]"," ""date_written"": ""2015-11-12 21:12:48"""," ""org"": ""mcclatchy"""," ""article_id"": ""02d46d0b3bbee3932fc1a00585489ab4"""," ""date_access"": ""2015-11-12 21:29:50.346493""}",
"{""body"": """""," ""byline"": """""," ""description"": ""Republican presidential candidate Donald Trump speaks about Dr. Ben Carson's childhood and his book. CNN's Erin Burnett has the exclusive interview."""," ""title"": ""Donald Trump: Ben Carson says he's pathological"""," ""url"": ""http://www.cnn.com/video/#/video/us/2015/11/13/donald-trump-ben-carson-pathological-intv-erin.cnn"""," ""topics"": [""personality"""," ""foreign policy/national security""]"," ""people"": [""Donald Trump"""," ""Erin Burnett"""," ""Ben Carson""]"," ""orgs"": []"," ""election_confidence"": 0.9257108961193793"," ""authors"": []"," ""date_written"": ""2015-11-13 01:20:03"""," ""org"": ""cnn"""," ""article_id"": ""f1cccd89913c13f9539c2c1cfa1c35f4"""," ""date_access"": ""2015-11-13 02:01:29.427948""}",
"{""body"": ""Four of the eight Republican presidential contenders in the prime-time debate on Tuesday were asked their views on raising the federal minimum wage.\n\nDonald Trump", who went first, set the tone when he said that the current minimum of $7.25 an hour was already too low when it took effect in 2009 and should be doubled.\n\nJust kidding!\n\nHere\u2019s what the candidates really said and why they\u2019re all wrong.\n\nMr. Trump said that American businesses can\u2019t compete because \u201cwages too high\u201d and, for that reason, he would keep the minimum wage where it is.\n\nIf American businesses can\u2019t compete \u2013 a dubious assertion in itself \u2013 it is not because wages are too high. Most working people can\u2019t remember their last raise. And the minimum wage is certainly not too high. Raising it to $12 an hour would simply bring it into line with historical wage-and-price benchmarks. Raising it to $15 an hour would bring it closer to where it would be if it had kept up in recent decades with productivity gains.\n\nAll of which makes a higher minimum wage, what\u2019s the word . . . fair? Sensible?\n\nBut in Mr. Trump\u2019s view, wages for low-paid workers in America are too high because they are higher than those in, say, Pakistan. If you take that thought to its logical conclusion, he is saying that if he were president, he would lead the nation in a race to the bottom with countries whose economies are built on poverty wages.\n\nBen Carson was off base, too. Earlier in the campaign, he said he favored increasing the minimum, to an unspecified amount. On Tuesday, he said he did not support raising the minimum, because \u201cevery time we raise the minimum wage, the number of jobless people increases.\u201d\n\nNo, it doesn\u2019t. To give just one example, the minimum wage was raised by nearly 12 percent in 1996 (to $4.75 an hour) and by another eight percent in 1997 (to $5.15). The late 1990s were a period of full employment and rising wages for everyone.\n\nThe question of whether a higher minimum wage leads to higher unemployment isn\u2019t one of those issues on which reasonable people disagree. It has been exhaustively studied, in theory and in real world conditions, since 1938, when the United States first enacted a minimum wage (at 25 cents an hour). The weight of evidence shows that increases in the minimum wage have lifted pay without hurting employment.\n\nMr. Carson also said that high unemployment among black teenagers was \u201cbecause of those high wages.\u201d Even for a teenager, $7.25 an hour is not a lot. Nor is $2.13 an hour, which is the federal minimum wage for tipped workers. Does he really want to let employers hire teenagers (and adults, for that matter) at wages that are not enough to provide pocket change, let alone cover real expenses, like getting back and forth to work?\n\nMarco Rubio was next, warning as he has for months that \u201cif you raise the minimum wage, you\u2019re going to make people more expensive than a machine. And that means all this automation that\u2019s replacing jobs and people right now is only going to be accelerated.\u201d\n\nPlaying on fears is not the hallmark of a leader. \u201cFear the robots\u201d is not an economic policy. Automation, by another name, is capital investment, and keeping wages low to discourage capital investment is a path to economic decline. It also ignores history, in which new technology has both replaced and created jobs.\n\nMr. Rubio went on to extol vocational training for welders as a way to lift wages. As if robots can\u2019t weld?\n\nThen there was John Kasich, who seemed to be trying to set himself apart from his scroogy opponents by noting that in Ohio, \u201cWe do have a moderate increase in the minimum wage.\u201d The minimum in Ohio is $8.10 an hour, except for employers grossing $283,000 a year or less, who can pay as little as $7.25 an hour.\n\nIf it wasn\u2019t so serious," it would be laughable."""," ""byline"": ""TERESA TRITCH"""," ""description"": ""Here\u2019s what the candidates said at the debate on Tuesday \u2014 and here are the facts."""," ""title"": ""Taking Note: Republicans Sound Off on the Minimum Wage"""," ""url"": ""http://takingnote.blogs.nytimes.com/2015/11/12/republicans-sound-off-on-the-minimum-wage/"""," ""topics"": [""jobs/employment""]"," ""people"": [""Donald Trump"""," ""Marco Rubio"""," ""Ben Carson"""," ""John Kasich""]"," ""orgs"": []"," ""election_confidence"": 0.8083537910154293"," ""authors"": [{""author_id"": 2728"," ""fullname"": ""teresa tritch"""," ""primary_org"": ""nyt""}]"," ""date_written"": ""2015-11-12 20:53:37"""," ""org"": ""nyt"""," ""article_id"": ""01fd6ecd05292172651b0f1d6742215a"""," ""date_access"": ""2015-11-12 21:44:49.772354""}",
"{""body"": """""," ""byline"": """""," ""description"": ""HILTON HEAD"," S.C.--The likes of John Kasich should take note: Marco Rubio believes that just because you\u2019re from an important swing state doesn\u2019t necessarily mean you are vice presidential running..."""," ""title"": ""Rubio talks veeps and swing states"""," ""url"": ""http://feeds.reuters.com/~r/reuters/blogs/talesfromthetrail/~3/qU6y3pqwes4/"""," ""topics"": [""personality""]"," ""people"": [""Marco Rubio"""," ""John Kasich""]"," ""orgs"": [""S.C.""]"," ""election_confidence"": 0.6495590115616325"," ""authors"": []"," ""date_written"": ""2015-11-12 19:04:33"""," ""org"": ""reuters"""," ""article_id"": ""68042b636ebf0165b4c9b7028c868f0d"""," ""date_access"": ""2015-11-12 19:48:48.215632""}",
"{""body"": ""Despite a month of sharpened attacks", Senator Bernie Sanders of Vermont has failed to significantly dent Hillary Rodham Clinton\u2019s lead in the Democratic presidential race, according to a New York Times/CBS News survey released on Thursday.\n\nMrs. Clinton has support from 52 percent of Democratic primary voters, while Mr. Sanders has backing from 33 percent, the poll found. In an early October CBS News poll, she led Mr. Sanders 56 percent to 32 percent.\n\nMr. Sanders, whose overarching challenge is to transform his left-wing, lesser-known candidacy into a formidable national campaign with broad appeal, will face his greatest test yet on Saturday night at the second Democratic debate, which will be televised nationally from Des Moines. Mrs. Clinton will take the stage after a run of positive developments since their Oct. 13 debate, including strong reviews of her performance there, Vice President Joseph R. Biden Jr.\u2019s decision not to enter the race, and a steely, well-received face-off with congressional Republicans investigating the 2012 attack on the United States diplomatic compound in Benghazi, Libya. \n\nMr. Sanders, in turn, has been drawing more contrasts with Mrs. Clinton\u2019s positions on trade, Social Security, the death penalty and marijuana legalization since the October debate, but his attacks have not been memorably effective.\n\nA third Democratic candidate, former Gov. Martin O\u2019Malley of Maryland, will also take part in Saturday\u2019s debate, but he is trailing far behind his rivals. He received 5 percent of the vote in the Times/CBS News poll.\n\nMr. Sanders and Mr. O\u2019Malley do appear to have room to grow if they can find a way, the poll found: Half of Democratic primary voters said it was still too early to say for sure who they would support.\n\nSanders supporters stand out as especially engaged with the presidential race. Fifty-four percent of them said they were paying a lot of attention to the campaign, compared with 38 percent of Mrs. Clinton\u2019s backers.\n\nBut Mrs. Clinton enjoys a firmer base of voters than Mr. Sanders, according to the poll. Fifty-four percent of her supporters said their minds were completely made up, while 58 percent of Mr. Sanders\u2019s supporters said they had not made a final decision.\n\nAnd 43 percent of Democrats said they would enthusiastically support Mrs. Clinton as their presidential nominee, compared to 35 percent for Mr. Sanders. Slim majorities of women, nonwhites and older voters said they would enthusiastically back Mrs. Clinton as the party\u2019s choice, while just three in 10 male Democrats said they would feel that way about her as their standard-bearer in 2016.\n\nA strong majority of Democratic primary voters say they are paying at least some attention to the presidential campaign; 26 percent of Democrats say they have not been paying much attention," compared with 11 percent of Republican primary voters.\n\nThe nationwide telephone poll was conducted Nov. 6 to 10 on cellphones and landlines with 418 Democratic primary voters. The margin of sampling error is plus or minus six percentage points. Additional findings from the full poll will be published on Thursday at 6:30 p.m."""," ""byline"": ""PATRICK HEALY and GIOVANNI RUSSONELLO"""," ""description"": ""Despite a month of sharpened attacks from Senator Bernie Sanders of Vermont", Mrs. Clinton has support from 52 percent of Democratic primary voters, according to a New York Times/CBS News survey released on Thursday," compared with Mr. Sanders\u2019s 33 percent."""," ""title"": ""First Draft: Poll Shows Hillary Clinton Maintaining Lead Over Bernie Sanders"""," ""url"": ""http://www.nytimes.com/politics/first-draft/2015/11/12/poll-shows-hillary-clinton-maintaining-lead-over-sanders/"""," ""topics"": [""personality"""," ""budget/taxation""]"," ""people"": [""Bernie Sanders"""," ""Joseph R. Biden Jr."""," ""Hillary Clinton"""," ""Martin O'Malley"""," ""Hillary Rodham Clinton""]"," ""orgs"": [""Social Security""]"," ""election_confidence"": 0.9295196373728521"," ""authors"": [{""author_id"": 586"," ""fullname"": ""patrick healy"""," ""primary_org"": ""nyt""}"," {""author_id"": 21573"," ""fullname"": ""giovanni russonello"""," ""primary_org"": ""npr""}]"," ""date_written"": ""2015-11-12 12:28:41"""," ""org"": ""nyt"""," ""article_id"": ""d9567f6867d45265d4f4fdfc11d01f30"""," ""date_access"": ""2015-11-12 13:01:42.494823""}",
