body,byline,description,title,url,topics,people,org,election_confidence,authors,date_written,orgs,article_id,date_access
"{""body"": "" (CNN)Donald Trump is pointing to a 1950s-era federal program as a possible model for his plan to deport 11 million undocumented immigrants"," insisting it can be done \""humanely.\""\nBut one expert who has studied \""Operation Wetback\"" said the program of then-President Dwight Eisenhower was deadly and cruel. \n\""It was not humane", it was a military style of operation,"\"" said Mae Ngai"," a professor of history at Columbia University. \""[Eisenhower] sent hundreds of border patrol officers to sweep up people.\""\n\""In many cases","\"" she added"," \""they basically herded people on to big trucks and dropped them off on the other side of the border.\"" \nTrump has said this week that he would use a \""deportation force\"" to carry out his plan and told reporters it would be done in a \""humane\"" way"," but he hasn't provided details. The real estate mogul said he has heard different things about how \""Operation Wetback\"" worked. \""I've heard good reports", I've heard bad reports,"\"" he told Fox host Bill O'Reilly on Wednesday night.\nBut Ngai said there's no doubt about the past program's harm or about the unworkability of Trump's plan.\n\""It's absolutely not possible","\"" she said. \""We're talking about 11 million people...You can't round up that many people -- I don't know how you could do it in a humane way"," it begs the imagination...This is just bluster on Trump's part.\"" \nRELATED: Trump promises 'deportation force'\nTrump didn't use the name of the program when he cited it in the GOP debate this week -- \""wetback\"" is a slur that was more widely used at the time than it is now.  \nUnder \""Operation Wetback","\"" Ngai said", raids began in Texas and southern California, but soon moved as far north as Chicago. Buses, trucks," trains and ships were used to transport immigrants back across the Mexico border.\n\""There was one infamous incident where 88 people died from heat stroke", because they were just left in 112-degree weather,"\"" said Ngai", the author of books," including \""Impossible Subjects: Illegal Aliens and the Making of Modern America","\"" and scholarly papers about immigration policy and the immigrant experience.\nThe government used boats designed to carry cargo to move immigrants from places like Galveston", Texas," to locations on Mexico's eastern shore. \n\""The ships weren't refurbished or fitted for this","\"" Ngai explained. When a riot erupted after a boat made a brief landing at a port en route to Mexico"," Congress launched an investigation.\nLawmakers would find that conditions on the \""penal hell ships","\"" as Ngai recounted the findings"," were similar to those on 18th-century slave ships. The deportation program lasted only a few months. \nAn immigrant \""panic\"" in the 1950s was sparked in large part by a program that offered Mexican laborers contracted", seasonal work in the U.S. But demand for the cheap labor exceeded the number of permitted legal entries and soon American businesses welcomed a second stream of uncontracted workers, Ngai said.\nThe actions of the growers, luring Mexican workers across the border," \""was an affront to the authority of the attorney general and the commissioner general of immigration","\"" she said. \""So 'Operation Wetback' was their response.\"" \nRELATED: Hillary Clinton faults Obama for strict deportation \n"""," ""byline"": """""," ""description"": """""," ""title"": ""Historian: Trump deportation plan 'absolutely not possible'"""," ""url"": ""http://www.cnn.com/2015/11/12/politics/donald-trump-deportation-force-eisenhower/index.html"""," ""topics"": [""immigration""]"," ""people"": [""Donald Trump"""," ""Hillary Clinton"""," ""Bill O'Reilly""]"," ""orgs"": [""GOP"""," ""Congress""]"," ""election_confidence"": 0.8001462528200675"," ""authors"": [{""author_id"": 44270"," ""fullname"": ""gregory krieg"""," ""primary_org"": ""cnn""}]"," ""date_written"": ""2015-11-12 20:15:22"""," ""org"": ""cnn"""," ""article_id"": ""d9a7a5c0b2c9f5def5d62c03451438d4"""," ""date_access"": ""2015-11-12 20:19:52.764352""}",
"{""body"": ""\n\n\n\ni\n\n\n\n\n            Ted Cruz's success is rooted in the idea that there's no such thing as too conservative", both inside electoral politics and in governing.\n            \n            \n                \n                Nati Harnik/AP\n                \n            \nhide caption\n\n\nitoggle caption\n\n        \n        Nati Harnik/AP\n        \n    \n\n\n\n\n\n\n\n\nTed Cruz's success is rooted in the idea that there's no such thing as too conservative, both inside electoral politics and in governing.\n\n            \n            Nati Harnik/AP\n            \n        \n\n\n\nThat the freshman senator from Texas had a good night on stage at the latest Republican debate surprises nobody anymore \u2014 Ted Cruz is poised, articulate and smart. He's gaining ground in the race for the Republican Presidential nomination, and he's positioning himself to capture supporters from Donald Trump or Ben Carson, should they falter. There's still a long way to go in this contest but Cruz and his campaign are well funded, well organized and confident in his ability to outlast and overtake his rivals. Cruz's success is rooted in the idea that there's no such thing as too conservative, both inside electoral politics and in governing. Or if need be, not governing \u2014 history's shown he's fine with shutting the federal government down if it helps him acquire leverage over the opposition, be it Democrat or Republican. And when he runs for office, nobody gets to the right of Ted Cruz. That's how he's won. The senator likes very much where he's positioned now. In most prior elections," he told NPR \""there has been a consensus moderate candidate early on and all the money gets behind that candidate.\"" Conservatives", on the other hand, are more plentiful," \""nobody has any money"," and we fight like cats and dogs.\"" \n\nThey're gonna spend millions ripping each other apart. To be honest", right now," the moderates are acting like conservatives usually do in a Republican primary.\n\n\nTed Cruz\n\n\n\""What's remarkable about this cycle is the entire situation is inverted","\"" Cruz said. He has enjoyed watching enjoyed watching candidates in the moderate wing of the party slug it out. \""They're gonna spend millions ripping each other apart. To be honest", right now, the moderates are acting like conservatives usually do in a Republican primary,"\"" he said. On the economy", immigration and Obamacare On the economic front, a President Cruz would abolish the IRS, institute a 10 percent flat tax across the board and retie the value of the dollar to the gold standard. The U.S. stopped trading gold for dollars in 1933 and while the supply of gold has grown, there isn't enough gold in the world to match the $18 trillion U.S GDP. The money supply, the availability of credit and the nation's economy would necessarily have to contract to match the supply of bullion. Nevertheless, Cruz says returning to the gold standard deserves serious consideration. If you look at most of the history of America, he said," \""we've had a gold standard. Including through some of the greatest economic booms known to mankind.\"" Unpredictability in the country's currency", he added," \""has a profoundly negative effect.\"" If elected president", Cruz would order the FBI and the Department of Justice to investigate Planned Parenthood for fraud. The Texas senator doesn't believe in climate change science and would veto any legislation that would raise taxes or fees to inhibit global warming. He would like to institute term limits for U. S. Supreme Court justices. He opposes any minimum wage increase. And he would deport the millions of undocumented immigrants in this country, all of them. \n\nYou know, my view on immigration is simple. Legal, good. Illegal," bad.\n\n\nTed Cruz\n\n\n\""You know", my view on immigration is simple,"\"" he said. \""Legal", good. Illegal, bad. ... You know, if you start from the proposition that rule of law matters," it answers a whole lot of questions.\"" In foreign policy"," Cruz is a hawk with limitations. He's less a \""boots on the ground\"" man than a \""bomb them from the skies\"" guy. He deplores the Obama administration's agreement to slow down Iran's nuclear capabilities and believes the next president will have to bomb. \""When the next president enters the White House", the odds are significant that he or she will encounter an Iran on the verge of having nuclear weapons,"\"" Cruz said. \""And it may be that the only option at the point to preventing Iran from having nuclear weapons is military force. And of course Cruz"," who was a catalyst in closing the federal government for two weeks in 2013 during the Showdown at the Obamacare Corral remains firmly against the Affordable Care Act. \""If I am elected president", mark my words, we will repeal every single word of Obamacare,"\"" he said. At war with the GOP establishment So what are the chances the Ted Cruz is the next Republican nominee for president? In the past", a rogue Republican senator at war with the leadership of his own party would have zero chance. But as if to demonstrate that we're not in Kansas anymore, Cruz's first radio spot emphasizes that the Texas senator is hated by the GOP establishment. In it, a young mother explains she voted for Cruz to keep America safe," stop the debt from growing and to keep her religious freedoms intact. \""The media and even some in his own party like Speaker John Boehner attacked Ted Cruz referring to him as a pain in the you know what","\"" the ad goes. \""Because of his bold actions fighting to keep the promises he made to me. That was the Ted Cruz I trust.\"" Among the Tea Party and other insurgent Republican voters that Cruz is courting", being made an object of ridicule by the leaders of your own party is something you want to advertise. In this world," moderates are squishy \""Republicans In Name Only\"" and right-wing true believers are the only Republican politicians that can be trusted to stand up and fight. \""There are a handful of consultants who relentlessly push what I call the Washington fallacy","\"" Cruz said. \""Which is that the way Republicans win a general election is to run in the middle. To run as Democrat light. Every time we do that"," we lose.\"" Cruz has assembled both an impressive campaign war chest and a solid network of state organizations across the South and Midwest. He's capturing both billionaire and Republican grass roots financial support. His strategy is to persevere and thrive while other candidates fall"," eventually emerging as the default favorite of Republican right. Cruz cites the millions of evangelicals in American \u2014 he says more than half of them didn't vote in 2012. \""I think I'm in the best position to energize and mobilize and inspire the millions of conservatives who've been staying home","\"" Cruz said. Super Tuesday comes early in this Republican primary", just 10 days after South Carolina. Georgia, Alabama, Virginia, Tennessee, Arkansas, Oklahoma and the big prize of Cruz's home Texas are among the conservative states that go to the polls. On Wednesday March 2, Ted Cruz is counting on the GOP race looking a lot different than the day before. And what of the other son of a Cuban immigrant, the Floridian who is also well positioned and a growing favorite with Republican voters? Cruz says he would be delighted if it came down to him and Marco Rubio," two quintessential American success stories writ large. He calls Rubio a \""friend\"" and \""fellow son of Cuban immigrants","\"" but said he still has the upper hand. \""I will say this. If the race becomes head to head. A battle between a clear conservative to a clear moderate", we win,"\"" Cruz said. A year ago no political pundits were predicting Donald Trump and Ben Carson would be leading the Republican field of presidential candidates. When it comes to this GOP race"," it seems it's the outsiders who've got the inside track.\n"""," ""byline"": """""," ""description"": ""\""The moderates are acting like conservatives usually do","\"" Cruz told NPR. The Texas senator is positioning himself to capture supporters from Donald Trump or Ben Carson"," should they falter."""," ""title"": ""As His Moderate Rivals Are 'Ripping Each Other Apart","' Ted Cruz Sees An In"""," ""url"": ""http://www.npr.org/2015/11/12/455765287/as-his-moderate-rivals-are-ripping-each-other-apart-ted-cruz-sees-an-in"""," ""topics"": [""immigration"""," ""health""]"," ""people"": [""Nati Harnik"""," ""Marco Rubio"""," ""Donald Trump"""," ""John Boehner"""," ""Ben Carson"""," ""Ted Cruz""]"," ""orgs"": [""Tea Party"""," ""FBI"""," ""IRS"""," ""GOP"""," ""Department of Justice""]"," ""election_confidence"": 0.9749132384756942"," ""authors"": [{""author_id"": 2954"," ""fullname"": ""wade goodwyn"""," ""primary_org"": ""npr""}]"," ""date_written"": ""2015-11-12 18:59:20"""," ""org"": ""npr"""," ""article_id"": ""17d658133a72eb424055bbe775b0cf4f"""," ""date_access"": ""2015-11-12 19:01:24.698439""}",
"{""body"": ""\n\n\n\n\n\n\nDonald Trump couldn't beat the team of Jimmy Fallon and Justin Timberlake.\nLast Saturday's Trump-hosted \""Saturday Night Live\"" averaged 9.3 million viewers"," according to final Nielsen figures released Thursday.\nNBC says it's the most-watched edition of \""SNL\"" since December 2013", when Fallon guest-hosted, joined by musical guest Timberlake. That broadcast drew 9.4 million viewers.\nTrump's appearance had been highly anticipated and sparked controversy in the aftermath of remarks made by the GOP presidential hopeful about Mexican immigrants. The show, which also featured musical guest Sia," was roundly panned by critics.\n"""," ""byline"": """""," ""description"": ""Donald Trump couldn't beat the team of Jimmy Fallon and Justin Timberlake."""," ""title"": ""Donald Trump's 'Saturday Night Live' episode draws 9.3 million viewers"""," ""url"": ""http://feeds.foxnews.com/~r/foxnews/entertainment/~3/4WrghT653mY/"""," ""topics"": [""immigration""]"," ""people"": [""Donald Trump"""," ""Justin Timberlake"""," ""Jimmy Fallon""]"," ""orgs"": [""SNL"""," ""GOP""]"," ""election_confidence"": 0.6348394965909439"," ""authors"": []"," ""date_written"": ""2015-11-12 19:26:21"""," ""org"": ""fox"""," ""article_id"": ""3ab00b17cc9d6efd97ac8310a4d51785"""," ""date_access"": ""2015-11-12 20:00:12.796397""}",
"{""body"": """""," ""byline"": """""," ""description"": ""Candidate provides insight into plan"""," ""title"": ""Trump: Deportation will be done in a very humane fashion"""," ""url"": ""http://feeds.foxnews.com/~r/foxnews/video/~3/FJKajrQHk0w/"""," ""topics"": [""immigration"""," ""personality""]"," ""people"": []"," ""orgs"": []"," ""election_confidence"": 0.6262595605892953"," ""authors"": []"," ""date_written"": ""2015-11-13 00:01:57"""," ""org"": ""fox"""," ""article_id"": ""8c2e24ca3cda68be33a93fe258043800"""," ""date_access"": ""2015-11-13 01:00:38.528696""}",
"{""body"": "" (AP) \u00e2\u0080\u0094 Republican presidential candidate Ted Cruz says he wants to do away with government support for the sugar industry \u00e2\u0080\u0094 a veiled dig at rival Marco Rubio", the Florida senator who has long supported sugar growers.\nSome conservatives like Cruz want to get rid of the program, which supports prices and protects growers from foreign competition. But sugar supports have for decades been unassailable in Congress, partly due to wide bipartisan support from lawmakers representing states from Florida to North Dakota that grow sugar cane and sugar beets.\nIn Tuesday night's GOP debate," Cruz listed assistance for sugar as among government programs he'd like to eliminate to allow more spending for the military.\n\""Among them are corporate welfare", like sugar subsidies,"\"" said the Texas senator. \""Let's take that as an example. Sugar subsidies. Sugar farmers farm under roughly 0.2 percent of the farmland in America"," and yet they give 40 percent of the lobbying money.\"" On Wednesday", Cruz spokeswoman Catherine Frazier clarified that Cruz meant 40 percent of crop industries' total lobbying expenditures.\nU.S. assistance to sugar growers is not really direct subsidies \u00e2\u0080\u0094 unlike some other agricultural commodities. The government does not offer cash payments to processors and growers. Instead, it props up prices through loans, limits the amount domestic processors can sell and restricts sugar imports.\nRubio, who has received campaign donations from the sugar industry, has consistently voted to maintain the sugar program. On Wednesday," he told ABC's \""Good Morning America\"" that he supports getting rid of sugar supports"," but only if countries that export sugar to the United States also get rid of their government sugar aid. The sugar industry has made a similar argument.\n\""I'm not going to wipe out an American industry that happens to have a lot of workers in Florida by unilaterally disarming","\"" Rubio said.\nBut another Republican candidate", former Florida Gov. Jeb Bush, has distanced himself from sugar producers as some conservative groups have focused on overhauling the program," calling it \""crony capitalism.\"" A Bush spokeswoman", Kristy Campbell," said Wednesday that Bush supports phasing out the sugar program.\n\""Gov. Bush believes we should constantly be moving to reduce government interference and create a level playing field for all commodities on the world market","\"" she said.\nIn 2014", the sugar industry spent almost $10 million on lobbying, according to the Center for Responsive Politics. The group's calculations show the industry contributed more than $5 million to congressional candidates during the 2014 campaign cycle, split almost evenly between Republicans and Democrats.\nWhen Frazier clarified Cruz's remark about lobbying expenditures, she cited a 2014 Heritage Foundation report. It's unclear how that report calculated the numbers, but the Center for Responsive Politics puts the percentage of sugar industry lobbying dollars closer to 8 percent of all agribusiness lobbying dollars so far this year.\nStill, the sugar industry's influence is undeniable.\nCongressional votes to reform or do away with the program have consistently failed. A 2013 amendment to the farm bill in the Senate to scale back the program garnered 45 votes, with many of the most conservative Republicans voting with Democrats to maintain the status quo. While sugar cane produces jobs in Florida, Louisiana and even Cruz's home state of Texas, sugar beets are grown and create jobs in at least 14 states," many in the Great Plains and the northern tier of the country.\n\""The bipartisan efforts in Congress to reform this program have been undermined by the sugar industry which doesn't want to give up these generous taxpayer subsidies","\"" said Sen. Jeanne Shaheen", a New Hampshire Democrat who sponsored the 2013 amendment.\nSome of the most ardent opponents have been candy companies, who see the prices they pay for domestic sugar inflated by the program. Members of Congress from Illinois, home to Wrigley and other candy companies, and Pennsylvania, home to Hershey, have fought for years to overhaul the program.\nJennifer Cummings, a spokeswoman for The Coalition for Sugar Reform, an alliance of candy companies, and other food industries and taxpayer watchdog organizations," says they believe there is momentum building for reform.\n\""America should be a leader on this issue and we shouldn't wait for other countries to reform their subsidies","\"" she says.\n___\nFind Mary Clare Jalonick on Twitter: """," ""byline"": """""," ""description"": ""WASHINGTON (AP) \u2014 Republican presidential candidate Ted Cruz says he wants to do away with government support for the sugar industry \u2014 a veiled dig at rival Marco Rubio"," the Florida senator who has long supported sugar growers."""," ""title"": ""Sugar program draws Cruz's ire"," remains popular in Congress"""," ""url"": ""http://hosted2.ap.org/APDEFAULT/89ae8247abe8493fae24405546e9a1aa/Article_2015-11-12-US--GOP%202016-Sugar/id-08a1061d0e5a4144ac113d6039bb41af"""," ""topics"": [""foreign policy/national security"""," ""campaign_finance""]"," ""people"": [""Catherine Frazier"""," ""Kristy Campbell"""," ""Mary Clare Jalonick"""," ""Jeb Bush"""," ""Jeanne Shaheen"""," ""Marco Rubio"""," ""Ted Cruz""]"," ""orgs"": [""Senate"""," ""Heritage Foundation"""," ""Congress"""," ""Center for Responsive Politics""]"," ""election_confidence"": 0.9519732218017437"," ""authors"": [{""author_id"": 39409"," ""fullname"": ""mary clare jalonick"""," ""primary_org"": ""ap""}]"," ""date_written"": ""2015-11-12 09:22:00"""," ""org"": ""ap"""," ""article_id"": ""b9f10d77533467a6e4b91da57ae779d9"""," ""date_access"": ""2015-11-12 15:00:06.031664""}",
"{""body"": """""," ""byline"": """""," ""description"": ""Republican presidential candidate Rick Santorum joins the crowded field competing in the New Hampshire primary. Rough Cut (no reporter narration)"""," ""title"": ""Republican Santorum files for New Hampshire primary"""," ""url"": ""http://feeds.reuters.com/~r/reuters/USVideoTopNews/~3/TQo55V6II84/story01.htm"""," ""topics"": []"," ""people"": [""Rick Santorum""]"," ""orgs"": []"," ""election_confidence"": 0.8377276715194434"," ""authors"": []"," ""date_written"": ""2015-11-12 18:55:00"""," ""org"": ""reuters"""," ""article_id"": ""1a776c98f99acada4eb4a942b3d5ed59"""," ""date_access"": ""2015-11-12 23:11:41.755105""}",
"{""body"": ""WASHINGTONU.S. President Barack Obama said on Thursday Republican presidential candidate Donald Trump's plan for mass deportation of illegal immigrants is unrealistic.\n\""The notion that we're gonna deport 11", 12 million people from this country - first of all, I have no idea where Mr. Trump thinks the money\u2019s gonna come from. It would cost us hundreds of billions of dollars to execute that,\u201d Obama said in a White House interview with ABC News," according to excerpts released by the network.\n\""Imagine the images on the screen flashed around the world as we were dragging parents away from their children", and putting them in what, detention centers, and then systematically sending them out,"\"" the president said. \u201cNobody thinks that is realistic. But more importantly"," that\u2019s not who we are as Americans.\""\nTrump", a real estate billionaire who has been leading in opinion polls among candidates for the Republican nomination in the 2016 election, calls for building a wall along the U.S. border with Mexico and deporting all illegal immigrants.\nThe immigration issue has driven a wedge between Hispanics, a voting bloc with increasing clout, and Republicans, many of whom take a hard line on illegal immigration," to the benefit of Obama's fellow Democrats. Most of the estimated 11 million illegal immigrants are Hispanic.\nObama said there has always been a streak of anti-immigrant sentiment in the United States. \""We don\u2019t want", I think, a president or any person in a position of leadership to play on those kinds of fears,"\"" he told ABC.\n\n (Reporting by Mohammad Zargham; Editing by Chris Reese)"""," ""byline"": """""," ""description"": ""WASHINGTON (Reuters) - U.S. President Barack Obama said on Thursday Republican presidential candidate Donald Trump's plan for mass deportation of illegal immigrants is unrealistic."""," ""title"": ""Obama says Trump's plan to deport illegal immigrants is unrealistic: ABC"""," ""url"": ""http://feeds.reuters.com/~r/Reuters/PoliticsNews/~3/7TBm3n3z-dE/story01.htm"""," ""topics"": [""immigration""]"," ""people"": [""Donald Trump"""," ""Mohammad Zargham"""," ""Chris Reese"""," ""Barack Obama""]"," ""orgs"": [""United States.""]"," ""election_confidence"": 0.8272852255750114"," ""authors"": [{""author_id"": 33346"," ""fullname"": ""reuters editorial"""," ""primary_org"": ""reuters""}]"," ""date_written"": ""2015-11-12 23:48:50"""," ""org"": ""reuters"""," ""article_id"": ""8fb64f04e1840998a09be466a81f5d84"""," ""date_access"": ""2015-11-13 00:04:49.592042""}",
