body,byline,description,title,url,topics,people,org,election_confidence,authors,date_written,orgs,article_id,date_access
" (AP) â The bloody attacks in Paris are putting the Syrian refugee crisis at center stage in U.S. politics as migrants from that war-torn country surge toward the West and security concerns rise.
GOP presidential contender Marco Rubio on Sunday said the United States should no longer accept Syrian refugees because it's impossible to know whether they have links to Islamic militants â an apparent shift from earlier statements in which he left open the prospects of migrants being admitted with proper vetting.
""It's not that we don't want to, it's that we can't,"" Rubio said Sunday on ABC's ""This Week.""  ""Because there's no way to background check someone that's coming from Syria.  Who do you call and do a background check on them?""
The question of admitting Syrian refugees has for months been part of the national security discussion among 2016 candidates that cuts to the heart of the American identity as a refuge. Former Florida governor Jeb Bush on Sunday told NBC's ""Meet the Press"" that the U.S. should admit Syrian Christians, after proper vetting. Other Republican candidates have called for a ban on allowing Syrians into the U.S. All three Democratic presidential candidates have said they would admit Syrians but only after thorough background checks.
But Friday night's mass killings in Paris, which left at least 129 people dead, offered evidence that may have backed up what many, including Rubio, had been warning: People with secret ties to Islamic militants could flow across borders as part of waves of refugees.
Authorities said a Syrian passport found near one of the Paris attackers that had been registered last month and traveled through three countries along a busy migrant corridor known for lax controls. It was not clear whether the document was real or forged. Officials on Sunday were still trying to identify people involved in the conspiracy. They said as many as three of the seven suicide bombers who died in the attacks were French citizens.
A spokesman for President Barack Obama said Sunday that the administration is moving forward with its plan to thoroughly vet and admit as many as 10,000 Syrian refugees.
""What we need to be able to do frankly is sort out that foreign fighter flow, those who have gone into Syria and come out and want to launch attacks or those people who have connections with ISIL in Syria,""  Deputy National Security Adviser Ben Rhodes said on Fox News Sunday. ""At the same time, we have to recognize there's tragic victims of this conflict, there are women, and children, orphans of this war and I think we need to do our part, along with our allies, to provide them a safe haven.""
The Paris attacks have elevated national security in the presidential contest. In Saturday night's Democratic presidential debate, which began with a moment of silence for the Paris victims, all three candidates â former secretary of state Hillary Rodham Clinton, Sen. Bernie Sanders and former Maryland Gov. Martin O'Malley â said the U.S. should admit far more than the 10,000 Syrians to which Obama has committed, but only with proper screening.
Rubio on Sunday said that was impossible.
""You can't pick up the phone and call Syria, and that's one of the reasons why I said we won't be able to take more refugees,"" Rubio said on ABC.
That is a switch from Rubio's other statements this fall, in which he voiced skepticism about proper vetting but still left the door open to admitting refugees.  In September, he told Boston Herald radio: ""We've always been a country that's been willing to accept people who have been displaced. And I would be open to that if it can do it in a way that allows us to ensure that among them are not infiltrated, people who are part of a terrorist organization.""
Former Florida Gov. Jeb Bush, meanwhile, said Sunday that the U.S. has a responsibility to ""help with refugees after proper screening.""
""And I think or focus out to be on the Christians who have no place in Syria anymore,"" he added in NBC's ""Meet the Press."" ''They're being beheaded, they're being executed by both sides.  And I think we have a responsibility to help.""
___
Follow Laurie Kellman on Twitter at: ",,WASHINGTON (AP) — The bloody attacks in Paris are putting the Syrian refugee crisis at center stage in U.S. politics as migrants from that war-torn country surge toward the West and security concerns rise.,Syrian refugee policy takes focus in US 2016 politics,http://hosted2.ap.org/APDEFAULT/89ae8247abe8493fae24405546e9a1aa/Article_2015-11-15-US--Campaign%202016-Syrian%20Refugees/id-6577eaaceeab47519d098645fc98804f,[u'foreign policy/national security'],"[u""Martin O'Malley"", u'Jeb Bush', u'Hillary Rodham Clinton', u'Marco Rubio', u'Barack Obama', u'Bernie Sanders', u'Laurie Kellman']",ap,0.5993125329466457,"[{u'author_id': 40901, u'fullname': u'laurie kellman', u'primary_org': u'ap'}]",2015-11-15 16:01:00,[u'Deputy National Security Adviser'],c7fb4108635fc77c265d05049df0b1d3,2015-11-15 22:00:05.561503
"Republican presidential candidates have criticized Democratic White House hopeful Hillary Clinton for decliningÂ to use term such as âradical Islam” and “Islamic terrorism”Â to describe the extremists who have unleashed a string of terrorist attacks on Western targets recently.
Asked at the second Democratic debate on Saturday night whether the U.S. was âat war with radical Islam,â Ms. Clinton drew a distinction between the worldâs 1.6 billion Muslims and those who commit acts of violent extremism.
âI donât think weâre at war with Islam. I donât think weâre at war with all Muslims,â she said. âI think weâre at war with jihadists. We are at war with violent extremism. We are at war with people who use their religion for purposes of power and oppression, and yes, we are at war with those people, but I donât want us to be painting with too broad a brush.â
She recounted admiringly former president George W. Bushâs call forÂ tolerance in the aftermath of the Sept. 11, 2001 terrorist attacks.
âIslam is peace,â Mr. Bush said in a speech at the Islamic Center of Washington, D.C. the week after the attacks.
Mrs. Clinton’sÂ answer prompted reproach from Republicans who insisted she use the phrase, âradical Islam.â
Former Arkansas governor and Republican presidential candidate Mike Huckabee on Twitter mocked Democrats, writing âSay it with me: âIslamic Terrorism.ââ Carly Fiorina wrote on Twitter that unlike Hillary Clinton, she would use the phrase âIslamic terrorism.â
You’re all grown up now. You can do it. Three words. Ten syllables. Say it with me: “Radical Islamic terrorism.” #DemDebate
â Gov. Mike Huckabee (@GovMikeHuckabee) November 15, 2015

We need a President who will see and speak and act on the truth…Hillary Clinton will not call this Islamic terrorism. I will.
â Carly Fiorina (@CarlyFiorina) November 15, 2015

On Sunday morning, Republican Florida Sen. Marco Rubio, who has put an aggressive foreign policy at the center of his presidential campaign, called the fight against terrorism âa clash of civilizationsâ and said he was baffled by Ms. Clintonâs reluctance to use the term âradical Islam.â
âI donât understand it. That would be like saying we werenât at war with Nazis, because we were afraid to offend some Germans who may have been members of the Nazi Party but werenât violent themselves,â he said. âWe are at war with radical Islam, with an interpretation of Islam by a significant number of people around the world, who they believe now justifies them in killing those who donât agree with their ideology.â
And on CNN on Sunday morning, Former Florida governor and Republican presidential candidate Jeb Bush said, âI know what Islamic terrorism is. This is not a question of religion. This is a political ideology that has co-opted a religion. And I think it’s more than acceptable just to call it for what it is and then organize an effort to destroy it.â
He also described the fight against terrorism as âa fight for Western civilization.â
About 1% of the U.S. population are Muslims, according to the Pew Research Center.Â About 26% are evangelical Protestants, a group who hold considerably influence among the GOP primary electorate in the early nominating states of Iowa and South Carolina.
______________________________________________________
2016 Election Calendar | WSJ/NBC Polls   | 2016 Poll Standings


Politics Alerts: Get email alerts on breaking news and big scoops. 

Capital Journal Daybreak Newsletter: Sign up to get the latest on politics, policy and defense delivered to your inbox every morning.
For the latest Washington news, follow @wsjpolitics
For outside analysis, follow @wsjthinktank",,"Republican presidential candidates have criticized Democratic White House hopeful Hillary Clinton for declining to use term such as “radical Islam"" and ""Islamic terrorism"" to describe the extremists who have unleashed a string of terrorist attacks on Western targets recently.",GOP Candidates Fault Hillary Clinton For Declining to Use Phrase ‘Radical Islam’,http://blogs.wsj.com/washwire/2015/11/15/gop-candidates-demand-hillary-clinton-use-phrase-radical-islam/,[u'foreign policy/national security'],"[u'Mike Huckabee', u'Marco Rubio', u'Jeb Bush', u'Carly Fiorina', u'Hillary Clinton']",wsj,0.9898823157673136,"[{u'author_id': 34144, u'fullname': u'anna louie sussman', u'primary_org': u'wsj'}]",2015-11-15 20:15:50,"[u'Capital Journal', u'WSJ', u'Democratic White House', u'Pew Research Center', u'GOP']",17923d3aa29dbbe159e610fb3fc7ab78,2015-11-15 20:59:26.868660
" (AP) â A day after deadly terrorist attacks in Paris, Hillary Rodham Clinton cast herself as the strongest U.S. commander in chief in an uncertain world, even as she found herself forced to defend the Obama administration's response to the rise of the Islamic State militants.
""This election is not only about electing a president, it's also about choosing our next commander in chief,"" said Clinton, in her opening remarks. ""All of the other issues we want to deal with depend upon us being secure and strong.""
But she nearly immediately faced criticism of her own record, when Vermont Sen. Bernie Sanders traced the current instability in the region to the Senate vote â including Clinton's â to authorize military action in Iraq in 2002. He said that U.S. invasion ""unraveled the region.""
Clinton fought back, saying terrorism has been erupting for decades, specifically mentioning the Sept. 11, 2001, attacks. She said the recent unrest in Libya and other parts of the Middle East was symptomatic of an ""arc of instability from North Africa to Afghanistan.""
She rejected the idea that she and the rest of the administration underestimated the growing threat of the Islamic State.
The early dispute revealed a foreign policy split within the Democratic Party, with Sanders playing to the anti-war activists who boosted then-Illinois Sen. Barack Obama to victory in 2008.
Sanders argued for a far more hands-off approach, advocating for Muslim countries to lead the fight and arguing that the war against Islamic State militants is about the ""soul of Islam.""
Clinton has a history of advocating for more robust involvement across the globe â both as a presidential candidate eight years ago and as Barack Obama's secretary of state. In recent weeks, she has advocated for a more aggressive U.S. role in the Syrian conflict, calling for a no-fly zone over the area, a move the Obama administration opposes.
The candidates were meeting in the shadow of the Paris attacks that killed at least 129 and wounded at least 352 people.
The debate began with a solemn tone, with a moment of silence followed by previously unplanned foreign policy questions.
All the candidates denounced the attacks, the first time the Democratic field spoke about the incidents.
The Republican presidential candidates condemned the Paris attacks earlier in the day, coupled with sharp criticism for Obama and his former secretary of state, Clinton.
Former technology executive Carly Fiorina said she was angry that Obama and Clinton declared victory in Iraq and ""abandoned all of our hard-won gains for political expediency."" Donald Trump, the celebrity businessman who leads many GOP polls, said the U.S. should be far more aggressive against the Islamic State and would be ""insane"" to accept any refugees from Syria.
Foreign relations is an area where Clinton, as a former secretary of state, is in the strongest position to talk about the attacks and the U.S. effort to dismantle the Islamic State group. But she is vulnerable, too, her tenure tied to that of Obama, who's struggled to contain the threat from Islamic militants in Syria and associated terror attacks across the globe.
Since the party's first debate a month ago, Clinton has helped build a lead in the early voting states, an uptick that has come amid other signs the party is coalescing behind her. An Associated Press survey of superdelegates published Friday found that half of the Democratic insiders are publicly backing Clinton.
___
Follow Lisa Lerer on Twitter at: http://twitter.com/llerer",,"WASHINGTON (AP) — A day after deadly terrorist attacks in Paris, Hillary Rodham Clinton cast herself as the strongest U.S. commander in chief in an uncertain world, even as she found herself forced to defend the Obama administration's response to the rise of the Islamic State militants.","Clinton, Sanders debate foreign policy after Paris attacks",http://hosted2.ap.org/APDEFAULT/3d281c11a96b4ad082fe88aa0db04305/Article_2015-11-14-US-DEM-2016-Debate/id-4079ead9676848da9fe71cb04c911dfa,[u'foreign policy/national security'],"[u'Lisa Lerer', u'Donald Trump', u'Hillary Rodham Clinton', u'Barack Obama', u'Bernie Sanders', u'Carly Fiorina']",ap,0.9411901882650927,"[{u'author_id': 39735, u'fullname': u'lisa lerer', u'primary_org': u'ap'}]",2015-11-14 21:41:00,"[u'Senate', u'Democratic Party', u'GOP']",3d3f8d73e4699bc72fc84a9133b79fa5,2015-11-15 03:00:03.348668
" (AP) â A day after deadly terrorist attacks in Paris, Hillary Rodham Clinton cast herself as the country's strongest commander in chief in a scary world, even as she defended her own role in the rise of Islamic militants.
""This election is not only about electing a president, it's also about choosing our next commander in chief,"" Clinton declared Saturday night in the Democrats' second debate of the presidential campaign. ""All of the other issues we want to deal with depend upon us being secure and strong.""
Amid the backdrop of global anxiety, Clinton found herself fending off questions about not only her foreign policy record but her economic ties, with both Vermont Sen. Bernie Sanders and former Maryland Gov. Martin O'Malley painting the former senator from New York as a lackey for Wall Street and corporate interests.
""Let's not be naive about it,"" said Sanders, noting that Clinton collected millions in campaign donations from Wall Street bankers. ""They expect to get something. Everybody knows that.""
The barbs marked a far more aggressive shift in a primary race that has been notable in part for its civility compared to the Republican contest.
Since the Democrats' first debate a month ago, Clinton has built a lead in the early voting states, gains that have come amid other signs the party is coalescing behind her. But the nomination fight is far from over.
On Saturday night, Clinton faced criticism of her national security record, when Sanders traced the current instability in the Middle East to the U.S. Senate's vote â including Clinton's â to authorize military action in Iraq in 2002. He said that U.S. invasion ""unraveled the region.""
The former secretary of state fought back, saying terrorism has been erupting for decades. She rejected the idea that she and the rest of the Obama administration underestimated the growing threat of the Islamic State group.
The back-and-forth revealed a foreign policy split within the Democratic Party, with Sanders playing to the anti-war activists who boosted then-Illinois Sen. Barack Obama to the presidential nomination in 2008.
Sanders argued for a far more hands-off approach, advocating for Muslim countries to lead the fight and declaring that the war against Islamic State militants is about the ""soul of Islam.""
Clinton has a history of advocating for more robust involvement across the globe â both as a presidential candidate eight years ago and as Obama's secretary of state. In recent weeks, she has called for a more aggressive U.S. role in the Syrian conflict, including a no-fly zone over the area, a move the Obama administration opposes.
The debate began with a moment of silence followed by the previously unplanned foreign policy questions. All the candidates denounced the attacks, but they gave some fodder to their Republican rivals who coupled condemnation of the Paris attacks with sharp criticism for Obama and Clinton.
All three Democrats criticized the term ""radical Islam"" used by Florida Sen. Marco Rubio and other Republican candidates as unnecessarily offensive to American Muslims.
""We are at war with violent extremism, we are at war with people who use their religion for purposes of power and oppression,"" said Clinton. ""I don't want us to be painting with too broad a brush.""
GOP candidates immediately seized on the remarks. ""Yes, we are at war with radical Islamic terrorism,"" tweeted former Florida Gov. Jeb Bush.
The debate pivoted to economic issues, in a conversation that revealed how Sanders' liberal message has helped shift the party to the left on some economic issues.
All three agreed that wealthy citizens and corporations should pay more in taxes to benefit the middle class. They tangled over how high to increase the minimum wage, with Clinton backing a $12-per-hour federal floor while Sanders and O'Malley said $15 an hour. And they fought over the degree to which they would curtail large financial institutions, with Sanders describing Wall Street's business model as ""greed and fraud"" â a startling judgment for a major presidential candidate.
""I'm not that much of a socialist compared to Eisenhower,"" joked Sanders, saying the 1950s-era president backed a 90 percent marginal tax rate.
Clinton defended her relationship with Wall Street, citing her work in the aftermath of the Sept. 11, 2001, attacks, but her statement met with blowback from Republicans who accused her of politicizing the terrorist assaults.
While Clinton is wary of alienating Sanders backers whose support she'll need should she win the nomination, she did take a few shots. She attempted to cast some of Sanders' major proposals, including a single-payer health care system and free college, as politically unrealistic.
""The revolution never came,"" she said, in a knock on his call for a ""political revolution.""
Sanders may have inadvertently helped her in the first debate, when he seemed to dismiss the controversy over her use of a private email account and server by saying Americans are tired of hearing about her ""damn emails.""
Saturday night, Sanders declined once again to attack: ""I am still sick and tired of Hillary Clinton's email,"" he said.
""I agree completely,"" said Clinton, with a laugh.
___
Lisa Lerer reported from Washington. Follow her on Twitter at: http://twitter.com/llerer",,"DES MOINES, Iowa (AP) — A day after deadly terrorist attacks in Paris, Hillary Rodham Clinton cast herself as the country's strongest commander in chief in a scary world, even as she defended her own role in the rise of Islamic militants.",Terrorism takes center stage at Democratic debate,http://hosted2.ap.org/APDEFAULT/89ae8247abe8493fae24405546e9a1aa/Article_2015-11-15-US--DEM%202016-Debate/id-2158b8e049e84780a061c1a960ea6397,[u'foreign policy/national security'],"[u""Martin O'Malley"", u'Jeb Bush', u'Hillary Clinton', u'Lisa Lerer', u'Hillary Rodham Clinton', u'Marco Rubio', u'Barack Obama', u'Bernie Sanders']",ap,0.8973793921032582,"[{u'author_id': 39735, u'fullname': u'lisa lerer', u'primary_org': u'ap'}, {u'author_id': 39392, u'fullname': u'ken thomas', u'primary_org': u'ap'}]",2015-11-15 03:39:00,"[u'Democratic Party', u'DES MOINES']",2415ee6b43739b648b2c437999fabee6,2015-11-15 09:00:04.644818
