title,url,org,body,election_news_confidence
Who’s Who in the Hillary Clinton Email Controversy,http://blogs.wsj.com/washwire/2015/09/03/whos-who-in-the-hillary-clinton-email-controversy/,wsj,"Former Secretary of State Hillary Clinton‘s aides have been drawn into the lawsuits and investigations into her use of a private email server for government business.

Two top aides are on Capitol Hill this week testifying in front of the House Select Committee on Benghazi, while another has said he will invoke his Fifth Amendment right not to answer questions in the course of the investigation.

Here’s a guide to who is who in the Clinton email drama:

Ms. Mills is a longtime attorney, campaign aide and adviser to the Clinton family. She most recently served as chief of Staff to Mrs. Clinton at the State Department. Before that she served in Bill Clinton‘s White House and on Mrs. Clinton’s 2008 presidential campaign. She is on Capitol Hill Thursday testifying behind closed doors before the Benghazi committee.

***

Another top aide to Mrs. Clinton at the State Department, Mr. Sullivan is a foreign-policy expert and an adviser to her 2016 campaign. He also served on Vice President Joe Biden‘s national security staff. He is expected to testify in front of the Benghazi committee on Friday.

Ms. Abedin worked for Mrs. Clinton at the State Department as deputy chief of staff and currently serves on her 2016 campaign. Ms. Abedin obtained permission to work as a special State Department employee, and was also on the payroll of the Clinton Foundation and the consulting firm Teneo. The State Department’s inspector general found this year that she was overpaid by almost $10,000 by the State Department — a finding that Ms. Abedin’s attorneys are challenging.

Mr. Reines served as a senior adviser to Mrs. Clinton at the State Department, often handling her media requests. His emails are the subject of a Freedom of Information Act lawsuit by the website Gawker seeking access to his correspondence with reporters.

Mr. Pagliano served as an information technology staffer on Mrs. Clinton’s 2008 presidential campaign before going to work for the State Department. He set up the server in question for Mrs. Clinton before it was later transferred to a professional IT company based in Denver. Through an attorney, he announced this week that he would invoke his Fifth Amendment right not to answer questions in the congressional investigations into the email server.

A longtime friend and political confidant of the Clinton family, Mr. Blumenthal was denied a job in the State Department under pressure from the White House. He nevertheless stayed in close contact with Mrs. Clinton during her time in office. He testified in a closed door session in front of the Benghazi committee in May.

More on the Clinton emails:

Interactive: Search Hillary Clinton’s Emails

Hillary Clinton’s Emails Point to Large Role for Blumenthal (Sept. 1)

Largest Batch to Date of Hillary Clinton Emails Released (Sept. 1)

Clinton Softens Tone on Email Questions, Just a Bit (Aug. 26)

Classified or Not? Explaining the Clinton Email Controversy (Aug. 19)

FBI Is Looking at Security of Hillary Clinton’s Email System (Aug. 5)

______________________________________________________

Politics Alerts: Get email alerts on breaking news and big scoops. (NEW!)

Capital Journal Daybreak Newsletter: Sign up to get the latest on politics, policy and defense delivered to your inbox every morning.

For the latest Washington news, follow @wsjpolitics

For outside analysis, follow @wsjthinktank",0.99990809960406468
Jeb Bush Broadens Attack on Donald Trump,http://blogs.wsj.com/washwire/2015/09/03/jeb-bush-broadens-attack-on-donald-trump/,wsj,"HAMPTON, N.H. A Jeb Bush broadened his attack on Donald Trump Thursday, saying the Republican Party faces a stark choice–both on issues and worldview between himself and the real estate mogul and reality television celebrity who is the front-runner for the 2016 GOP nomination.

There's one candidate in the Republican Party that is preying on people's angst and fears that has a philosophy not about goodness and greatness of the American people, Mr. Bush said in a town hall meeting here. Donald Trump's view is that the end is near.

Mr. Bush said the party is better off with a more upbeat conservative message because when we give people hopeâ¦we can lift them up.''

I choose that path because the other path will lead to defeat, but more importantly, it will lead to more angst, more anger said Mr. Bush, drawing differences with Mr. Trump on taxes, immigration and other policies. Whatever the issue, there is one path that is aspirational and hopeful and there is one path that is negative and is not the right path for this country.”

And one day after Mr. Trump criticized Mr. Bush for speaking in Spanish on the campaign trail, the bilingual former Florida governor slipped in a Spanish phrase when he called on Republicans to campaign with our arms wide open.

Mr. Trump on Wednesday complained about Mr. Bush's use of Spanish saying that he should  set the example by speaking English while in the U.S.

Earlier in the day, Mr. Bush on ABC's Good Morning America responded to that complaint by saying, I think Donald Trump is trying to insult his way to the presidency and it’s not going to work. People want an uplifting hopeful message. People come to this country to pursue their dreams, sometimes they start without speaking English but they learn English and they add vitality to our country.

The town hall was held on a factory floor after Mr. Bush toured a plant of Foss Manufacturing, a synthetic fabric firm. Workers in attendance included fans, foes and the indifferent. Employees said attendance was not mandatory, but the plant's production line was shut down to make it easier for them and their families to attend.

One questioner attacked Mr. Bush's immigration policies, saying it amounted to appeasement to propose allowing a pathway to legal status for millions of people in the U.S. illegally,

We are pissed off right now, said Dennis Lamare of Lee, N.H. There is an air of appeasement.

Responding to Mr. Lamare, Mr. Bush took a swipe at two of Mr. Trump's signature immigration proposals A building a wall on the southern border and having Mexico pay for it, which Mr. Bush called ludicrous,  and deporting people here illegally and their families.

Rounding people up Mr. Bush said, would create real chaos and cost hundreds of billions of dollars.

______________________________________________________

Politics Alerts: Get email alerts on breaking news and big scoops. (NEW!)

Capital Journal Daybreak Newsletter: Sign up to get the latest on politics, policy and defense delivered to your inbox every morning.

For the latest Washington news, follow @wsjpolitics

For outside analysis, follow @wsjthinktank",0.99999627088245469
"Ben Carson Wins in Matchup With Donald Trump, Poll Shows",http://blogs.wsj.com/washwire/2015/09/03/ben-carson-wins-in-matchup-with-donald-trump-poll-shows/,wsj,"If Donald Trump has an Achilles’ heel in the Republican presidential nominating contest, it just might be the candidate who is least like him: soft-spoken retired neurosurgeon Ben Carson.

A Monmouth University poll released Thursday found that in head-to-head matchups with nine top members of the GOP field, the real-estate mogul beat each of his rivals—except for Mr. Carson. Former Florida Gov. Jeb Bush, who for months was the field’s front-runner, lost with 37% to Mr. Trump’s 56%. Florida Sen. Marco Rubio‘s margin was similarly poor: 38% to 52%. Wisconsin Gov. Scott Walker lost 38% to 53%; Kentucky Sen. Rand Paul 27% to 60%; Ohio Gov. John Kasich 29% to  62%; and New Jersey Gov. Chris Christie 30% to 63%. Former Hewlett-Packard chief executive Carly Fiorina and Texas Sen. Ted Cruz came the closest, losing 37% to  50% and 41% to 48%, respectively.

In a matchup with Mr. Carson, Mr. Trump didn’t even come close. He lost with 36% of GOP voters’ support, compared with 55% for Mr. Carson. Neither candidate has ever held elected office.

“The fact that the only one who can challenge Trump is the only other candidate who has never held or run for elected office speaks volumes to the low regard GOP voters have for the establishment,” said Patrick Murray, director of the Monmouth University Polling Institute, in a statement.

Mrs. Fiorina has also never held elected office, and has seen a distinct bump in polling following her widely praised performance in the second-tier debate held last month.

As Mr. Trump draws hefty crowds around the country and lands in the headlines for his bombastic, often controversial remarks, little attention has been paid to Mr. Carson, who rocketed to fame in conservative political circles after criticizing the health-care law in a 2013 National Prayer Breakfast speech while President Barack Obama sat just feet away. But Mr. Carson has been quietly building support, with a recent survey by TargetPoint Consulting, a top GOP polling and data-research firm, finding that roughly two-thirds of likely Republican voters would consider backing him—the highest level of support for any candidate in the field. Just 16% said they wouldn’t, the lowest such tally.

Mr. Carson is currently polling second among GOP voters, according to a Real Clear Politics average of recent national polls. He has 13.2% of support, to Mr. Trump’s 27.2%, according to that average.

More:

Ben Carson Quietly Builds Support

Sanders, Trump et al: Partying Like It’s 1968

Donald Trump’s Insults Rattle Republican Rivals, Please Fans

______________________________________________________

Politics Alerts: Get email alerts on breaking news and big scoops. (NEW!)

Capital Journal Daybreak Newsletter: Sign up to get the latest on politics, policy and defense delivered to your inbox every morning.

For the latest Washington news, follow @wsjpolitics

For outside analysis, follow @wsjthinktank",0.99999996510510758
Prosecutors plan to seek death penalty for accused Charleston church gunman Dylann Roof,http://www.washingtonpost.com/news/post-nation/wp/2015/09/03/prosecutors-plan-to-seek-death-penalty-for-accused-charleston-church-gunman/,washpo,"Dylann Roof (R), the 21-year-old man charged with the killings. (Randall Hill/Reuters) Prosecutors in South Carolina intend to seek a death sentence for Dylann Roof, the man accused of killing nine black parishioners in a Charleston, S.C., church earlier this year. Roof has been charged with nine counts of murder and three counts of attempted murder for the June massacre. Scarlett A. Wilson, the prosecutor in the case, has a news conference scheduled for Thursday afternoon to make an announcement regarding the case. Court documents filed Thursday show that the state intends to seek the death penalty for Roof. Under South Carolina law, prosecutors can seek a death sentence if there are certain aggravating factors in a case, including if someone is charged with murdering more than one person during a single act. This story will be updated.",0.31019947427230887
How To Make Gravlax (and Save Big on Cured Salmon),http://www.wsj.com/articles/how-to-make-gravlax-and-save-big-on-cured-salmon-1441298027,wsj,"IN BEVERLY HILLS, where I grew up, Sunday mornings meant trekking off to Nate ’n Al and stuffing myself with enough lox, bagels and cream cheese to last until dinner and beyond. I could hardly imagine anything more delicious than the deli’s lox—mildly salted, lightly cold-smoked Nova Scotia salmon. As time passed, however, I graduated to Scottish, Irish and Norwegian smoked salmons and liked them even better. But their high price relegated them to the “special occasion food” category.

The real game-changer first appeared to me on a Stockholm restaurant menu. Gravlax, thinly sliced and rosy-orange, looked like smoked salmon, but its meltingly tender texture and cleaner taste were new, and wonderful. I learned that preparing gravlax was smoke-free and dead simple, a mere matter of smothering a very fresh salmon fillet in salt, sugar and abundant fresh dill, and refrigerating it for a couple of days. Here was something even a kitchen novice could manage at home—and quite inexpensively to boot.

Guests devour my home-cured gravlax enthusiastically whether it’s served as an hors d’oeuvre, a sandwich filling, a brunch-buffet anchor or a light main course. If I’m feeling traditional, I’ll serve dark or rye bread and a sweet mustard-dill sauce as accompaniments. Sometimes, however, I go all Nordic-minimal, presenting the thinly sliced gravlax with nothing but cracked pepper and a drizzle of lemon juice or champagne vinegar.

Whether you opt to serve your gravlax naked or sauced, use only the very freshest fish to make it. Once cured, if well-wrapped and refrigerated, gravlax will last up to a week. But if you smell any off odors, discard it sooner.

This style of preparation dates back to the middle ages, when Scandinavian fishermen simply buried salted salmon on the beach to preserve it, and the process hasn’t gotten any more complicated in the intervening centuries. Once you’ve mastered the making of gravlax you may want to experiment. The salt-to-sugar ratio is a question of personal taste. And some cooks include additional spices—caraway, coriander and fennel seeds all nicely complement the fresh dill.

I’ve even dallied with versions spiked with aquavit—which, by the way, also makes a delicious and appropriately brisk drink pairing for this herbed and salty food. The curing time is not set in stone either. Longer equals a stronger flavor, and vice versa.

Making it at home not only saves you the money you’d otherwise spend on all those imported salmons; it also means you can have your gravlax just as you like it. What a luxury.

1. Combine salt, sugar, toasted fennel seeds and crushed peppercorns in a small bowl.

2. Line a deep dish or plastic container with a long piece of foil, letting ends trail out of dish. Cut salmon in half crosswise and place one half, skin-side down, on top of foil.

3. Sprinkle half of spice mix evenly over fish, top with bunch of dill and sprinkle remaining spice over dill. Place remaining salmon, skin-side up, on top.

4. Wrap with foil, place a bowl on top of foil and weight with a heavy can. Refrigerate 48-72 hours, turning foil packet periodically and replacing weight. At end of curing, unwrap, discard dill and wipe spices from fish. (Rinse fish for a less-salty result.) Sprinkle with chopped dill. To serve, thinly slice gravlax against the grain.",0.32027119441894059
Texans WR Strong learning value of sacrifice in the NFL,http://feeds.foxnews.com/~r/foxnews/sports/~3/5mAOn3x5ZHg/,fox,"Aug 22, 2015; Houston, TX, USA; Houston Texans head coach Bill O'Brien talks with wide receiver Jaelen Strong (11) before a game against the Denver Broncos at NRG Stadium. Mandatory Credit: Troy Taormina-USA TODAY Sports

Houston Texans wide receiver Jaelen Strong has helped turn tough love from the coaching staff into a productive preseason performance.

Strong, a third-round pick out of Arizona State, has two touchdown receptions though Houston's first three exhibition games.

It's a noticeable improvement for the rookie, who was featured on 'Hard Knocks' two weeks ago being lectured by coaches. Strong credits advice he's received from veteran receiver Nate Washington and receivers coach Stan Hixon, among others, for helping him settle in during camp.

""Study, study, study, study,"" Strong said, per ESPN's Tania Ganguli. ""Sacrifice a lot of things. I'd rather give up everything just to be perfect on the football field. That's just how my mindset has changed. Before I was trying to take little pieces here, little pieces there. You've got to make that sacrifice.""

Strong, who was taken with the 70th pick in the draft, has impressed the coaching staff with his skillset in camp.

""He's improved every week,"" Texans coach Bill O'Brien said. ""I think that he's taken the coaching to heart. He's a very talented guy. He's big, he's strong, he's a very instinctive player, he makes contested catches. I think that he's improved every week. The key for Jaelen is the key for every rookie, is to keep improving.""

The 21-year-old said Washington has helped provide valuable perspective on what it takes to be successful in the NFL.

""He told me he's in his 11th year and he's still trying to make the team,"" Strong said. ""There's always somebody coming for your spot. Always somebody trying to take that food off your plate. Granted these are your teammates, you go out there to win together. But it's your job. This is how you feed your family. Everything you do you've gotta do it the right way.""

(h/t ESPN)",0.32672288579197994
Report: Patriots don't plan to play Tom Brady in preseason finale,http://feeds.foxnews.com/~r/foxnews/sports/~3/CdQMqflHbvg/,fox,"Tom Brady is officially available to start for the New England Patriots in Week 1 following the nullification of his four-game suspension, but fans will have to wait until next Thursday to see their quarterback on the field.

According to Jeff Howe of the Boston Herald, a source said that the Patriots are unlikely to play Brady in the preseason finale on Thursday night.

This should come as no surprise, as the majority of starters across the NFL will be relegated to being cheerleaders on the sidelines tonight.

With Brady now available to play in the regular season opener, the Patriots could now play Jimmy Garoppolo for some time in the preseason finale. He's no longer going to be the starter this season and can still benefit from extra preseason time to work on some things -- even if it is against the Giants' backup defense.

While it's disappointing Brady won't be on the field Thursday night against the Giants, Patriots fans are just a short week away from seeing the quarterback back in action against the Steelers in Week 1.

(h/t Jeff Howe)",0.31421478483098331
Small Business and the Secret of Big Growth,http://www.wsj.com/articles/small-business-and-the-secret-of-big-growth-1441234231,wsj,"Tired of plodding growth, stagnant wages and widening inequality, most Americans have little positive to say about the U.S. economy. With one notable exception. In a Gallup poll this summer, almost two-thirds expressed confidence in small businesses. That’s three times as many as said the same about big business. Only the U.S. military ranks consistently as high.

The faith in small business runs deep but rests on an increasingly unsure foundation. Small firms have been slow to recover from the recession, and business deaths now outpace births for the first time since the Census Bureau began keeping records more than three decades ago. A July survey by the National Small Business Association showed that only 35% of owners are optimistic about the direction of the economy.

These warning signs should light a fire under Democrats and Republicans. The health of small local firms is one of the vital signs of democracy, a key indicator of community well-being.

Small businesses continue to create most new jobs and employ about half of the private workforce, according to data from the Small Business Administration. They are launchpads for innovation and opportunity. As chairman of McLarty Cos., a fourth-generation family-owned automotive firm that began as a single car dealership in Hope, Ark., I’ve seen firsthand how small businesses can transform Main Street into an avenue to the American dream.

That avenue is now strewn with potholes and obstacles, including taxes and regulations. Despite the gilded image of startups like Uber and Airbnb, many new small firms struggle to find financing. Wendy Guillies, president of the Kauffman Foundation, reported earlier this year that more than half of young companies that applied for credit were turned down. Her conclusion: “Across the board, the American economy appears to be getting less dynamic.”

Where can we look for big thinking about small business? Neither the sweeping promises of economic populism, aimed largely at Wall Street, nor the antigovernment reflexes of some on the right, squarely address the problems of small business. But policies that help smaller firms compete, thrive and create good jobs are needed, and there are good ideas from both sides of the political aisle.

Tax reform is one such idea. Small businesses can’t compete with large corporations that find creative ways to lower their taxes. The money they must spend to comply with the complicated tax code is a heavy burden. Addressing these points last month, Democratic presidential candidate Hillary Clinton proposed a program of “tax relief and simplification” for entrepreneurs, and promised “less red tape” and “easier access to capital.”

Mrs. Clinton has said that she wants to be “the small business president.” She will not be alone on the campaign trail. Among Republicans, Gov. John Kasich pushed this year to eliminate the income tax in Ohio on most small businesses. Jeb Bush’s supporters cite his record as governor when Florida was the nation’s leader in small business creation.

In Congress, bipartisan efforts are seeking to curb some onerous regulations for small businesses. The Small Business Healthcare Relief Act is sponsored by Sens. Chuck Grassley (R., Iowa) and Heidi Heitkamp (D., N.D.) and Reps. Charles Boustany Jr. (R., La.) and Mike Thompson (D., Calif.). It would protect firms with fewer than 50 employees that offer health reimbursement accounts being penalized under the Affordable Care Act for providing this cost-sharing option to employees.

Congress and the White House also should rally bipartisan support for the expansion of vocational training and apprenticeships. In a recent survey by the National Federation of Independent Business, about half of small business owners seeking new employees said they had difficulty finding qualified applicants. Training costs for small businesses should be offset by tax breaks and other incentives.

A thread running through these efforts is an opportunity to find common political cause, the antithesis of today’s unfortunate division and distrust. After all, it takes cooperation to launch a small business. As the late Republican Congressman Jack Kemp once said, “You can’t create more employees without first creating more employers.” And you can’t sustain employers without a well-trained, fairly paid and engaged workforce.

Small business owners are clear about what they want from Washington. Asked in last month’s National Small Business Association survey to rank their priorities for the administration and Congress, the top responses were simplify and cut taxes, reduce the national deficit, and “end the partisan gridlock and work together.” The message to the country’s political leadership is clear: Lead, or get out of the way.

Mr. McLarty, former White House chief of staff and special envoy for the Americas under President Bill Clinton, is chairman of McLarty Associates, an international strategic-advisory firm.",0.38743730595780557
