title,url,org,body,election_news_confidence
Hillary Could Lose Iowa---and New Hampshire,http://www.wsj.com/articles/hillary-could-lose-iowaand-new-hampshire-1441234267,wsj,"Political junkies are focused on Donald Trump, but Hillary Clinton’s weakness remains a huge story. Her support among Iowa’s likely Democratic caucusgoers has dropped to 37%, down 20 points since May, according to an Aug. 26 Des Moines Register/Bloomberg Politics poll. Meanwhile, Vermont Sen. Bernie Sanders is up 16 points to 30%, and Vice President Joe Biden, who isn’t even running, is up six points to 14%.

The poll caused great consternation among Mrs. Clinton’s supporters, as it should have. Some of her advocates tried to claim that the survey contained good news, in that the former secretary of state’s favorable rating among Democratic caucusgoers remained at 77%.

But if Mrs. Clinton’s favorables remained high while she hemorrhaged support, then Iowa Democrats are moving to Mr. Sanders not because they dislike her but because she doesn’t excite them, and they like him more. That too was polled. Only 2% of Mr. Sanders’s backers said that their decision to support him was because they don’t support Mrs. Clinton.

But is there a Democrat who—absent something extraordinary, say, Mrs. Clinton’s indictment over mishandling classified information on her private email account—can beat her for the nomination?

If this is the field, the answer is probably no. Former Maryland Gov. Martin O’Malley, former Virginia Sen. Jim Webb and former Rhode Island Gov. Lincoln Chafee are vying to avoid being asterisks in the polls.

Things will probably get worse for Mrs. Clinton in the short term. It’s possible, even likely, that she will lose both the Feb. 1 Iowa caucus and the New Hampshire primary eight days later. Mr. Sanders will appeal in a state like Iowa, where there is a strong left-wing sentiment, and the caucus format is dominated by more ideologically committed activists. He could carry New Hampshire in a multicandidate field.

But then the calendar becomes Mrs. Clinton’s friend. South Carolina and Nevada are next. Neither is fertile ground for Mr. Sanders, the self-proclaimed democratic socialist. On March 1 come primaries in Arkansas, Massachusetts, Oklahoma, Tennessee and Texas, all states Mrs. Clinton carried in 2008. She will probably fare well on super Tuesday again, except perhaps in Massachusetts, a next-door neighbor to Mr. Sanders’s home state.

There also will be primaries that day in Alabama, Georgia, North Carolina, Vermont and Virginia, states that then-Sen. Barack Obama carried in 2008. Vermont will go for its favorite son, but Mrs. Clinton stands a better chance than Mr. Sanders in the others if she has the backing of black Democratic leaders who voted for Mr. Obama seven years ago.

Competing in these primaries will be expensive. A reasonable flight of three or four weeks of television ads in those states will cost north of $30 million, even at the low rates candidates are guaranteed by the FCC, and more if the ads are bought by a super PAC. Mrs. Clinton is likely to have the cash; Mr. Sanders is not, even if his fundraising gets a boost from early victories.

The contests between March 5 and March 15 appear inhospitable for Mr. Sanders as well. Mrs. Clinton carried Florida, Michigan and Ohio in 2008 and virtually tied in Missouri, even with Sen. Claire McCaskill helping out Mr. Obama. This time she will be helping Hillary. Mr. Obama carried his home state of Illinois, Kansas (where he claimed family ties), Louisiana and Mississippi. All four, especially the Southern states, seem better turf for Mrs. Clinton this time.

There are also March caucuses in Colorado, Minnesota and Nebraska. Unprepared for most caucuses in 2008, Mrs. Clinton got walloped. Even if she’s learned a lesson, Mr. Sanders could be competitive in parts of Colorado and Minnesota.

Mr. Sanders’s problem is simply that there aren’t enough left-wing enclaves like Portland and Berkeley, Madison and Ann Arbor, Burlington and Boulder for him to beat her for the nomination.

Could Vice President Joe Biden, though? Mr. Biden would do better in the blue-collar parts of Missouri and Michigan than Mr. Sanders—and maybe even Mrs. Clinton. But once the contest runs through the South, he would have to pick up a substantial part of the black vote. It’s one thing to vacation in South Carolina, as Mr. Biden does. It’s another thing to generate the level of support that Mr. Obama enjoyed there in 2008.

Still, the more candidates in the Democratic race, the more Mrs. Clinton’s numbers will drop, and the more unconventional the nominating process will become. And in this election, unconventional is doing better than expected.

Mr. Rove helped organize the political-action committee American Crossroads and is the author of “The Triumph of William McKinley: Why the 1896 Election Still Matters,” out in November from Simon & Schuster.",0.99998270649105214
Small-Business Hiring Picks Up,http://www.wsj.com/articles/small-business-hiring-picks-up-1441279409,wsj,"Hiring at small businesses increased in August, according to the National Federation of Independent Business. Its monthly employer survey finds that NFIB members added a net 0.13 workers per firm in recent months, which was better than July’s 0.05 reading and represents “a large improvement in hiring activity,” according to the NFIB’s William Dunkelberg. Morning Editorial Report reviewed the survey results, which will be released later today.

Click here to receive Opinion headlines and James Freeman’s commentary via email.

The good news is that business conditions are improving and small employers did not freak out over the August volatility on Wall Street. The bad news is that the improvement is likely not large enough to pull the economy out of “the same old 2-2.5% rut” for GDP growth in the second half of the year, according to Mr. Dunkelberg. Still, based on today’s numbers, he expects the Department of Labor’s August employment report to show job gains of 250,000 or more.

After a solid second quarter for GDP growth, your correspondent wonders if low fuel prices are finally starting to drive the economy out of the Obama-era malaise and offset Washington’s myriad policy mistakes.

Speaking of policy mistakes, Hillary Clinton is proposing an FDR-style tax distortion for investments, and Alan Reynolds describes what happened after this policy was implemented in the 1930s. “In the 12 months between February 1937 and 1938, the Dow Jones Industrial stock average fell 41%...That crash presaged one of the nation’s worst recessions, from May 1937 to June 1938, with GDP falling 10% and industrial production 32%,” writes Mr. Reynolds.

As for Mrs. Clinton’s most famous recent mistake, a Journal editorial notes her “self-serving decision to use a private email server for official communications may have resulted in far greater mishandling of classified information.”

The big mistake for Senate Democrats is giving the President enough support to sustain a veto of GOP efforts to block his Iran nuclear deal. The Democrats “now own the Ayatollahs,” notes a Journal editorial.

Next comes the “spectacle” of “the President’s party using a procedural dodge to avoid voting on the merits” of a hugely consequential international agreement. “Previous arms-control pacts of this magnitude were submitted as treaties requiring two-thirds approval by the Senate. Mr. Obama and Senate Democrats maneuvered the Iran deal as an ‘executive agreement,’ so he is able to commit America to trusting the Ayatollahs with the support of a mere partisan minority. At least ObamaCare had a partisan majority,” notes the Journal.

Also today, Daniel Henninger explains why much of the Obama crowd wants Joe Biden to run, and Karl Rove explains why Hillary Clinton could lose both Iowa and New Hampshire.

In other news, Ned Crabb reports that at Smithfield, Maine’s North Pond, both the spiders and the fish were biting this summer.",0.51014153014308605
