body,byline,description,title,url,topics,people,org,election_confidence,authors,date_written,orgs,article_id,date_access
"Democratic U.S. presidential candidates Senator Bernie Sanders (L), former Secretary of State Hillary Clinton and former Maryland Governor Martin O'Malley pose on stage ahead of the second official 2016 U.S. Democratic presidential candidates debate in Des Moines, Iowa, November 14, 2015.   (REUTERS/Jim Young)Hillary Clinton was put on the defensive at the opening of Saturday night’s Democratic presidential debate over military interventions she backed in countries now gripped by instability.The debate in Des Moines, Iowa, came in the wake of the Paris terror attacks, which thrust the issues of national security and foreign policy back to the center of the 2016 campaign. The debate format was changed to focus anew on those issues.But, citing the chaos in the Middle East and North Africa, Clinton’s rivals criticized her Senate vote for use of force before the Iraq war and appeared to criticize her support for toppling Libyan dictator Muammar Qaddafi.Former Maryland Gov. Martin O’Malley said America’s role is not to roam the world “looking for new dictators to topple.”He said it is also important to understand “secondary and third consequences” that come after removing a “single dictator.” O’Malley called Libya, Syria and other countries in the region a “mess.”Clinton defended her support for toppling Qaddafi, saying he was threatening a “genocide” and America’s European and Arab allies asked for U.S. support.She also said “it is imperative” that the U.S. do more to confront the “arc of instability” in the region. And to O’Malley’s critique, she said, “I don’t think you can paint with a broad brush,” and “This is an incredibly complicated region of the world.”Vermont Sen. Bernie Sanders, meanwhile, referenced Clinton’s support for use of force in Iraq and said the “disastrous invasion” led “to the rise of Al Qaeda and to ISIS.”Clinton again called her Iraq war vote a “mistake,” but disputed that the war is the only driver of modern terrorism.The candidates also condemned the Paris terror attacks.“Our prayers are with the people of France tonight, but that is not enough,” Clinton said.She called for global “resolve” to “root out” the “radical jihadist ideology” that motivates groups like the Islamic State. Clinton, a former secretary of state, said she would coordinate efforts “against the scourge of terrorism.”“It cannot be contained. It must be defeated,” she said of ISIS.Sanders blasted ISIS as a “barbarous organization.”O’Malley called this the “new face” of terror threats.The attacks across multiple locations in Paris killed at least 129 people and wounded hundreds, officials said. In a primary race otherwise dominated by the economy, climate and front-runner Clinton’s personal record, the debate in Des Moines, Iowa, now is expected to focus heavily on security and foreign policy after debate host CBS News reworked the format.  It is an area where Clinton, as former secretary of state, enters with the thickest resume – but also one that could prove problematic, given her involvement shaping the policies in increasingly unstable and chaotic nations like Libya and Syria.Sanders, after appearing to give her a pass at the first debate over her personal email controversy, has in recent weeks shown a greater interest in criticizing her record. But his focus on issues like income inequality could be out of place in a discussion focused on global security challenges. Sanders’ campaign objected to some of the CBS News debate tweaks, sources said.Clinton also enters this debate – hosted by CBS News, KCCI-TV and The Des Moines Register – facing a narrower field than at their first encounter in October. Since that debate, two candidates have dropped out, leaving only Sanders and O’Malley.Clinton is seen to have otherwise strengthened her hand since that debate, making it through a lengthy hearing before the Benghazi congressional committee and seeing one of her biggest potential political threats – a late bid by Vice President Biden – disappear as the vice president announced he would not run.Sanders remains Clinton’s biggest challenge, and has stirred an enthusiasm in the Democratic base that Clinton has struggled to evoke. But nationally and in Iowa, she continues to lead him by double digits in the polls.Still, the FBI investigation over Clinton’s use of a personal email and server while secretary of state looms over her bid, with the probe said to be expanding. ",,Hillary Clinton was put on the defensive at the opening of Saturday night’s Democratic presidential debate over military interventions she backed in countries now gripped by instability. ,Clinton on defense over Middle East policies at Dem debate,http://feeds.foxnews.com/~r/foxnews/most-popular/~3/TEOgoe910VE/,['foreign policy/national security'],"['Bernie Sanders', 'Muammar Qaddafi', 'Hillary Clinton', u""Martin O'Malley"", 'Jim Young']",fox,0.9311865151561396,[],2015-11-15 02:02:16,"['Senate', 'Al Qaeda', 'FBI']",b06f7a0e9f9c60524f5011b3887f1e37,2015-11-15 03:00:12.671185
"Here’s the latest:• What is the status of the investigation?The French authorities have released no information since a news conference by the Paris prosecutor on Saturday, and no updates are scheduled for Sunday.The death toll holds at 129, but the number of critically wounded — nearly 100 — signaled that figure was certain to grow.Investigators were hunting down information about the first of the suspects to be publicly identified, Ismaël Omar Mostefaï, 29, a French citizen who was one of three hostage takers at the Bataclan concert hall.In the eastern Paris suburb of Montreuil, the authorities found three Kalashnikov rifles in an abandoned vehicle, a sign that some of the attackers may have escaped.The authorities in Belgium made seven arrests that left open the possibility that the plot had roots there.Fundamental questions remain: How did the terrorists, who acted in three synchronized teams, pull off the deadliest terrorist attack in Western Europe since 2004?And did they receive direction from Islamic State leaders in Iraq and Syria, who until now had never taken responsibility for such a large-scale attack in the West?• What’s happening in Paris?Paris is still by and large shuttered, even for a Sunday, and France remains under a state of emergency.Museums and other cultural centers are closed for a second day. A star-crossed movie opening about a terrorist attack in France was canceled.But small crowds congregated at the Place de la République — as they did after the Charlie Hebdo massacre in January — to show solidarity on Saturday, ignoring government advice to stay home. And French flags are appearing in Parisian apartment windows.The archbishop of Paris officiates at a Mass at the Cathedral of Notre-Dame today. And schools are to reopen on Monday.• What about elsewhere?From Vatican City to Seoul, law enforcement authorities are on heightened alert.Foreign Minister Ibrahim al-Jaafari of Iraq said his country’s intelligence services obtained information indicating that, besides France, the United States and Iran were among countries being targeted for attack.• What’s next for policy makers?As France deals with the aftermath in Paris, global attention turns to policy and politics. President Obama and other world leaders are in Turkey for a Group of 20 summit meeting today, where the terrorist attacks are already a focus.Migration is, too, because one of the assailants entered the European Union through Greece with other refugees last month and then passed through Serbia, where he sought asylum.That is sure to complicate the vexing problem of how to handle the unceasing flow of people from Syria, Iraq, Afghanistan and elsewhere in Europe. Jean-Claude Juncker, the head of the European Commission, said today that Europe should not react by rejecting refugees.European Union justice and interior ministers will hold a special meeting on the Paris attacks Friday.• How is Paris playing in the U.S. presidential campaign?Candidates for the Democratic nomination, in their debate Saturday night in Des Moines, agreed that America is determined to fight terrorism, dedicated to responsibilities to refugees and devoted to diplomacy.But Senator Bernie Sanders of Vermont sought to tie the rise of the Islamic State to Hillary Rodham Clinton’s vote as a senator to authorize the American-led invasion of Iraq in 2003.By contrast, leading Republicans like Donald J. Trump, Ben Carson and Senator Ted Cruz of Texas called on the Obama administration to halt plans to accept 10,000 Syrian refugees next year.Although they broadly agreed that the Paris attacks should be the catalyst for a new military strategy against the Islamic State, most of the Republicans were still tentative about committing more American ground troops to that effort.• Who were the victims?Little seemed to tie the dead at the six attack sites, except that they were out having fun. And that was the point for the Islamic State militant group, which said that it struck France’s symbols of “perversity.”“Bars, a concert, a great game,” Bernard-Henri Lévy, a French author and philosopher, wrote on Twitter. “This is the French art of living together that has been targeted.”Several foreigners, including people from Belgium, Britain, Germany, Portugal, Spain, Sweden, and the United States, were killed in the attacks.An American student from California State University in Long Beach, Nohemi Gonzalez, 23, also died in the Paris attacks. She was spending a semester at the Strate School of Design in Paris.Valentin Ribet, a 26-year-old lawyer, was killed at the Bataclan concert hall during a sold-out show by the American rock band Eagles of Death Metal.Guillaume B. Decherf, 43, a critic at a French cultural magazine and a father of two, was killed as well. Three employees from Universal Music France also died, as did Nick Alexander, a British citizen who sold merchandise for the band, and Aurélie De Peretti, 33.“Yesterday, the victims weren’t journalists or famous. They were civilians,” Maxim Ferron, manager of a Paris tea shop, said on Saturday.You can sign up here to get the regular weekday Morning Briefing delivered to your inbox. For feedback, contact us at briefing@nytimes.com.",VICTORIA SHANNON,A briefing with the latest information.,Paris Attacks: What We Know and Don’t Know,http://www.nytimes.com/2015/11/15/world/europe/paris-attacks-what-we-know-and-dont-know.html,['foreign policy/national security'],"['Bernie Sanders', 'Donald J. Trump', 'Ted Cruz', 'Ben Carson', 'Hillary Rodham Clinton']",nyt,0.618289695091248,"[{'author_id': 3610, 'fullname': 'victoria shannon', 'primary_org': 'nyt'}]",2015-11-15 13:40:59,"['European Union', 'European Commission']",6ded827bf50f48e2904c2075b94bd707,2015-11-15 14:00:27.355766
" “We will not solve our nation’s problems … by returning to [the] polarizing figures of our past.”This was a not so veiled attack against Hillary Clinton from Martin O’Malley on Saturday night at the second Democratic debate. It was uttered on a night when her opponents were more direct in their criticism but still did not appear to lay a glove on her.  Indeed, O’Malley’s words are poignant, but ultimately won’t make much of a difference. Hillary Clinton is 19 points up nationally and Saturday night’s debate was another example of why she is so far in front.Just as in the first debate, Clinton showed the depth of her experience in politics over the last 30 years. She has the deepest understanding of the issues – particularly foreign policy having been secretary of state – and is a sharp, quick debater.None of the candidates were willing to say that we’re at war with radical Islam. Everyone was watching for this and it seemed that they erred on the side of political correctness. Clinton continued to show herself to be a commanding force on the stage. This isn’t to say that she didn’t have struggles.She tripped up during an answer about Wall Street where she countered that her work to aid the 9/11 recovery while a New York senator made her a crusader against Wall Street. And her vote for the Iraq war haunted her again. These are points the GOP will seize upon and showed flashes of weakness.Saturday debate began with a series of questions on terrorism and how America can combat ISIS, especially in light of the heinous attacks in Paris on Friday night. We knew this would happen, as it should. And each of the candidates emphasized how important American leadership is in the fight against terrorism, something I agree with wholeheartedly.It was no surprise that Clinton was the most hawkish of the three candidates on stage. She talked of using airpower, training and equipping forces in the region and pushes our allies – especially Turkey and the Gulf States – to make up their minds about how much they’re going to help in this effort. Sanders and O’Malley had good rhetoric on the issue, but were vague and non-specific. And we also heard again that climate change is creating terrorism from Sanders – a claim that the Republicans will surely seize on.It must be noted that Clinton was trying to distance herself from Obama's statement that ISIS needs to be ""contained"" by saying they need to be ""defeated."" That being said, she did not declare war on ISIS. She did not forthrightly speak of the singular and unique role the U.S. must play in providing leadership, and sought to deflect attention from Sanders' efforts to link her with the rise of ISIS because of her support of the Iraq war by blaming George Bush.In short, it was a good and effective job for a Democratic primary audience, but all three candidates were on the defensive for much of the first part of the debate over the Middle East and the War on Terror. This will probably be a manageable challenge in the Democratic primary, but will almost certainly be a more serious challenge during the general election campaign. We will have to watch how this unfolds closely.Furthermore, none of the candidates were willing to say that we’re at war with radical Islam. Everyone was watching for this and it seemed that they erred on the side of political correctness.Clinton had the best rationale for not using the term by defending it in terms of not offending our Muslim allies, but coming on the day after the Paris attacks, I’m sure this will be an issue.There was more antagonism on Saturday night than we’ve seen before. Sanders went after Clinton for her close ties to Wall Street and on gun control. And Clinton returned the favor.O’Malley got in on the action to tout how far he went as Maryland governor to raise wages, control gun violence and work to combat climate change. He certainly did better than he has before, but I don’t think he made a strong case for an O’Malley presidency. As Sanders pointed out, it’s not like Baltimore is doing too well right now. And he’s right.The most important thing that voters will have seen at the Iowa debate this week is that a Clinton and a Sanders presidency would be very different.Sanders believes two things are of paramount importance: income inequality and climate change. His plans could push taxes on the rich upwards of 80 percent-- in a light moment he joked about Dwight Eisenhower levying a 90% tax -- and he’d bring back Glass-Steagall and break up the banks. Sanders supports a $15 minimum wage and free college tuition. And he brought the conversation on health care back to the idea of single payer, a favorite of the progressive left.These are all areas where you can see differences with Clinton. She only supports a $12 federal minimum wage and said it should be up to states/cities to raise it above that (this is also what Senate Democrats support). She wouldn’t break up the banks or bring back Glass-Steagall while at the same time arguing that her proposals go the furthest in reining in the banks.On health care, Clinton wants to build on ObamaCare and improve it, especially by focusing on the issue of prescription drug costs.It’s also important to note that all the candidates were allied on immigration – each supports comprehensive immigration plan and a pathway to citizenship.Martin O’Malley was the only candidate to say how many Syrian refugees he’d take in (65,000), but they all argued that it’s our humanitarian duty to take in refugees. This will also be a sticking point after the Paris attacks.All this is to say that Saturday night’s event was a well-moderated debate and all the candidates did well.It’s just that Clinton did that much better. She’s the only one on stage who looked presidential. And I believe everyone could see that. Douglas E. Schoen has served as a pollster for President Bill Clinton. He has more than 30 years experience as a pollster and political consultant. He is also a Fox News contributor and co-host of ""Fox News Insiders"" Sundays on Fox News Channel and Mondays at 10:30 am ET on FoxNews.com Live. He is the author of 11 books. His latest, co-authored with Malik Kaylan is ""The Russia-China Axis: The New Cold War and America's Crisis of Leadership (Encounter Books, September 2014). Follow Doug on Twitter @DouglasESchoen.+ FollowFoxNewsOpinion on Facebook",,Hillary Clinton was the only one on stage in Iowa who looked presidential.,Hillary Clinton demonstates why she's in the lead at second Democratic debate,http://feeds.foxnews.com/~r/foxnews/opinion/~3/lnuj77XSBpw/hillary-clinton-demonstates-why-shes-in-lead-at-second-democratic-debate.html,"['foreign policy/national security', 'health']","[u""Martin O'Malley"", 'Bill Clinton', 'Malik Kaylan', 'Hillary Clinton', 'Douglas E. Schoen', 'Dwight Eisenhower']",fox,0.698605561614771,[],2015-11-15 14:32:00,"['Senate Democrats', 'GOP']",3008ee479035bc3ab78e5b9abb8cfda6,2015-11-15 15:16:56.373657
"WashingtonThe Democratic candidates for president gathered in Des Moines, Iowa, for their second debate Saturday, and CNN's Reality Check team spent the night putting their statements and assertions to the test.The team of reporters, researchers and editors across CNN selected key statements and rated them: True; Mostly True; True, but Misleading; False; or It's Complicated.Previous CNN Reality Check coverage of the Democratic and Republican candidates can be found here. This story will be updated throughout the night.Reality Check: Sanders on vets with PTSDBy Debra Goldschmidt, CNN HealthVermont Sen. Bernie Sanders said, ""When you talk about the long-term consequences of war, let's talk about the men and women who came home from war, the 500,000 who came home with PTSD and traumatic brain injury.""Roughly 2.6 million veterans served in Iraq and Afghanistan, and the U.S. Department of Veteran Affairs says 11% to 20% of military members who served in Iraq and Afghanistan suffer from PTSD.According to a Veteran Affairs independent study on traumatic brain injury, self-reported data found 15% of troops who were engaged in active combat in Afghanistan and Iraq ""may have suffered"" a mild traumatic brain injury. This falls in line with a report from the Brain Trauma Foundation, which found between 10% to 20% of Iraq veterans suffer from some level of traumatic brain disorder.Verdict: TrueReality Check: O'Malley on net immigration from MexicoBy Sonam Vashi, CNNFormer Gov. Martin O'Malley said, ""The truth of the matter is net immigration from Mexico last year was zero."" He then challenged viewers to fact-check him, and we couldn't resist.According to the Pew Research Center, net migration from Mexico probably reached zero in 2010, and more Mexicans have left the United States than arrived since then.Additionally, the actual number of Mexicans living in the United States consistently declined throughout 2014. The U.S. Border Patrol also reported that in the 2014 fiscal year, the number of Mexicans apprehended along the border decreased 14% when compared to the 2013 fiscal year.The information we have suggests that the net immigration rate is negative -- which is actually not zero -- but it is close, and probably still supports O'Malley's point.Verdict: Mostly true",,,Democratic debate: CNN's Reality Check team inspects the claims,http://www.cnn.com/2015/11/14/politics/democratic-debate-fact-check/index.html,['immigration'],"['Bernie Sanders', u""Martin O'Malley""]",cnn,0.5480945459848154,"[{'author_id': 45638, 'fullname': u""cnn's reality check team"", 'primary_org': 'cnn'}]",2015-11-15 04:09:39,"['U.S. Border Patrol', 'Pew Research Center']",5f763ceb49f12a5e357faeff8b4407dd,2015-11-15 04:16:08.650830
