body,byline,description,title,url,topics,people,org,election_confidence,authors,date_written,orgs,article_id,date_access
" (AP) â With the country still reeling from deadly terrorist attacks in Paris, Hillary Rodham Clinton cast herself as America's strongest leader in a scary world, even as she found herself forced to defend her own role during the rise of the Islamic State militants.""This election is not only about electing a president, it's also about choosing our next commander in chief,"" Clinton declared Saturday night in the Democrats' second debate of the presidential campaign. ""All of the other issues we want to deal with depend upon us being secure and strong.""Amid the backdrop of global anxiety, Clinton found herself fending off questions about not only her foreign policy record but her economic ties, with both Vermont Sen. Bernie Sanders and former Maryland Gov. Martin O'Malley painting the former senator from New York as a lackey for Wall Street and corporate interests.""Let's not be naive about it,"" said Sanders, noting that Clinton collected millions in campaign donations from Wall Street bankers. ""They expect to get something. Everybody knows that.""Clinton defended her relationship with Wall Street, citing her work in the aftermath of the Sept. 11, 2001, attacks, but her statement met with criticism from Republicans who accused her of politicizing the terrorist assaults.The barbs marked a far more aggressive shift in a primary race that has so far been notable for its civility. Democrats have spent months boasting about the substantive tone of their contest, attempting to set up a favorable early contrast with the ""carnival barker"" insults of the crowded Republican primary.Since the Democrats' first debate a month ago, Clinton has built a lead in the early voting states, gains that have come amid other signs the party is coalescing behind her. But the nomination fight is far from over.Saturday night, Clinton faced criticism of her national security record, when Sanders traced the current instability in the Middle East to the U.S. Senate's vote â including Clinton's â to authorize military action in Iraq in 2002. He said that U.S. invasion ""unraveled the region.""The former secretary of state fought back, saying terrorism has been erupting for decades, specifically mentioning the Sept. 11 attacks. She said the recent unrest in Libya and other parts of the Middle East is symptomatic of an ""arc of instability from North Africa to Afghanistan.""She rejected the idea that she and the rest of the Obama administration underestimated the growing threat of the Islamic State.The back-and-forth revealed a foreign policy split within the Democratic Party, with Sanders playing to the anti-war activists who boosted then-Illinois Sen. Barack Obama to victory in 2008.Sanders argued for a far more hands-off approach, advocating for Muslim countries to lead the fight and declaring that the war against Islamic State militants is about the ""soul of Islam.""Clinton has a history of advocating for more robust involvement across the globe â both as a presidential candidate eight years ago and as Obama's secretary of state. In recent weeks, she has called for a more aggressive U.S. role in the Syrian conflict, including a no-fly zone over the area, a move the Obama administration opposes. But she stood by her opposition to seeking a formal declaration of war against the Islamic State.All the candidates denounced the attacks, and the debate began on a solemn note with a moment of silence followed by the previously unplanned foreign policy questions.They gave some fodder to their Republican critics, who coupled condemnation of the Paris attacks during the day with sharp criticism for Obama and his former secretary of state, Clinton.""We are at war with violent extremism, we are at war with people who use their religion for purposes of power and oppression,"" said Clinton, arguing the U.S. is not at war with Islam or all Muslims. ""I don't want us to be painting with too broad a brush.""Sanders and O'Malley agreed with her sentiments, saying the term ""radical Islam"" used by Florida Sen. Marco Rubio and other Republican presidential candidates, is unnecessarily offensive to American Muslims.Republicans immediately seized on the remarks. ""Yes, we are at war with radical Islamic terrorism,"" tweeted former Florida Gov. Jeb Bush.The conversation later pivoted to economic issues, with the candidates tangling over how to pay for their plans to expand college affordability, family leave and prescription drug coverage.The conversation revealed how Sanders' message has helped shift the party to the left on some economic issues.All three agreed that wealthy citizens and corporations should pay more in taxes to benefit the middle class. They tangled over how high to increase the minimum wage, with Clinton backing a $12-per-hour federal floor while Sanders and O'Malley said $15 an hour â the rate being pushed by a campaign of fast-food workers and labor unions. And they fought over the degree to which they would curtail large financial institutions, with Sanders describing Wall Street's business model as ""greed and fraud"" â a startling judgment for a major presidential candidate.""I'm not that much of a socialist compared to Eisenhower,"" joked Sanders, saying the former president backed a 90 percent marginal tax rate.While Clinton is wary of alienating Sanders backers whose support she'll need should she win the nomination, she did take a few shots. She attempted to cast some of Sanders major proposals, including a single payer health care system and free college, as politically unrealistic.""The revolution never came,"" she said, in a knock on his call for a ""political revolution."" ''I waited and I got the scars to show for it.""Sanders may have inadvertently helped her in the first debate, when he seemed to dismiss the controversy over her use of a private email account and server by saying Americans are tired of hearing about her ""damn emails.""Saturday night, Sanders declined once again to attack:  ""I am still sick and tired of Hillary Clinton's email,"" he said.""I agree completely,"" said Clinton, with a laugh.___Lisa Lerer reported from Washington. Follow her on Twitter at: http://twitter.com/llerer",,"DES MOINES, Iowa (AP) — With the country still reeling from deadly terrorist attacks in Paris, Hillary Rodham Clinton cast herself as America's strongest leader in a scary world, even as she found herself forced to defend her own role during the rise of the Islamic State militants.","After attacks, Democrats debate terrorism and economy",http://hosted2.ap.org/APDEFAULT/89ae8247abe8493fae24405546e9a1aa/Article_2015-11-15-US--DEM%202016-Debate/id-b1119a79e3cb48fc925b4b1cc23a45b7,"['foreign policy/national security', 'economy']","[u""Martin O'Malley"", 'Jeb Bush', 'Hillary Clinton', 'Lisa Lerer', 'Hillary Rodham Clinton', 'Marco Rubio', 'Barack Obama', 'Bernie Sanders']",ap,0.9601124224145782,"[{'author_id': 39735, 'fullname': 'lisa lerer', 'primary_org': 'ap'}, {'author_id': 39392, 'fullname': 'ken thomas', 'primary_org': 'ap'}]",2015-11-15 00:29:00,"['Democratic Party', 'DES MOINES']",90c45191172a386e74147537bc3ab9f8,2015-11-15 06:00:04.650773
"Democratic U.S. presidential candidates Senator Bernie Sanders (L), former Secretary of State Hillary Clinton and former Maryland Governor Martin O'Malley pose on stage ahead of the second official 2016 U.S. Democratic presidential candidates debate in Des Moines, Iowa, November 14, 2015.    REUTERS/Mark KauzlarichDemocratic U.S. presidential candidates Senator Bernie Sanders (L), former Secretary of State Hillary Clinton and former Maryland Governor Martin O'Malley pose on stage ahead of the second official 2016 U.S. Democratic presidential candidates debate in Des Moines, Iowa, November 14, 2015.   (REUTERS/Jim Young)PreviousNextHillary Clinton faced tough criticism Saturday night from her Democratic rivals over everything from her Middle East policies to her swaying stance on gun control to her Wall Street ties, at a debate that saw both Bernie Sanders and Martin O’Malley step up their attacks on the party’s front-runner.The former secretary of state was put on the defensive almost immediately, as she was challenged by her rivals -- and the moderator -- over military interventions she backed in countries now gripped by instability. Vermont Sen. Sanders ripped her support for “regime change.”  But while the Paris terror attacks the night before shifted the early presidential debate focus to national security, the candidates sparred aggressively in the latter half over domestic issues – especially financial industry reform and Clinton’s Wall Street support.Former Maryland Gov. O’Malley called her the “candidate of Wall Street.”Asked about her hefty Wall Street-backed speaking fees and donations, Clinton defended her independence in being able to pursue financial industry reform.But Sanders shot back, “Not good enough.”“Let's not be naive about it. Why …has Wall Street been the major campaign contributor to Hillary Clinton?” he said. “You know, maybe they're dumb and they don't know what they're going to get, but I don't think so.”He and O’Malley, unlike Clinton, both want to re-instate a Depression-era banking law known as Glass-Steagall – and they both criticized Clinton’s Wall Street plans as not going far enough. O’Malley called it “weak tea.”In an eyebrow-raising moment, Clinton countered Sanders’ criticism of her Wall Street donations by saying that as New York senator, she helped “rebuild” Wall Street and downtown Manhattan after 9/11.Clinton was later asked about social media reaction claiming she had invoked 9/11 to justify financial industry donations; Clinton said she’s sorry that anyone had that “impression.”Meanwhile, she said she doesn’t think her rivals’ financial industry plans – particularly to reinstate the Depression-era law that separated investment and commercial banking – would get the job done.“I'm all about making sure we actually get results,” Clinton said.The debate in Des Moines, Iowa, came in the wake of the Paris terror attacks, which thrust the issues of national security and foreign policy back to the center of the 2016 campaign. The format of the debate – hosted by CBS News, KCCI-TV and The Des Moines Register -- was changed to focus anew on those issues in the beginning.Clinton tried to highlight her deep experience in foreign policy issues from the outset.“This election is not only about electing a president. It's also about choosing our next commander-in-chief,” she said.But, citing the chaos in the Middle East and North Africa, Clinton’s rivals soon turned to her record as U.S. senator and later as secretary of state to question her judgment in foreign policy matters.O’Malley appeared to criticize her support for toppling Libyan dictator Muammar Qaddafi.He said America’s role is not to roam the world “looking for new dictators to topple.” He said it is also important to understand “secondary and third consequences” that come after removing a “single dictator.” O’Malley called Libya, Syria and other countries in the region a “mess.”Clinton defended her support for ousting Qaddafi, saying he was threatening a “genocide” and America’s European and Arab allies asked for U.S. support. And to O’Malley’s critique, she said, “I don’t think you can paint with a broad brush” in an “incredibly complicated region of the world.”Sanders, meanwhile, referenced Clinton’s Senate vote for the use of force in Iraq and said the “disastrous invasion” led “to the rise of Al Qaeda and to ISIS.” The senator also claimed that “climate change is directly related to the growth of terrorism.”Clinton again called her Iraq war vote a “mistake,” but disputed that the war is the only driver of modern terrorism.She and O’Malley briefly sparred over America’s role in fighting ISIS. After Clinton said it “cannot be an American fight, although American leadership is essential,” O’Malley said, “This actually is America’s fight,” though not “solely” America’s fight.Sanders staked out a different position in saying it is the nations in the region that “have to get their hands dirty.”“Those Muslim countries are going to have to lead the effort,” he said.The candidates declined to categorize the threat itself as “radical Islam.” Asked about that categorization, Clinton said only, “I don’t think we’re at war with Islam.”All the candidates on stage condemned the Paris terror attacks and vowed to take on the threat of terror.“It cannot be contained. It must be defeated,” Clinton said of ISIS, appearing to distance herself from President Obama, who hours before the Paris attacks claimed ISIS was “contained.”The attacks across multiple locations in Paris killed at least 129 people and wounded hundreds, officials said. It brought the issue of terrorism to the forefront of both party’s presidential primary races. Ostensibly, it is an area where Clinton enters with the thickest resume – but also one that could, as the debate showed, prove problematic given her involvement shaping the policies in increasingly unstable nations like Libya and Syria.While the tragedy hung over the debate, the candidates were able to tackle of range of domestic issues including wages and immigration.O’Malley landed virtually the only shot of the night against Republican candidate Donald Trump, a favorite target of the Democrats, by calling him an “immigrant-bashing carnival barker.” The Democratic candidates generally agree on the call for comprehensive immigration reform with a path to citizenship for illegal immigrants in the country.Sanders, meanwhile, continued to advocate for a $15 minimum wage.But the candidates were divided on gun control. While Clinton has tried in the past to cast Sanders as soft on the issue, O’Malley accused Clinton of being “on three sides of this.”“When you ran in 2000, you said we needed federal robust regulations, then in 2008 you were portraying yourself as Annie Oakley and saying we don't need those regulations ... and now you’re coming back around here,” he said.The debate was notable in that it saw Sanders and O’Malley taking a more aggressive tone against the front-runner, who seemed to have strengthened her hand since their initial debate.Since that debate, two candidates have dropped out, leaving only Sanders and O’Malley. She also made it through a lengthy hearing before the Benghazi congressional committee and saw one of her biggest potential political threats – a late bid by Vice President Biden – disappear as the vice president announced he would not run.Sanders remains Clinton’s biggest challenge, and has stirred an enthusiasm in the Democratic base that Clinton has struggled to evoke. But nationally and in Iowa, she continues to lead him by double digits in the polls.Still, the FBI investigation over Clinton’s use of a personal email and server while secretary of state looms over her bid, with the probe said to be expanding. Sanders appeared to give her a pass on the email issue at the first debate by saying he was tired of hearing about the controversy.Sanders, though, stood by his comments at the second debate Saturday night: “I was sick and tired of Hillary Clinton’s email, I’m still sick and tired of Hillary Clinton’s email. … Let’s go to the major issues facing America.” ",,"Hillary Clinton faced tough criticism Saturday night from her Democratic rivals over everything from her Middle East policies to her swaying stance on gun control to her Wall Street ties, at a debate that saw both Bernie Sanders and Martin O’Malley step up their attacks on the party’s front-runner.  ","Clinton hit by Dem rivals over Wall St. ties, Mideast policies at 2nd debate",http://feeds.foxnews.com/~r/foxnews/most-popular/~3/V8TEBB0dgZ8/,"['foreign policy/national security', 'immigration']","[u""Martin O'Malley"", 'Jim Young', 'Hillary Clinton', 'Donald Trump', 'Muammar Qaddafi', 'Bernie Sanders']",fox,0.9974292038547423,[],2015-11-15 05:15:16,"['Senate', 'Al Qaeda', 'FBI']",79bd7c26a3cede5c90902c1c11117ed4,2015-11-15 06:14:21.385069
"Democratic presidential candidates Bernie Sanders, Hillary Clinton and Martin O'Malley debate in Des Moines, Iowa.",,"Democratic presidential candidates Bernie Sanders, Hillary Clinton and Martin O'Malley debate in Des Moines, Iowa.",Democratic debate in Iowa,http://www.cnn.com/2015/11/15/politics/gallery/democratic-debate-iowa/index.html,"['personality', 'campaign_finance']","['Bernie Sanders', 'Hillary Clinton', u""Martin O'Malley""]",cnn,0.7807667701681759,[],2015-11-15 13:34:05,[],920429bdc2037b8c788e02d99abc6669,2015-11-15 14:01:26.727014
" (CNN)Bernie Sanders hasn't decided just how much he wants to raise taxes, but he is promising this:""It will not be as high as the number under Dwight D. Eisenhower, which was 90%.""""I'm not that much of a socialist, compared to Eisenhower,"" Sanders said to laughs at the second Democratic presidential debate in Des Moines, Iowa.The Vermont senator, a political independent who describes himself as a ""democratic socialist,"" has made tax hikes -- to be used to pay for his ambitious social programs -- an unabashed part of his campaign pitch.The top marginal tax rate in 2015 is 39.6%. During the Eisenhower administration, the highest rate never dipped below 91%, according to the Tax Foundation. ",,"Bernie Sanders hasn't decided just how much he wants to raise taxes, but he is promising this:",Sanders: Eisenhower hiked taxes more than I would,http://www.cnn.com/2015/11/14/politics/democratic-debate-bernie-sanders-eisenhower-tax-rates/index.html,"['budget/taxation', 'personality']","['Bernie Sanders', 'Dwight D. Eisenhower']",cnn,0.684129033751907,"[{'author_id': 44270, 'fullname': 'gregory krieg', 'primary_org': 'cnn'}]",2015-11-15 03:39:17,['Tax Foundation'],93558420913b76a90b6b4cd15f001e72,2015-11-15 04:01:27.601134
" (CNN)Hillary Clinton, Bernie Sanders and Martin O'Malley met for the second Democratic presidential primary debate on Saturday night, an event that finally saw a fight between the front-runner and her chief opponent, but also coming a day after a deadly terror attack that shocked the world. Here are the six key takeaways from the debates:Clinton distanced herself from President Barack Obama's now-controversial comment in an interview Thursday that the U.S. had ""contained ISIS."" During Saturday's debate, Clinton asserted that ISIS ""cannot be contained"" and must simply be ""defeated."" As she has in the past, Clinton also suggested that she had argued ""early on that we needed to find a way to train and equip moderates."" Clinton reportedly argued for a more forceful administration plan to help the Syrian opposition early on in the civil war that has since exploded.RELATED: Hillary Clinton at Democratic debate: ISIS 'cannot be contained'The Vermont senator in the first debate appeared unprepared or unwilling to go after Clinton with any real vigor.But Saturday night, Sanders suggested Clinton is in the pocket of Wall Street and tied her vote to authorize the war in Iraq to the rise of ISIS. Clinton, meanwhile, knocked Sanders on his mixed record on guns and suggested his policy proposals are too simplistic.In the most forceful exchange of the night, Sanders pointed to the millions of dollars in donations Wall Street has funneled to Clinton's campaigns over her political career.""Why over her political career has Wall Street been a major, the major campaign contributor to Hillary Clinton? Maybe they're dumb and they don't know what they're going to get, but I don't think so,"" Sanders said. ""I have never heard a candidate, never, who has received huge amounts of money from oil, from coal, from Wall Street from the military industrial complex, not one candidate -- 'Oh these, these campaign contributions will not influence me.' But why do they make millions of dollars of campaign contributions? They expect to get something, everybody knows that.""RELATED: Democratic debate: CNN's Reality Check team inspects the claimsClinton responded by accusing Sanders of impugning her ""integrity,"" before claiming that Wall Street has supported her because of the work she did to rebuild the Financial District after it was hit in the 9/11 attack on the World Trade Center.  As she did in the first debate, Clinton hit Sanders on guns, calling the Vermont senator's vote to shield gun makers from some lawsuits a ""terrible mistake"" and urging Sanders to admit as much, as she has done regarding her Iraq vote.Sanders responded by suggesting there's little daylight between himself and Clinton and O'Malley on guns.Sanders didn't take the gloves off completely during Saturday night's debate in Iowa.Instead, he took a pass on one of the biggest points of contention of the 2016 cycle: Clinton's record as secretary of state.Given a chance to slam Clinton's tenure, Sanders demurred, instead pivoting to his ""disagreement"" with Clinton over her vote in favor of the Iraq War in 2002, more than six years before she became secretary of state.Republicans are already picking apart Clinton's track record as secretary of state, but Sanders' simply wouldn't take the bait.It was reminiscent of Sanders' ""damn emails"" moment in the first Democratic debate, when he said Americans are tired of hearing about the controversy over Clintons' use of personal email during her time as secretary of state.However, Clinton's response to Sanders -- when she beat back the suggestion that she is influenced by Wall Street donors -- could really come back to bite her.Clinton explained her connection to Wall Street by tying her relationship to her role in helping to rebuild New York's financial district after the 9/11 attacks.Twitter was ablaze Saturday night over the response, and the Republican National Committee was quick to blast out a best-of compilation of political observers' reactions.It's not the only moment that could come back to haunt Clinton -- especially if she faces a younger GOP nominee, like Sen. Marco Rubio of Florida.Clinton at one point said she is ""from the '60s"" -- a moment in the debate that could be replayed in political ads down the line suggesting she is part of the past, not the future, of American leadership.The debate Saturday night began with the candidates pausing on stage, taking a moment of silence to remember the victims of the terrorist attacks that ripped Paris apart just a day earlier.  Clinton said while ""our prayers are with the people of France tonight...that is not enough"" and called for better coordinated efforts to root out ISIS, the radical group that claimed responsibility. She said Americans should see the terrorist attack as a reminder that the election ""is not only about electing a president, it's also about choosing our next commander in chief.""Sanders made brief note of the terrorist attacks at the top of his opening statement, but quickly pivoted to the core message of the campaign: ""a rigged economy"" that benefits billionaires.Still, Sanders made a bold claim in his reference to Paris: ""Together, leading the world, this country will rid our planet of this barbarist (sic) organization called ISIS.""And O'Malley, after saying his heart goes out ""to the people of France in this moment of loss,"" quickly called for ""fresh thinking"" and ""new approaches"" -- a definitive nod to his youth and the generational contrast the  52-year-old offers to Clinton's 68 years and Sanders' 74.All three candidates refused to say the fight was with radical Islam, instead focusing on using the word ""jihadist"" to describe the threats spotlighted in the Paris attacks. RELATED: Clinton calls out 'radical jihadist ideology'O'Malley delivered several strong one-liners throughout the night, notably when he slammed Republican front-runner Donald Trump as a ""carnival barker"" for his immigration policies.But O'Malley also missed a couple of key moments where he could have shined. His central contention is that it's time for a new generation of leadership -- meaning no more baby boomers like Clinton. But he lacked a strong, convincing response to one of the debate's final questions: When have you been most tested in your life, and how did it prepare you for the presidency? O'Malley's response conceded that he is untested -- that nothing he's been through as mayor of Baltimore or governor of Maryland comes close to the crises he would face as President.Trump later responded to O'Malley's insult on Twitter by calling him a ""clown."" ",,,Takeaways from the Democratic presidential debate,http://www.cnn.com/2015/11/15/politics/democratic-debate-key-takeaways/index.html,['foreign policy/national security'],"[u""Martin O'Malley"", 'Hillary Clinton', 'Donald Trump', 'Marco Rubio', 'Barack Obama', 'Bernie Sanders']",cnn,0.9948085516716363,"[{'author_id': 2323, 'fullname': 'jeremy diamond', 'primary_org': 'cnn'}]",2015-11-15 05:40:18,"['World Trade Center', 'Republican National Committee', 'GOP']",c28fb23d87e1883fc57bffcce551dc8f,2015-11-15 06:01:45.852422
