body,byline,description,title,url,topics,people,org,election_confidence,authors,date_written,orgs,article_id,date_access
"i            Democratic presidential candidates Bernie Sanders, Hillary Clinton and Martin O'Malley stand on the stage prior to Saturday's Democratic primary presidential debate in Des Moines, Iowa.                                                        Alex Wong/Getty Images                            hide captionitoggle caption                Alex Wong/Getty Images            Democratic presidential candidates Bernie Sanders, Hillary Clinton and Martin O'Malley stand on the stage prior to Saturday's Democratic primary presidential debate in Des Moines, Iowa.                        Alex Wong/Getty Images                    Hillary Clinton entered the second debate of the campaign for the Democratic presidential nomination with far less to prove than she had in the first, and, in the end, she probably achieved far less as well. But for the time being, at least, she may be able to afford it. The first debate, in October, corresponded with a time of stress for her candidacy, besieged by various legal and political investigators and drifting downward in voter-preference polls. But Clinton did so well and struck such a blend of competence and charm in the October debate on CNN that she was widely acknowledged to have rescued her fortunes — or at least strengthened her hand. This latest debate on CBS News and staged at Drake University in Des Moines, Iowa, was never likely to have as great an impact. The likely audience was limited. It was staged on a Saturday night, competing with various sports and entertainment programs. This weekend, in particular, it was overshadowed by the tragedy unfolding in Paris, where at least 129 people died in terrorist attacks Friday night. The group known as Islamic State claimed responsibility for the coordinated attacks by teams of gunmen and suicide bombers. The debaters observed a moment of silence for the victims in Paris and devoted the first quarter of the debate to discussing the attacks and the proper response from the U.S. and its allies. All agreed the U.S. had a major, leading role to play in battling the terrorists, but all also agreed that U.S. allies needed to respond with greater commitment as well. Sen. Bernie Sanders of Vermont noted that the struggles in the Middle East amounted to ""a war for the soul of Islam,"" implying it was a contest beyond the power of the U.S. government to resolve. But Sanders also explicitly assigned responsibility for the current turmoil in the Middle East to the administration of George W. Bush, whose invasion of Iraq in 2003 was responsible for ""all this instability,"" he said. Sanders made the point that he had opposed the invasion on the Senate floor, where Clinton had voted in support. Clinton has since called that vote a mistake. But the most difficult part of that first segment of the debate for Clinton came when CBS News debate moderator John Dickerson asked whether her prescriptions for the fight against the group called Islamic State suffered for her association with President Obama, who has been downplaying, or underestimating, the strength of the group. As recently as this week, the president had said the group had been ""contained,"" at least in its territorial ambitions in Iraq and Syria. On this, Clinton distanced herself from the president somewhat, saying she had advised more involvement in the region after the withdrawal of U.S. troops from Iraq — a shift she said was mandated by the agreement struck with Iraq by the last Bush administration. She had said she warned that ""extremist groups might fill the vacuum."" Sanders said several times that the Department of Defense budget was already $600 billion and that the U.S. should be hesitant to increase that greatly without knowing what it was expecting to accomplish with more military hardware. A self-described Democratic Socialist, Sanders also contrasted his reliance on small donors with the Clinton campaign's donations from the wealthy of Wall Street: ""Maybe they're stupid about what they're going to get [in return], but I don't think so."" Clinton then insisted on a chance to respond, because Sanders had ""impugned my integrity."" That drew an audible sound of anticipation from the crowd, which may not have expected even this degree of confrontation between the candidates after the harmony of the first debate. Clinton then said she had many thousands of donors, most of them not rich, and 60 percent of them women. Although not directly responsive to the Wall Street thrust from Sanders, Clinton's reference to gender prompted applause and cheers from the crowd. This was her best moment of the debate, according to people following the proceedings on social media such as Twitter. Clinton went on to suggest her contributions from Wall Street stemmed from appreciation for all she had done to help the Lower Manhattan financial industry recover from the terror attacks of September 2001. That rationale drew a decidedly mixed response from the audience in the hall and on social media, with many questioning whether it fully explained the generous contributions she still receives from the financial industry more than a dozen years later. .@HillaryClinton vehemently offers support for Wall Street as post-911 recovery effort.  Does that fly?— David Axelrod (@davidaxelrod) November 15, 2015Sanders said Clinton's plan to increase regulation of the financial industry was ""not good enough,"" and he had corroborating support from third-place challenger Martin O'Malley, the former governor of Maryland, who called the Clinton plan ""weak tea."" The candidates revisited a divide on gun violence, with Sanders saying he was willing to reconsider his past opposition to legislation stripping gun manufacturers of their liability when their products were used in the commission of crimes. O'Malley sided with Clinton on this issue, only moments after favoring Sanders' point of view on banking regulation. But, in general, the candidates were largely in agreement on major issues. They agreed that President Obama had been right to offer a path to citizenship for young people brought to the U.S. illegally while still minor children. ""The symbol of America is the Statue of Liberty,"" said O'Malley, ""not a barbed-wire fence."" O'Malley also won cheers from the crowd for his reference to ""that immigrant-bashing carnival-barker Donald Trump,"" a reference to the candidate leading most polls among Republican candidates for president. All three candidates supported greater access to a college education, with Sanders saying all public universities and colleges should be tuition-free. Clinton said she did not think taxpayers should pay for Trump's children to go to college, as he is a billionaire. O'Malley noted that he had held the line on tuition increases at state schools when he was a governor. And neither Sanders nor O'Malley took the bait when asked whether Clinton's private e-mail server should have been used for any kind of government business. Sanders in particular refused the chance to criticize her on the issue, saying he was still ""tired of her emails,"" as he had said in the first debate. Dickerson then asked Clinton if there were ""other shoes to drop"" as multiple investigations proceed into her time in office and the activities of her aides. Clinton alluded to her 11 hours of testimony before a House investigative panel last month as an indication to the contrary. Overall, the debate did not seem likely to affect Clinton's standing in the primary field. Despite moments of vulnerability and dubious reaction to her defenses regarding Wall Street contributors, she remained the strong center of the cast on stage. She had 40 percent of the total speaking time, with 35 percent going to Sanders and 25 percent to O'Malley. But as she had arrived at this juncture of the campaign as not only the leader but an increasingly dominant leader, Clinton had little room to improve. Dickerson also invited favorable comparison to his predecessors in the role of debate moderator. His questions were crisp, to the point and frequently challenging — but without the argumentative tone that has brought criticism from participants in earlier debates on the Republican side.",,"Former Maryland Gov. O'Malley won cheers referring to ""that immigrant-bashing carnival barker Donald Trump,"" and adding ""the symbol of America is the Statue of Liberty, not a barbed-wire fence.""","Clinton And Rivals Cross Swords In Second Debate, But Cause No Wounds",http://www.npr.org/2015/11/15/456082324/clinton-and-rivals-cross-swords-in-second-debate-but-cause-no-wounds,['foreign policy/national security'],"[u""Martin O'Malley"", 'John Dickerson', 'Hillary Clinton', 'Donald Trump', 'George W. Bush', 'David Axelrod', 'Bernie Sanders', 'Alex Wong']",npr,0.9637297713515782,"[{'author_id': 707, 'fullname': 'ron elving', 'primary_org': 'npr'}]",2015-11-15 15:39:34,"['Senate', 'Department of Defense', 'Statue of Liberty']",7e4ddf68b8279cb0b7cffa129e045a28,2015-11-15 16:00:04.545163
"Democrats and Republicans, based on their recent presidential debates, are set to offer voters a stark choice in 2016 about how the economy should be managed, with both sides moving toward the outer flanks of their parties.In Saturday’s Democratic debate, candidates said they would seek to rein in Wall Street, raise taxes, increase the minimum wage and expand the federal government’s role in health care. Republicans, meanwhile, are competing to repeal regulations, cut taxes, keep the minimum wage as it stands and roll back President Barack Obama’s signature health-care overhaul.The parties right now “have polar opposite analyses of how the economy works and how it should work,” said Jared Bernstein, a former economic adviser in the Obama administration. “It’s obvious but underappreciated how far apart they are on the fundamentals—wages, taxes, financial markets.”Former Secretary of State Hillary Clinton and her top challenger, Vermont Sen. Bernie Sanders, sparred Saturday over how to pay for new federal investments in education, infrastructure and health care. Both called for raising taxes on the wealthy, although Mrs. Clinton pledged to do so without hitting families that earn less than $250,000 or increasing deficits, which would constrain new spending ambitions.Mr. Sanders wouldn’t say exactly how high tax rates should rise but noted the top tax rate had been 91% in the 1950s under President Dwight D. Eisenhower, a Republican. “I’m not that much of a socialist compared to Eisenhower,” Mr. Sanders said.Republicans have put tax-cutting proposals at the heart of their economic policy agenda, and they have largely shied away from promises made by candidates four years ago to avoid running up budget deficits.The boldness of some proposals drew warnings from one candidate, Ohio Gov. John Kasich, at last week’s Republican presidential debate. “Hillary and the Democrats promise everything on the spending side. We’ve got to be responsible about what we propose on the tax side,” he said.Republicans at last week’s debate also dismissed efforts to boost the federal minimum wage, now at $7.25 an hour, as an ineffective way to raise incomes. Florida Sen.  Marco Rubio and businessman  Donald Trump said it would put U.S. workers at a disadvantage. “You’re going to make people more expensive than a machine,” Mr. Rubio said.Democrats on Saturday debated whether to target a federal minimum wage of $12 or $15 an hour. Mr. Sanders supports the higher threshold, an effort backed by labor unions. He brushed aside warnings issued recently by Alan Krueger, the Princeton University professor who served as Mr. Obama’s top economist, that a $15 minimum wage is an untested, risky level. His research contends minimum-wage increases haven’t decreased employment, and he supports raising wages to $12 an hour.“I do take what Alan Krueger said seriously,” said Mrs. Clinton, who also has endorsed the $12 floor.Mr. Sanders and Martin O’Malley, the third candidate at Saturday’s debate and a former Maryland governor, said they would shun anyone with Wall Street ties from top positions in their administrations, including figures such as  Robert Rubin and Larry Summers, who served as treasury secretaries for President  Bill Clinton.Some Democrats have faulted that approach. “The idea that you have to excommunicate anybody who ever worked in the financial sector is ridiculous,” said Will Marshall, president of the Progressive Policy Institute, a centrist Democratic think tank. “We need people who oversee the Federal Reserve system and have high posts at Treasury that have expertise in finance.”Both Republicans and Democrats have promised to crack down on Wall Street, but they disagree sharply over how to do it. Republicans generally have blamed government policies, from housing to Federal Reserve interest-rate decisions, for provoking the financial crisis. They say the Dodd-Frank Act in particular has restrained economic growth and should be repealed.Democrats quarreled Saturday over whether the regulatory overhaul had gone far enough by failing to reinstate a New Deal-era law that separated commercial and investment banking, known as the Glass-Steagall Act.The flare-up over banking laws reflected Mr. Sanders’s broader critique that Democrats and Republicans have given banks too much political power, a throwback to the “trust busting” of President Theodore Roosevelt more than a century ago. Why do big industries make “millions of dollars of campaign contributions? They expect to get something,” he said in Saturday’s debate. “Everybody knows that.”Both parties did agree in the past week on one thing: the virtues of community banks. Republicans warned that too many were going out of business. Mr. Sanders said Saturday that they needed more support. “That’s the future of banking in America,” he said.Write to Nick Timiraos at nick.timiraos@wsj.com",,"Democrats and Republicans, based on their recent presidential debates, are set to offer voters a stark choice in 2016 about how the economy should be managed, with both sides moving toward the outer flanks of their parties.",Parties' Divide on Economy Widens,http://www.wsj.com/articles/parties-divide-on-the-economy-widens-1447633374,['economy'],"['Theodore Roosevelt', u""Martin O'Malley"", 'Alan Krueger', 'Bill Clinton', 'Hillary Clinton', 'Dwight D. Eisenhower', 'John Kasich', 'Donald Trump', 'Frank Act', 'Marco Rubio', 'Barack Obama', 'Robert Rubin', 'Bernie Sanders', 'Nick Timiraos', 'Jared Bernstein', 'Larry Summers']",wsj,0.9974921961765002,"[{'author_id': 1142, 'fullname': 'nick timiraos', 'primary_org': 'wsj'}]",2015-11-16 00:47:47,"['Federal Reserve', 'Progressive Policy Institute', 'Princeton University', 'Treasury']",484ee671ab80d4804ea360c0a75d43e0,2015-11-16 01:02:09.678920
"WASHINGTON The deadly attacks in Paris pushed terrorism and the Syrian refugee crisis to the center of the U.S presidential campaign on Sunday, as Republicans hammered Obama administration plans to take in more refugees as well as Democratic front-runner Hillary Clinton's stance on Middle East policy.After officials said one of the Paris gunmen might have slipped into Europe among refugees fleeing Syria's war, more Republicans voiced their opposition to the 10,000 Syrian refugees the White House wants to admit in the coming year.""Bringing people into this country from that area of the world I think is a huge mistake,"" Republican candidate Ben Carson said on the ""Fox News Sunday"" program, echoing comments by fellow Republican contenders on Saturday.While the U.S. number is a fraction of the hundreds of thousands of refugees that Europe is prepared to take, the plan has become a main point of attack for candidates seeking to show a tougher stance on terrorism.The deadliest attack in Europe in a decade could end up reshaping the race to elect a U.S. president in 2016.Clinton, a former secretary of state under President Barack Obama, told a debate on Saturday in Iowa that she supported raising the refugee intake to 65,000, but only with a careful screening and vetting process.Ben Rhodes, deputy national security adviser for Obama, defended the administration's vetting process as thorough and made a humanitarian appeal.""We're also dealing with people who've suffered the horrors of war, women and children, orphans. We can't just shut our doors to those people,"" he said on NBC's ""Meet the Press.""Earlier this month, the administration announced plans to accelerate the process for Syrian refugees hoping to enter the United States with new screening outposts in Iraq and Lebanon. More on the Syrian refugee screening processThe events in Paris have highlighted a double-edged foreign policy problem for Clinton. As America's top diplomat from 2009 to 2013, she has international experience none of her rivals can match but can also be called to account for failings on her watch.Clinton's Democratic and Republican opponents said the administration had misjudged the Middle East and underestimated Islamic State, the militant group that claimed credit for bomb and gun attacks that killed at least 132 people in Paris on Friday.Republican presidential candidate Senator Lindsey Graham said on CNN's ""State of the Union"" on Sunday that if he were elected, the United States would be ""part of a world-wide force to destroy ISIL,"" another acronym for Islamic State.""Hillary Clinton,"" he added ""seems to be disconnected from what you need to do. She won’t embrace boots on the ground.""VETTING UNDER SCRUTINYFlorida Senator Marco Rubio, another Republican candidate, said on ABC's ""This Week with George Stephanopoulos"" that just one vetting oversight could jeopardize public safety. ""You can have a thousand people come in and 999 of them are just poor people fleeing oppression and violence, but one of them is an ISIS fighter. ... If that's the case, you have a problem,"" Rubio said.Fellow Republican contenders, Ohio Governor John Kasich and former Florida Governor Jeb Bush, have been open to accepting more refugees, but they echoed Rubio's concerns about vetting. ""We can't be in a position of inviting the enemy in, and frankly we better be careful about looking at Americans that have traveled"" in the region, Kasich said on Fox News' ""Sunday Morning Futures with Maria Bartiromo.""Bush said on ""Meet the Press"" the United States had a special responsibility to help Syrian Christians, who he said had no place in their homeland.Ahead of the first Democratic nominating contest in Iowa on Feb. 1, Clinton has opened a commanding lead over main party challenger Bernie Sanders, who argues the invasion of Iraq, which Clinton supported in a U.S. Senate vote in 2003, led to the rise of al Qaeda and Islamic State.For more on the 2016 U.S. presidential race and to learn about the undecided voters who determine elections, visit the Reuters website. (here). (Additional reporting by Krista Hughes and Alana Wise; Writing by Kevin Drawbaugh; Editing by Mary Milliken and Peter Cooney)",,"WASHINGTON (Reuters) - The deadly attacks in Paris pushed terrorism and the Syrian refugee crisis to the center of the U.S presidential campaign on Sunday, as Republicans hammered Obama administration plans to take in more refugees as well as Democratic front-runner Hillary Clinton's stance on Middle East policy.","After Paris, Republicans hit refugee plan and Clinton stance",http://feeds.reuters.com/~r/Reuters/PoliticsNews/~3/NNm-X0383HI/story01.htm,['foreign policy/national security'],"['Maria Bartiromo', 'Kevin Drawbaugh', 'Lindsey Graham', 'Jeb Bush', 'George Stephanopoulos', 'Hillary Clinton', 'John Kasich', 'Ben Rhodes', 'Mary Milliken', 'Marco Rubio', 'Barack Obama', 'Alana Wise', 'Bernie Sanders', 'Peter Cooney', 'Krista Hughes', 'Ben Carson']",reuters,0.9457890581047372,"[{'author_id': 11927, 'fullname': 'erin mcpike', 'primary_org': 'cnn'}]",2015-11-15 21:56:18,['ISIL'],5956d625c66f9d3fa103fc3308eeadd7,2015-11-15 22:51:53.110847
