body,byline,description,title,url,topics,people,org,election_confidence,authors,date_written,orgs,article_id,date_access
"An unsettling yet telling split-screen changed the view of the presidential campaign Saturday night: three Democratic candidates who had come to Iowa to talk about domestic issues found their debate hijacked by a foreign policy crisis dominating the news from a world away.As metaphors for the last two presidencies go, the turnabout was apt: Both George W. Bush and Barack Obama came into office with domestic issues prime on their minds, only to have conflicts abroad hobble and frustrate their tenures.Foreign policy, and specifically her vote for the Iraq War, also frustrated Hillary Rodham Clinton in her unsuccessful run for president in 2008. Not even an ad that year asserting that she was most experienced to take the 3 a.m. crisis call—the implication being that Obama wasn’t—was enough to overcome Democrats' embrace of his early opposition to the war.As much as anything, Saturday night's debate in the shocked aftermath of the Paris terrorist attack offered Clinton an opportunity to argue anew that her experience is necessary—and her opponents' is insufficient--for any 3 a.m. call. That allowed her to eclipse her rivals on stage, although in doing so, she may have created vulnerabilities a Republican could exploit next fall.As a former senator and secretary of State, Clinton spoke with fluency about the contradictory puzzle and complicated players in the Middle East, and the tensions there that already have spilled into violence on the European continent. She recounted her experience helping downtown New York recover from the Sept. 11, 2001, attack (weirdly, however, it was in response to a criticism of her closeness with Wall Street donors).Seeking to shake up the Democratic race and loosen Hillary Rodham Clinton's front-runner status, rivals Bernie Sanders and Martin O'Malley repeatedly challenged the former secretary of State on Saturday night in a debate where they largely agreed on most issues.The session at Drake University...Seeking to shake up the Democratic race and loosen Hillary Rodham Clinton's front-runner status, rivals Bernie Sanders and Martin O'Malley repeatedly challenged the former secretary of State on Saturday night in a debate where they largely agreed on most issues.The session at Drake University...When asked to recount a crisis that had tested her, she dramatically retold the story of advising President Obama to go after Osama bin Laden in 2011 despite concerns by many in the administration that the mission could fail. And, she noted, she offered the advice without consulting anyone, even her husband, former President Bill Clinton.It was that question, more than any other, that demonstrated Clinton’s advantage once the focus turned to foreign policy. By contrast, former Maryland Gov. Martin O'Malley recounted the daily tribulations of a mayor and state executive, and Vermont Sen. Bernie Sanders told of a veterans' bill, one in which he was not successful in achieving his initial goal and had to negotiate a compromise.Indeed, discomfort on the part of Sanders and O'Malley was palpable from the start. After a moment of silence for the victims in Paris, the candidates moved to opening statements. Speaking before Clinton, Sanders jumped quickly into his familiar arguments about a ""rigged economy,"" a ""corrupt campaign finance system"" and the need for millions of Americans to stand and say that ""enough is enough.""Speaking after Clinton, O’Malley averred that the Paris attacks showed the need for ""new thinking, fresh approaches and new leadership."" But he did not offer any of the first two, and on the third, his mention that he worried about terrorism as a governor only underscored his lack of front-line international experience.Clinton went right to the point.""We need to have a resolve that will bring the world together to root out the kind of radical jihadist ideology that motivates organizations like ISIS, the barbaric, ruthless, violent jihadist, terrorist group,"" she said, adding pointedly: ""This election is not only about electing a president. It's also about choosing our next commander in chief.""Clinton did not offer many operational details, apart from working with American allies on a united anti-jihadist front. But neither did her opponents.The Democratic frontrunner undoubtedly would have received a rougher going-over had the debate been against a Republican free to oppose her actions as secretary of State from a perspective 180 degrees opposite hers (and all of the GOP candidates' views are.) Her weakest moment came in a muddled response to an obvious question about President Obama's failure—and hers--to anticipate the powerful rise of the Islamic State militants. That's a point Republicans are sure to hammer.Clinton seemed intent on carefully navigating her party's shoals. She mildly distanced herself from Obama’s ill-timed assertion—delivered just before the Paris attack—that the Islamic State was contained. ""It cannot be contained, it must be defeated,"" she said.But she immediately moved to calm the left: ""What the president has consistently said--which I agree with--is that we will support those who take the fight to ISIS,"" she said, citing the U.S. forces training Arab and Kurdish militaries. ""But this cannot be an American fight, although American leadership is essential."" She mentioned the limits of American involvement twice.The Democratic counter to Clinton was far more difficult to make, giving the debate performances of Sanders and O'Malley the feel of a collection of pulled punches.Sanders has ridden a wave of support from the party's liberal left. Flaying Clinton for being insufficiently aggressive against the Islamic State and other terrorist groups would have inevitably risked a collision with the anti-interventionist views of his supporters, which by all evidence the senator ardently shares. O'Malley, with no clear path to the nomination besides his generational pitch, was effectively in the same fix.Neither candidate, for example, explicitly hit Clinton on one of the most significant events of her tenure as secretary of State, the loss of four Americans at the U.S. mission in Benghazi, Libya. Republicans have argued that attack would have been prevented by a more aggressive posture.The irony of terrorism and foreign policy overtaking a Democratic debate is that the party's candidates have largely avoided the subject this election cycle.Republicans have brawled over the level of aggression each would apply in the Mideast, with several candidates advocating no-fly zones that would put the country's military in direct conflict with Russian planes operating over Syria. Several also have advocated a sharp rise in American troops overseas.But for Democrats, the subject has been far more fraught. Obama came to office in the aftermath of Bush's intervention in Iraq and Afghanistan and vowed to disentangle America from both fights. He has since disappointed some of his followers by announcing that he would keep at least 5,500 troops in Afghanistan beyond the previously announced 2016 withdrawal. He also said recently that he would send special operations troops to Syria to assist rebels there --language that uncomfortably echoes the beginning of involvements in past military theaters.So for the Democratic candidates there had been no real primary season rationale for a focus on foreign policy. The first Democratic debate stuck to the candidates' nuanced differences on issues like economic policy, healthcare and criminal justice, and their agreements on matters such as changing immigration policy and raising the minimum wage.Then Paris exploded in violence.Whether terrorism will remain at the forefront of the campaign is impossible to predict, given that nearly a year remains before the election. But if it happens, more detail will be required from both the Democrats and Republicans seeking the White House.Ironically, as the candidates spoke to a country shaken by the Paris attack and wondering if it could happen here, one question was left unasked Saturday night: If France couldn't find a handful of terrorists in a country of 66 million people, how would the next president find them in a country of 320 million?cathleen.decker@latimes.comFor political news and analysis, follow me on Twitter: @cathleendecker . For more on politics, go to latimes.com/decker.",,<p>An unsettling yet telling split-screen changed the view of the presidential campaign Saturday night: three Democratic candidates who had come to Iowa to talk about domestic issues found their debate hijacked by a foreign policy crisis dominating the news from a world away.</p> <p>As metaphors for the...</p>,"In debate after Paris attack, Hillary Clinton finds foreign policy a strength",http://www.latimes.com/la-pol-prez-clinton-democratic-debate-foreign-policy-strength-20151115-story.html,['foreign policy/national security'],"[u""Martin O'Malley"", 'Bill Clinton', 'Hillary Clinton', 'Hillary Rodham Clinton', 'Barack Obama', 'Bernie Sanders', 'W. Bush']",latimes,0.9048834332016689,"[{'author_id': 41997, 'fullname': 'cathleen decker', 'primary_org': 'latimes'}]",2015-11-15 15:58:00,['GOP'],a106378f349b7a4c999b2ff445406a8c,2015-11-15 16:25:06.794468
"Republican presidential candidates have criticized Democratic White House hopeful Hillary Clinton for decliningÂ to use term such as âradical Islam” and “Islamic terrorism”Â to describe the extremists who have unleashed a string of terrorist attacks on Western targets recently.Asked at the second Democratic debate on Saturday night whether the U.S. was âat war with radical Islam,â Ms. Clinton drew a distinction between the worldâs 1.6 billion Muslims and those who commit acts of violent extremism.âI donât think weâre at war with Islam. I donât think weâre at war with all Muslims,â she said. âI think weâre at war with jihadists. We are at war with violent extremism. We are at war with people who use their religion for purposes of power and oppression, and yes, we are at war with those people, but I donât want us to be painting with too broad a brush.âShe recounted admiringly former president George W. Bushâs call forÂ tolerance in the aftermath of the Sept. 11, 2001 terrorist attacks.âIslam is peace,â Mr. Bush said in a speech at the Islamic Center of Washington, D.C. the week after the attacks.Mrs. Clinton’sÂ answer prompted reproach from Republicans who insisted she use the phrase, âradical Islam.âFormer Arkansas governor and Republican presidential candidate Mike Huckabee on Twitter mocked Democrats, writing âSay it with me: âIslamic Terrorism.ââ Carly Fiorina wrote on Twitter that unlike Hillary Clinton, she would use the phrase âIslamic terrorism.âYou’re all grown up now. You can do it. Three words. Ten syllables. Say it with me: “Radical Islamic terrorism.” #DemDebateâ Gov. Mike Huckabee (@GovMikeHuckabee) November 15, 2015We need a President who will see and speak and act on the truth…Hillary Clinton will not call this Islamic terrorism. I will.â Carly Fiorina (@CarlyFiorina) November 15, 2015On Sunday morning, Republican Florida Sen. Marco Rubio, who has put an aggressive foreign policy at the center of his presidential campaign, called the fight against terrorism âa clash of civilizationsâ and said he was baffled by Ms. Clintonâs reluctance to use the term âradical Islam.ââI donât understand it. That would be like saying we werenât at war with Nazis, because we were afraid to offend some Germans who may have been members of the Nazi Party but werenât violent themselves,â he said. âWe are at war with radical Islam, with an interpretation of Islam by a significant number of people around the world, who they believe now justifies them in killing those who donât agree with their ideology.âAnd on CNN on Sunday morning, Former Florida governor and Republican presidential candidate Jeb Bush said, âI know what Islamic terrorism is. This is not a question of religion. This is a political ideology that has co-opted a religion. And I think it’s more than acceptable just to call it for what it is and then organize an effort to destroy it.âHe also described the fight against terrorism as âa fight for Western civilization.âAbout 1% of the U.S. population are Muslims, according to the Pew Research Center.Â About 26% are evangelical Protestants, a group who hold considerably influence among the GOP primary electorate in the early nominating states of Iowa and South Carolina.______________________________________________________2016 Election Calendar | WSJ/NBC Polls   | 2016 Poll StandingsPolitics Alerts: Get email alerts on breaking news and big scoops. Capital Journal Daybreak Newsletter: Sign up to get the latest on politics, policy and defense delivered to your inbox every morning.For the latest Washington news, follow @wsjpoliticsFor outside analysis, follow @wsjthinktank",,"Republican presidential candidates have criticized Democratic White House hopeful Hillary Clinton for declining to use term such as “radical Islam"" and ""Islamic terrorism"" to describe the extremists who have unleashed a string of terrorist attacks on Western targets recently.",GOP Candidates Fault Hillary Clinton For Declining to Use Phrase ‘Radical Islam’,http://blogs.wsj.com/washwire/2015/11/15/gop-candidates-demand-hillary-clinton-use-phrase-radical-islam/,['foreign policy/national security'],"['Mike Huckabee', 'Marco Rubio', 'Jeb Bush', 'Carly Fiorina', 'Hillary Clinton']",wsj,0.9898823157673136,"[{'author_id': 34144, 'fullname': 'anna louie sussman', 'primary_org': 'wsj'}]",2015-11-15 20:15:50,"['Capital Journal', 'WSJ', 'Democratic White House', 'Pew Research Center', 'GOP']",17923d3aa29dbbe159e610fb3fc7ab78,2015-11-15 20:59:26.868660
"A women takes a photo while standing on the stage for Saturday night's Democratic presidential debate between Sen. Bernie Sanders, I-Vt,, Hillary Rodham Clinton and former Maryland Gov. Martin O'Malley, Friday, Nov. 13, 2015, in Des Moines, Iowa. (AP Photo/Charlie Neibergall)The Democratic presidential candidates faced off for their second debate Saturday night, with the issues of terrorism and national security thrust back into the spotlight in the wake of the deadly Paris attacks.All three candidates have weighed in on the tragedy, condemning the attacks for which the Islamic State has claimed responsibility. The attacks across multiple locations in the city killed at least 129 people and wounded hundreds, officials said.  In a primary race otherwise dominated by the economy, climate and front-runner Hillary Clinton’s personal record, the debate in Des Moines, Iowa, now is expected to focus heavily on security and foreign policy after debate host CBS News reworked the format.   It is an area where Clinton, as former secretary of state, enters with the thickest resume – but also one that could prove problematic, given her involvement shaping the policies in increasingly unstable and chaotic nations like Libya and Syria.Vermont Sen. Bernie Sanders, after appearing to give her a pass at the first debate over her personal email controversy, has in recent weeks shown a greater interest in criticizing her record. But his focus on issues like income inequality could be out of place in a discussion focused on global security challenges.Clinton also enters this debate – hosted by CBS News, KCCI-TV and The Des Moines Register – facing a narrower field than at their first encounter in October. Since that debate, two candidates have dropped out, leaving only Sanders and former Maryland Gov. Martin O’Malley.Clinton is seen to have otherwise strengthened her hand since that debate, making it through a lengthy hearing before the Benghazi congressional committee and seeing one of her biggest potential political threats – a late bid by Vice President Biden – disappear as the vice president announced he would not run.Sanders remains Clinton’s biggest challenge, and has stirred an enthusiasm in the Democratic base that Clinton has struggled to evoke. But nationally and in Iowa, she continues to lead him by double digits in the polls.Still, the FBI investigation over Clinton’s use of a personal email and server while secretary of state looms over her bid, with the probe said to be expanding.",,"The Democratic presidential candidates faced off for their second debate Saturday night, with the issues of terrorism and national security thrust back into the spotlight in the wake of the deadly Paris attacks.",Democratic 2016 candidates face off for 2nd debate,http://feeds.foxnews.com/~r/foxnews/politics/~3/TEOgoe910VE/,['foreign policy/national security'],"['Bernie Sanders', 'Charlie Neibergall', 'Hillary Clinton', u""Martin O'Malley"", 'Hillary Rodham Clinton']",fox,0.8547615578685663,[],2015-11-15 02:02:16,['FBI'],16cb890d4d44df5c90d0eef0d397081f,2015-11-15 02:15:49.625467
"Republican candidates for president called on the Obama administration to tighten border controls amid reports that one of the suicide bombers who carried outÂ Fridayâs attacks in Paris may have entered Europe as a Syrian migrant.Former Arkansas governor Mike Huckabee said President Barack Obama should âclose our borders.ââIf a left-wing politically-correct country like France will close its borders, it’s time for us to put a moratorium on people coming here from countries where there are ISIS or al Qaeda ties,â he told CNN on Saturday.Florida Sen. Marco Rubio, another GOP presidential candidate, said the difficulty of running background checks on Syrian refugees should preclude further migration from Syria into the U.S.âYou canât pick up the phone and call Syria, and thatâs one of the reasons why I said we wonât be able to take more refugees,â he said on ABC on Sunday.He added: âYou can have 1,000 people come in, and 999 of them are just poor people fleeing oppression and violence, but one of them is an ISIS fighter. If thatâs the case, you have a problem, and there is no way to vet that out.âThe news that one of the bombers may have entered Europe amidst the flood of Middle Eastern refugees has galvanized opponents of Chancellor Angela Merkelâs open-door policy, with critics saying migrants represented a grave security threat.Jeb Bush, whose support for legal status for undocumented immigrants in the U.S. puts him at odds with the mainstream of the Republican Party, said the U.S. had the capacity to screen refugees based on their religion.âWe do that all the time. We do that,â he said on CNN on Sunday. âIt takes almost a year for a refugee to be processed into the United States.”He called for the U.S. to take a âlimited numberâ and to prioritize Christians who are fleeing religiously motivated persecution in Syria.The U.S. is preparing to admit at least 10,000 Syrian refugees in the next year, a six-fold increase from the number currently in the country, the White House announced in September.Ben Rhodes, deputy national security advisor to President Obama, said the administration had no intention of changing its refugee policy and said it had extensive screening procedures already in place for all Syrian refugees entering the U.S.âThere’s a very careful vetting process that includes our intelligence community, our national Counterterrorism Center, the Department of Homeland Security,â he said on NBC on Sunday.âWe need to sort out how to focus on the terrorists that we need to keep out of the country. But I think we do need to do our part to take those refugees who are in need.â______________________________________________________2016 Election Calendar | WSJ/NBC Polls   | 2016 Poll StandingsPolitics Alerts: Get email alerts on breaking news and big scoops. Capital Journal Daybreak Newsletter: Sign up to get the latest on politics, policy and defense delivered to your inbox every morning.For the latest Washington news, follow @wsjpoliticsFor outside analysis, follow @wsjthinktank",,Republican candidates for president called on the Obama administration to tighten border controls amid reports that one of the suicide bombers who carried out Friday’s attacks in Paris may have entered Europe as a Syrian migrant.,Republican White House Hopefuls Call for Curbs on Syrian Refugee Inflow,http://blogs.wsj.com/washwire/2015/11/15/republican-white-house-hopefuls-call-for-curbs-on-syrian-refugee-inflow/,['foreign policy/national security'],"['Jeb Bush', 'Ben Rhodes', 'Marco Rubio', 'Mike Huckabee', 'Barack Obama']",wsj,0.5913526949570084,"[{'author_id': 34144, 'fullname': 'anna louie sussman', 'primary_org': 'wsj'}]",2015-11-15 19:55:56,"['al Qaeda', 'WSJ', 'Capital Journal', 'Republican Party', 'Department of Homeland Security', 'United States.', 'GOP']",b2e7aeeb9e5674f19b32e6bf93cac287,2015-11-15 20:01:36.153455
