body,byline,description,title,url,topics,people,org,election_confidence,authors,date_written,orgs,article_id,date_access
"Democratic U.S. presidential candidates Senator Bernie Sanders (L), former Secretary of State Hillary Clinton and former Maryland Governor Martin O'Malley pose on stage ahead of the second official 2016 U.S. Democratic presidential candidates debate in Des Moines, Iowa, November 14, 2015.   (REUTERS/Jim Young)Hillary Clinton was put on the defensive at the opening of Saturday night’s Democratic presidential debate over military interventions she backed in countries now gripped by instability.The debate in Des Moines, Iowa, came in the wake of the Paris terror attacks, which thrust the issues of national security and foreign policy back to the center of the 2016 campaign. The debate format was changed to focus anew on those issues.But, citing the chaos in the Middle East and North Africa, Clinton’s rivals criticized her Senate vote for use of force before the Iraq war and appeared to criticize her support for toppling Libyan dictator Muammar Qaddafi.Former Maryland Gov. Martin O’Malley said America’s role is not to roam the world “looking for new dictators to topple.”He said it is also important to understand “secondary and third consequences” that come after removing a “single dictator.” O’Malley called Libya, Syria and other countries in the region a “mess.”Clinton defended her support for toppling Qaddafi, saying he was threatening a “genocide” and America’s European and Arab allies asked for U.S. support.She also said “it is imperative” that the U.S. do more to confront the “arc of instability” in the region. And to O’Malley’s critique, she said, “I don’t think you can paint with a broad brush,” and “This is an incredibly complicated region of the world.”Vermont Sen. Bernie Sanders, meanwhile, referenced Clinton’s support for use of force in Iraq and said the “disastrous invasion” led “to the rise of Al Qaeda and to ISIS.”Clinton again called her Iraq war vote a “mistake,” but disputed that the war is the only driver of modern terrorism.The candidates also condemned the Paris terror attacks.“Our prayers are with the people of France tonight, but that is not enough,” Clinton said.She called for global “resolve” to “root out” the “radical jihadist ideology” that motivates groups like the Islamic State. Clinton, a former secretary of state, said she would coordinate efforts “against the scourge of terrorism.”“It cannot be contained. It must be defeated,” she said of ISIS.Sanders blasted ISIS as a “barbarous organization.”O’Malley called this the “new face” of terror threats.The attacks across multiple locations in Paris killed at least 129 people and wounded hundreds, officials said. In a primary race otherwise dominated by the economy, climate and front-runner Clinton’s personal record, the debate in Des Moines, Iowa, now is expected to focus heavily on security and foreign policy after debate host CBS News reworked the format.  It is an area where Clinton, as former secretary of state, enters with the thickest resume – but also one that could prove problematic, given her involvement shaping the policies in increasingly unstable and chaotic nations like Libya and Syria.Sanders, after appearing to give her a pass at the first debate over her personal email controversy, has in recent weeks shown a greater interest in criticizing her record. But his focus on issues like income inequality could be out of place in a discussion focused on global security challenges. Sanders’ campaign objected to some of the CBS News debate tweaks, sources said.Clinton also enters this debate – hosted by CBS News, KCCI-TV and The Des Moines Register – facing a narrower field than at their first encounter in October. Since that debate, two candidates have dropped out, leaving only Sanders and O’Malley.Clinton is seen to have otherwise strengthened her hand since that debate, making it through a lengthy hearing before the Benghazi congressional committee and seeing one of her biggest potential political threats – a late bid by Vice President Biden – disappear as the vice president announced he would not run.Sanders remains Clinton’s biggest challenge, and has stirred an enthusiasm in the Democratic base that Clinton has struggled to evoke. But nationally and in Iowa, she continues to lead him by double digits in the polls.Still, the FBI investigation over Clinton’s use of a personal email and server while secretary of state looms over her bid, with the probe said to be expanding. ",,,DEMOCRATIC DEBATE  2016 candidates condemn Paris attacks at opening,http://www.foxnews.com/politics/2015/11/14/democratic-2016-candidates-face-off-for-2nd-debate/,['foreign policy/national security'],"['Bernie Sanders', 'Muammar Qaddafi', 'Hillary Clinton', u""Martin O'Malley"", 'Jim Young']",fox,0.9318134445268402,[],2015-11-15 02:32:43,"['Senate', 'Al Qaeda', 'FBI']",1e6c60a4b3334c751ae09ef925cc938d,2015-11-15 03:00:05.529453
"Donald Trump has dramatically escalated his attacks on his nearest rival for the Republican presidential nomination, Ben Carson. A new Reuters/Ipsos poll may explain why: the billionaire real estate magnate is bleeding support among avid church-goers and women to the retired neurosurgeon. While the unconstrained Trump has a comfortable double-digit lead over the soft-spoken Carson, the data points to a possible emerging threat to Trump's hopes of capturing the party's nomination for the November 2016 election. The poll of likely Republican primary voters also shows that Carson is drawing strong support from the rural Midwest, including Iowa, which holds the first Republican nominating contest on Feb. 1. Trump, in contrast, is drawing strong support in the northeast and southeast.That geographical divide is significant, analysts said, because Carson's dominance in more socially conservative states like Kansas, Iowa and Nebraska reflects how his story of personal redemption is resonating strongly with evangelical voters. They traditionally play an outsize role not just in the first nominating contest in Iowa on Feb. 1, but in Nevada and South Carolina, which also hold nominating votes in February.""If Carson keeps his nose clean he could win those states and could catch lightning in a bottle,"" said Ford O'Connell, a Republican strategist not affiliated with either campaign.Trump, who has topped national polls of likely Republican primary voters for months, has until now enjoyed strong support among the key constituency of low-income, blue-collar, church-going voters, who have been attracted by his image as a straight-talking political outsider.But Carson's similar appeal as an outsider taking on the Republican establishment has undercut Trump's support in recent weeks, and Carson has surged to the top of a few recent national polls.Carson's growing support with women and blue collar voters may explain Trump's recent attacks on his rival, said O'Connell. Trump has highlighted media reports questioning elements of Carson's personal story, and on Thursday he called Carson ""pathological"" and likened him to a child molester.""OUTSIDER VOTE""""Trump is desperate to consolidate the 'outsider' vote. The blue collar vote is very, very key to Trump's success in that. He has tried everything to shake Carson off and it hasn't worked, so he has decided to go nuclear,"" said O'Connell, an advisor to Republican Senator John McCain's 2008 presidential campaign.To be sure, a separate rolling five-day Reuters/Ipsos poll shows Trump surging to 42 percent of likely Republican primary voters, up from 25 percent, since Nov. 6 while Carson was flat at 23 percent.The Trump campaign did not respond to requests for comment on the polling data. Barry Bennett, Carson’s campaign manager, said of Trump's heightened criticism of Carson: “It’s hard to explain his remarks but clearly he’s feeling some pressure and overreacting.”Bridget Miller, 43, from Stilwell, Kansas, said she had initially considered voting for Trump, but had switched to Carson. ""Carson is pro-life; he's pro-gun; he's saved baby's lives. He speaks to a lot of our values here,"" she said.Other likely Republican primary voters say they initially supported Trump but his latest criticism of Carson and his ""child molester"" comments only confirmed their belief that he is unsuited to the presidency.Janis Anderson, 54, from Fargo, North Dakota, said she had considered Donald Trump, but his latest comments about Carson were “ridiculous.”Trump still either leads or shares the lead among most geographical and demographic groups, including wealthy and middle-income voters, people with and without college degrees, the southeast, northeast, the Upper Midwest and the American West.But the story is different among lower-paid workers. In September, Carson had just over 14 percent of support among voters in households with an annual income of $50,000 or less, according to the broader Reuters/Ipsos data. By the end of October, that had jumped to over 23 percent support. Trump's support in the same group was flat at around 33 percent.Among likely female Republican primary voters, Carson has seen his support jump since September from about 19 to 27 percent - the highest of any Republican candidate - while Trump's has slipped from 30 percent to 25.Carson's support among regular churchgoers has also risen sharply, according to the Reuters/Ipsos survey, jumping 10 points between September and November to 32 percent, the highest of any Republican candidate. Trump's support with religious voters has slipped from 26 percent to 22 percent.""As the campaign has evolved over time, Trump has begun to wear a little bit thin, especially voters who want a softer, more gentlemanly approach to politics,"" said David Gergen, an adviser to four former U.S. presidents from both parties. ""Carson is wearing better with women than Trump.""The surveys of likely Republican voters was taken from Sept. 1 until Oct. 31. The Reuters/Ipsos poll has a credibility interval, a measure of accuracy, of 3 to 8 percent.  (Editing by Ross Colvin)",,"(Reuters) - Donald Trump has dramatically escalated his attacks on his nearest rival for the Republican presidential nomination, Ben Carson. A new Reuters/Ipsos poll may explain why: the billionaire real estate magnate is bleeding support among avid church-goers and women to the retired neurosurgeon.",Trump is going nuclear on White House rival Carson. Here's why,http://feeds.reuters.com/~r/Reuters/PoliticsNews/~3/f3pNyxKw-3c/story01.htm,"['immigration', 'campaign_finance', 'guns']","[u""Ford O'Connell"", 'David Gergen', 'Donald Trump', 'Barry Bennett', 'Ross Colvin', 'Ben Carson']",reuters,0.9860721955143571,"[{'author_id': 36541, 'fullname': 'tim reid', 'primary_org': 'reuters'}, {'author_id': 45662, 'fullname': 'chris kahn', 'primary_org': 'reuters'}]",2015-11-15 18:16:24,[],81e9a97c437e7c5c3439ed58bd08dc5f,2015-11-15 18:51:20.444551
" (CNN)CNN Opinion asked a range of contributors for their take on the second Democratic presidential debate held at Drake University in Des Moines, Iowa. Who were the winner and loser? The opinions expressed in these commentaries are solely those of the authors.This debate was more difficult for Hillary Clinton than was expected. Though she had opportunities to highlight her extensive experience and leadership skills, she was still thrown on the defense in two pivotal areas. On foreign policy, in the aftermath of Paris, she was forced to defend the record of the Obama administration in Syria and saw how this issue -- foreign policy -- could be turned against her. This, more than the vote in Iraq, will be a challenge.Domestic policy also remained a concern as Bernie Sanders and Martin O'Malley hit harder in her ties to Wall Street and more centrist views on some economic issues. Clinton still exits from the debate as the most formidable candidate in the group and the one best positioned to defeat the GOP. O'Malley continues to struggle gaining any traction and Sanders still seems too left for the party.But the debate was a warning. It brought out some of the questions that Clinton will face in the coming months. In the coming weeks, she will need to provide stronger answers if she wants a smooth victory in the primaries and the general election. Winner: No clear winner.Loser: Martin O'Malley. Julian Zelizer is a professor of history and public affairs at Princeton University and a New America fellow. He is the author of ""The Fierce Urgency of Now: Lyndon Johnson, Congress, and the Battle for the Great Society"" and co-editor of a new book, ""Medicare and Medicaid at 50: America's Entitlement Programs in the Age of Affordable Care."" The good news for Bernie Sanders and Martin O'Malley was that they shared a victory in this debate by criticizing Hillary Clinton directly and to her face, pushing back against the notion that Clinton's nomination is inevitable. Not if Sanders and O'Malley have anything to say about it.When asked about the role of Wall Street, Sanders, who has criticized the influence of big-money donors in American politics, said Clinton's many backers from financial corporations are seeking to curry favor with her.""Maybe they're dumb, and they don't know what they're going to get, but I don't think so,"" Sanders said of Clinton's Wall Street donors. ""Why do they make millions of dollars of campaign contributions? They expect to get something, everybody knows it.""Clinton, clearly stung by the statement, pointed out that Sanders ""has basically used his answer to impugn my integrity."" At issue was a call by Sanders and O'Malley to tighten regulatory controls over banking institutions by reviving elements of the now-defunct Glass-Steagall Act.  Clinton dismissed her critics: ""My proposal is tougher, more comprehensive and more effective,"" she said. But O'Malley called her ideas ""weak tea"" and the cheers Sanders got by taking her on suggest a sizable portion of Democrats want the next president to control Wall Street rather than the other way around. The Sanders-O'Malley duo also scored points by pushing for a $15 minimum wage, considerably higher than the $12 Clinton advocates. The recent nationwide strikes and demonstrations in favor of a $15 minimum wage -- which translates into an annual full-time salary of $31,000 -- show that Sanders and O'Malley are riding a powerful grassroots wave. If Clinton sticks to her $12 proposal, she should expect more verbal slugfests with her opponents -- and a Democratic base that may jump off the Clinton bandwagon if she doesn't move in a more liberal direction.Errol Louis is the host of ""Inside City Hall,"" a nightly political show on NY1, a New York all-news channel. A day after ISIS terrorized Paris in multiple coordinated attacks with guns and suicide bombs, killing over 100 and injuring hundreds more, Democrat frontrunner Hillary Clinton left doubts she's up to the task to protect America. In opening questions on foreign policy during the CBS-moderated debate, Clinton danced around her lack of accomplishments as secretary of state under President Barack Obama. When asked about Obama's Syria policy, Clinton said she disagreed with Obama's strategy from the start and warned him if the United States didn't intervene in Syria, our enemies would fill the void.  Clinton said the ""Middle East is a complicated region"" and ""the arch of instability."" Americans don't vote for a president to tell them what they already know. Clinton's textbook responses to foreign policy questions were rote. More disturbing was she couldn't point to any accomplishments as secretary of state other than advising Obama on Osama bin Laden's capture. Libya, Syria, Egypt and Russia all fell apart under her tenure. If elected president, Clinton didn't convince voters she would do anything differently or make America safer, which brings us to terrorism.When asked if she would declare war against Islam like President Francois Hollande has, Clinton replied no. ""We're not at war with Islam. We're not at war with Muslims.""  Yet, that's just the problem. Islam is at war with America and the world and we need a president who will finally acknowledges this, not one who shrinks from this challenge. Obama hasn't. In an interview with ""Good Morning America"" that aired the day of the Paris attack, Obama said ISIS had been contained.Over the last four years since the civil war unraveled in Syria, ISIS has taken root there, training Muslims from around the world to be jihadists. France has a large population of Muslim nationals, many of whom have freely entered the country. America, like Germany and France, have welcomed thousands of Syrian refugees. It won't be long before what happened in Paris makes it's way to our homeland. During the second Democrat debate, Hillary Clinton revealed her biggest strength may be her biggest weakness -- her foreign policy experience.Crystal Wright is a conservative writer who runs the blog ConservativeBlackChick.com. She also is a principal at the Baker Wright Group, a communications and public relations firm. You can follow her @GOPBlackChick.On a very tough night to talk politics, it seemed all three candidates were a little off their game.Hillary Clinton was well-positioned coming in to look tough -- and presidential -- on terrorism. But she didn't anticipate Martin O'Malley lurching to her right. ""It is America's fight,"" he corrected her, ""but not solely America's fight."" With Bernie Sanders attacking from the left, she was suddenly stuck in the middle, playing defense. On the discussion regarding banks and campaign finance, however, Sanders should have had the natural upper hand, but he couldn't land a punch. Clinton won the issue in the room. Sanders also might be the first Democrat to acknowledge raising the minimum wage will have some negative repercussions, which I think will come back to haunt him.O'Malley had some blunders as well. He floated a frightening 70% tax rate on the wealthy, unprompted. He walked into a critique from Sanders on the safety of Baltimore, the city he ran as mayor. All told, they each had some unexpected highlights and some surprising misses. When Clinton loses on foreign policy but wins on the banks, you know it's a weird night.S.E. Cupp is the author of ""Losing Our Religion: The Liberal Media's Attack on Christianity,"" co-author of ""Why Yo're Wrong About the Right"" and a columnist at the New York Daily News.  Two moments in tonight's debate clarified why Bernie Sanders won't assume the role of frontrunner any time soon.  In the first, Sanders reiterated his noble, but politically disastrous, appeal that we all stop talking about Hillary Clinton's (damn) emails.  It's the high road, for sure.  But by extricating her from a scandal that had bedeviled her campaign for months, Sanders has ceded the space needed for Clinton to take flight.The second moment illustrates the difficulty Sanders has faced in winning over African Americans.  When asked about Black Lives Matter, Sanders rattled off a bunch of standard statistics about incarceration and unemployment rates. Clinton, by contrast, acknowledged the profound pain that black mothers feel when they lose their children to violence, and she then paid tribute -- by name -- to some of the young men who have lost their lives to police violence.Winner: Hillary Clinton. She came across as shrewd, measured, and worldly.  Nothing about the debate tonight changed the fundamental dynamics of this race. Most improved: Martin O'Malley.  He spoke fluidly and forcefully about all manner of issues. He made a showing tonight; it just won't make much of a difference.Lastly, a note on format.  With just a handful of Democratic contenders left in the race for president, the conversation in tonight's debate sank reasonably deep into policy details. The kinds of zingers and gaffes that separate winners from losers on a stage of ten just don't count for nearly as much on a stage of three.  May the Republicans take notice and winnow their ranks soon.William Howell is the Sydney Stein professor in American politics at the University of Chicago. Once again, Democrats proved that they are the adults in this race by having a civilized, high-minded and respectful debate about the important issues facing our country.  They also demonstrated they are all better equipped to lead the nation going into the 21st century as we face unprecedented threats from abroad and an economy that needs continued Democratic leadership to fully recover and give middle class voters all the tools they need to succeed.There were fireworks as both Bernie Sanders and Martin O'Malley tried to take the fight to Hillary Clinton, specifically on her Iraq vote and her connections to Wall Street.  She swatted away the criticisms with ease, with facts, and demonstrated she is best suited to lead the country as president and commander in chief. On foreign policy, her knowledge of the issues, her grasp of the nuances involved in global diplomacy and her determination to implement unparalleled American leadership to defeat ISIS and radical extremist jihadists in the Middle East, put her head and shoulders above the rest, both in the Democratic field as well as all Republicans vying for the presidency. On economic and domestic issues, Clinton underscored differences with Sanders and O'Malley, again showing important nuances on positions such as the minimum wage, college affordability and gun control, showing her grasp of details and the ""weeds"" of these complex issues.  She showed her policies would put middle class families first while ensuring our economy can absorb them without disruption. O'Malley had a great debate, showing his passionate progressive positions, at times taking the critique to both of his opponents, but mostly agreeing with them on key issues.  While his resume is impressive and he has many accomplishments to show as Maryland governor, unfortunately, he was not able to have a sufficient breakout moment that will enable him to climb out of the single digits in the polls. Sanders continued to show his passionate commitment to liberal positions, focusing on climate change and income inequality, both of which are tremendously important to the progressive base.  But his knowledge of foreign policy and issues going on in the Middle East came up wanting and did not inspire broad-based trust needed to be elected as commander In chief.As an issue that is front and center, immigration brought out the best in all of the Democratic candidates -- an easy feat given the contrast with the ridiculous, unworkable, unjust and unelectable positions that are held by most Republicans. Importantly, Clinton was the first one to contrast all the Democrats with the Republicans and was the only one to defend President Obama's record.  A brilliant and important move to excite and mobilize the Democratic base.Overall, Clinton outshined her Democratic opponents, showing her proposals would pay for the opportunities and the level playing field that would help create more good paying jobs and expand economic growth for those who have been left behind.  And both Sanders and O'Malley took a definitive back seat to Clinton when it came to foreign policy, defense of the homeland and what it takes to confront the challenges we face, tragically demonstrated by last night's Paris attacks. Maria Cardona is a political commentator for CNN, a Democratic strategist and principal at the Dewey Square Group. She is a former senior adviser to Hillary Clinton and was communications director for the Democratic National Committee. She also is a former communications director of the Immigration and Naturalization Service.  Join us on Facebook.com/CNNOpinion.Read CNNOpinion's Flipboard magazine",,,"Democratic debate: A weird night for Clinton, Sanders",http://www.cnn.com/2015/11/15/opinions/opinion-roundup-democratic-debate/index.html,"['foreign policy/national security', 'economy']","['Julian Zelizer', u""Martin O'Malley"", 'Lyndon Johnson', 'Francois Hollande', 'Hillary Clinton', 'William Howell', 'Crystal Wright', 'Barack Obama', 'Maria Cardona', 'Bernie Sanders', 'Errol Louis', 'Black Lives Matter']",cnn,0.5029967003123051,[],2015-11-15 07:21:45,"['Dewey Square Group', 'University of Chicago', 'Congress', 'S.E.', 'Immigration and Naturalization Service.', 'Democratic National Committee', 'Medicaid', 'City Hall', 'GOP', 'Princeton University', 'Osama bin Laden']",5d7daaf4e96aedcbe9fa5c6ed7e2ce9a,2015-11-15 08:02:07.855030
