body,byline,description,title,url,topics,people,org,election_confidence,authors,date_written,orgs,article_id,date_access
"DES MOINES, Iowa U.S. Democratic presidential front-runner Hillary Clinton was criticized in a debate on Saturday for her 2003 vote backing the U.S. invasion of Iraq, with rival Bernie Sanders linking it to regional chaos that aided the rise of Islamic State militants.The day after a series of deadly bomb and gun attacks that killed at least 129 people in Paris, Sanders said the invasion was ""one of the worst foreign policy blunders in the modern history of the United States.”""I would argue that the disastrous invasion of Iraq, something that I strongly opposed, unraveled the region immensely, and led to the rise of Al Qaeda and to ISIS,"" said Sanders, a U.S. senator from Vermont.""I don't think any sensible person would disagree that the invasion of Iraq led to the massive level of instability we are seeing right now,"" he said.Clinton, who has frequently called the vote a mistake, said it should be placed in the historical context of years of terrorism before the invasion.“If we’re ever going to really tackle the problems posed by jihadi extremists, we need to understand it and realize that it has antecedents to what happened in Iraq,” she said.The exchange came early in the second debate for Democrats seeking their party's nomination for the November 2016 presidential election, with the focus shifted to foreign policy and ways to combat terrorism after the Paris attacks.The candidates and audience at Drake University in Des Moines, Iowa, observed a moment of silence at the beginning of the debate to honor those killed in France.Clinton, the former secretary of state, has far more foreign policy experience than either Sanders or her other rival, former Maryland Governor Martin O'Malley. But she was forced on the defensive early in the debate about her years of leading President Barack Obama's foreign policy team.Clinton struck a sharp contrast to Obama's comments in an interview aired on Friday that ISIS had been contained.""We have to look at ISIS as the leading threat of an international terror network. It cannot be contained, it must be defeated,"" she said.Republican presidential contenders have criticized Obama for what they say was an inadequate response to the rise of Islamic State in Iraq and Syria. In the aftermath of the attacks, businessman Donald Trump and U.S. Senator Ted Cruz called on the administration to reconsider plans to allow thousands of Syrian refugees to be resettled in the United States.The White House aims to increase to 10,000 the number of Syrian refugees accepted in the United States during fiscal year 2016, from less than 2,000 accepted in the previous year.Clinton has always been from the more hawkish wing of the Democratic Party. Her support for the 2003 Iraq invasion played a major role in her primary loss to Obama in the 2008 White House race.The foreign policy focus was a dramatic shift in emphasis in a Democratic presidential race that so far has been dominated by domestic economic issues such as income inequality, college affordability and family leave.The Democrats returned to that theme later in the debate, and Sanders criticized Clinton for being too cozy with Wall Street and not being in favor of reinstating the Glass-Steagall Act, the 1933 law that established a firewall between investment and commercial banking.""Over her political career, Wall Street has been a major, the major donor to Hillary Clinton. Now maybe they’re dumb, but I don’t think so,"" said Sanders, who favors reinstatement of the act.Clinton accused Sanders of impugning her integrity and said reinstating the law was not enough to rein in corporate influence and reform Wall Street.""Reinstating Glass-Steagall is a part of what very well could help, but it is nowhere near enough,"" she said. ""I go after all of Wall Street, not just the big banks.""With the political clock ticking to the first nominating contest in Iowa on Feb. 1, Clinton has opened a commanding lead over Sanders, her prime challenger, in national and Iowa polls. O'Malley trails well behind, in single digits in most polls. (Additional reporting by Megan Cassella and Luciana Lopez; Editing by Ken Wills)",,"DES MOINES, Iowa (Reuters) - U.S. Democratic presidential front-runner Hillary Clinton came under early criticism in a debate on Saturday for her 2003 vote backing the U.S. invasion of Iraq, with Bernie Sanders linking it to regional chaos that aided the rise of Islamic State militants.",Clinton's vote on Iraq invasion criticized at Democratic debate,http://feeds.reuters.com/~r/reuters/topNews/~3/ndcOFKT1XSs/story01.htm,['foreign policy/national security'],"[u""Martin O'Malley"", 'Hillary Clinton', 'Donald Trump', 'Ken Wills', 'Barack Obama', 'Luciana Lopez', 'Bernie Sanders', 'Megan Cassella', 'Ted Cruz']",reuters,0.8741247998552852,"[{'author_id': 34291, 'fullname': 'john whitesides', 'primary_org': 'reuters'}, {'author_id': 33388, 'fullname': 'amanda becker', 'primary_org': 'reuters'}]",2015-11-15 03:04:55,"['Al Qaeda', 'United States.', 'Democratic Party', 'DES MOINES']",fe31e80ae202d2b9bca5df166c92e5fd,2015-11-15 03:50:51.260133
"There is plenty of anger swirling around the 2016 presidential campaign. Anger at Washington, disdain for Wall Street, disgust with career politicians. Anger is all the rage, and both parties clearly have candidates that are successfully riding the wave. Neither Bernie Sanders nor Donald Trump would be where he is without the substantial number of fed-up voters in their parties. Everyone can see that. It's obvious.But loathing doesn't account for the differences we are witnessing between the GOP and Democratic Party nomination fights. Fear does. Or the absence of fear. Although both sides are angry, Republicans are more angry at the Republican Party leadership than they are afraid of Democrats, while Democrats are more afraid of Republicans than they are angry at the Democratic Party leadership. That's why Trump and Ben Carson, extreme outsiders, are dominating on the right while Hillary Rodham Clinton, the consummate insider, is dominating on the left.This relationship isn't new: The extent to which fear of the other side tempers anger at one's own often determines the nominee.In 2004, when I ran Howard Dean's campaign for president, Democrats were seething at the Democratic establishment, which had voted with the GOP to invade Iraq. But this anger over time gave way to a very real fear that Bush would win reelection.Bernie Sanders' success on the campaign trail does not defy explanation in quite the way that Donald Trump's does — Sanders has not dominated the polls, for one thing — but it's improbable all the same. He is a 74-year-old grandfather with thick glasses and frequently disheveled white hair. And...Bernie Sanders' success on the campaign trail does not defy explanation in quite the way that Donald Trump's does — Sanders has not dominated the polls, for one thing — but it's improbable all the same. He is a 74-year-old grandfather with thick glasses and frequently disheveled white hair. And...As fear of Bush's victory rose, voters in Iowa and New Hampshire, who had been attracted to Howard Dean's progressive politics and willingness to take on the party leadership, moved to John Kerry. Venting, they realized, wasn't as important as nominating someone with a better chance to win.This year, fear within the Democratic Party of a GOP win is off the charts. The GOP has majorities in the House of Representative and the U.S. Senate. For Democrats, losing the presidency in 2016 would be catastrophic. With control of both the executive and legislative branches of government, the GOP would be able to roll back all of the accomplishments of the Obama administration and fill any number of Supreme Court vacancies, guaranteeing a rightward shift in the makeup of the court for a generation.Bernie Sanders can tap into the very real anger at Wall Street and Washington all he wants, but he's not going anywhere; the party rank and file isn't going to risk the 2016 election by nominating an untested democratic socialist. Fear has a way of making voters put ideological purity aside and rally around the most tested, most viable general election candidate: Hillary Rodham Clinton.The fact that many Republicans are probably snickering at those last few sentences helps explain the starkly different race for the GOP nomination. There is a complete absence of fear within the GOP rank and file right now. Having won the House and the Senate, having taken over most state legislatures, the party feels as if the wind is at its back. Are they sick of Barack Obama? Absolutely. Are they sick of Clinton? Certainly. But they don't fear either one of them. They're convinced that the country could not possibly want another four years with a Democrat in the White House.Any fear they had of Clinton was erased by months of pundits proclaiming her collapse, her fumbling response to the private server scandal and Sanders' surprising popularity in early primary states. GOP primary voters' opinion of her was so low they happily bought into the idea of her vulnerability, and still do.It's the absence of fear that is driving Jeb Bush into the ground and holding Marco Rubio, John Kasich and others from gaining any real traction. Why compromise for someone who calls illegal immigration “an act of love,” or someone who once supported a path to citizenship, if there is no way you can lose? Why not go with the guy who wants to deport all 11 million undocumented immigrants, then let the “good ones” back in?Of course, there's still time for the GOP to get scared straight. As Clinton's strengths become more obvious, and they will, fear within the GOP will rise. Republican primary voters could abandon Trump and Carson for Rubio, Kasich, Christie or even Bush — just as Democratic primary voters abandoned Dean for Kerry in 2004.The establishment candidates just have to hope that fear will overcome loathing sooner rather than later.Joe Trippi is a Democratic strategist and media consultant who ran Howard Dean's campaign for president and was a media advisor to Gov. Jerry Brown in 2010. He writes on politics frequently for Opinion.Follow the Opinion section on Twitter @latimesopinion and Facebook",,"<p>There is plenty of anger swirling around the 2016 presidential campaign. Anger at Washington, disdain for Wall Street, disgust with career politicians. Anger is all the rage, and both parties clearly have candidates that are successfully riding the wave. Neither Bernie Sanders nor Donald Trump...</p>",Fear (or its absence) are driving the GOP and Democratic presidential campaigns,http://www.latimes.com/la-oe-1115-trippi-fear-loathing-campaign-20151115-story.html,"['immigration', 'personality']","['John Kerry', 'Howard Dean', 'Joe Trippi', 'Jerry Brown', 'Jeb Bush', 'John Kasich', 'Donald Trump', 'Hillary Rodham Clinton', 'Marco Rubio', 'Barack Obama', 'Bernie Sanders', 'Ben Carson']",latimes,0.998588817920651,"[{'author_id': 40887, 'fullname': 'joe trippi', 'primary_org': 'latimes'}]",2015-11-15 13:00:00,"['Senate', 'Democratic Party', 'Supreme Court', 'U.S. Senate', 'Republican Party', 'GOP']",ad7c89b531459df05d638232ac670ed5,2015-11-15 13:20:55.822287
"After Bernie Sanders challenged Hillary Clintonâs independence from the influence of her corporate donors, she offered a defense during Saturday nightâs debate â and included her work as a New York senator after September 11th.SANDERS: Hereâs the story: I mean, you know, letâs not be naive about it. Why do â why, over her political career has Wall Street been a major â the major campaign contributor to Hillary Clinton? You know, maybe theyâre dumb and they donât know what theyâre going to get, but I donât think so.",,"“So, I represented New York, and I represented New York on 9/11 when we were attacked. Where were we attacked?” Bernie Sanders had challenged Clinton on whether the Wall Street contributions she receives influence her.View Video ›buzzfeed-video1.s3.amazonaws.comAfter Bernie Sanders challenged Hillary Clinton's independence from the influence of her corporate donors, she offered a defense during Saturday night's debate — and included her work as a New York senator after September 11th.""Why, over her political career has Wall Street been a major — the major campaign contributor to Hillary Clinton?"" Sanders asked onstage after calling her financial policy package not good enough. ""You know, maybe they're dumb and they don't know what they're going to get, but I don't think so.""Clinton, offered the chance to respond, first cited the number of small donors to her presidential campaign, and then that the majority of them are women.Then, she turned to 9/11.""So, I represented New York, and I represented New York on 9/11 when we were attacked,"" she said. ""Where were we attacked? We were attacked in downtown Manhattan where Wall Street is."" ""I did spend a whole lot of time and effort helping them rebuild,"" she continued. ""That was good for New York. It was good for the economy and it was a way to rebuke the terrorists who had attacked our country.""SANDERS: Here's the story: I mean, you know, let's not be naive about it. Why do — why, over her political career has Wall Street been a major — the major campaign contributor to Hillary Clinton? You know, maybe they're dumb and they don't know what they're going to get, but I don't think so.Here is the major issue when we talk about Wall Street. It ain't complicated. You have six financial institutions today that have assets of 56%, equivalent to 56% of the GDP In America. They issue two-thirds of the credit cards and one-third of the mortgages.If Teddy Roosevelt, a good Republican, were alive today, you know what he'd say? ""Break them up."" Reestablish Glass-Steagall. And Teddy Roosevelt is right. That is the issue. Now I am the only candidate up here that doesn't have a super PAC. I am not asking Wall Street or the billionaires for money. I will break up these banks. Support community banks and credit unions. That's the future of banking in America.DICKERSON: Great follow up because you — and Secretary Clinton, you will get a chance to respond. You said they know what they're going to get. What are they going to get?SANDERS: I have never heard a candidate never, who has received huge amounts of money from oil, from coal, from Wall Street, from the military industrial complex, not one candidate say, oh, these campaign contributions will not influence me. I'm going to be independent. Well, why do they make millions of dollars of campaign contributions? they expect to get something. Everybody knows that. Once again, I am running a campaign differently than any other candidate. We are relying on small campaign donors, 750,000 of them, 30 bucks a piece. That's who I'm indebted to.CLINTON: Well, John, wait a minute. Wait a minute, he has basically used his answer to impune my integrity. Let's be frank here.SANDERS: No, I have not. CLINTON: Oh, wait a minute, senator. You know, not only do I have hundreds of thousands of donors, most of them small. And I'm very proud that for the first time a majority of my donors are women, 60%So, I represented New York, and I represented New York on 9/11 when we were attacked. Where were we attacked? We were attacked in downtown Manhattan where Wall Street is. I did spend a whole lot of time and effort helping them rebuild. That was good for New York. It was good for the economy and it was a way to rebuke the terrorists who had attacked our country.So, you know, it's fine for you to say what yo're going to say, but I looked very carefully at your proposal. Reinstating Glass-Steagall is a part of what very well could help, but it is nowhere near enough. My proposal is tougher, more effective, and more comprehensive because I go after all of Wall Street not just the big banks.",Hillary Clinton Invokes 9/11 In Defense Of Wall Street Contributions,http://www.buzzfeed.com/katherinemiller/hillary-clinton-invokes-911-in-defense-of-wall-street-contri,['campaign_finance'],"['Bernie Sanders', 'Teddy Roosevelt', 'Hillary Clinton']",buzzfeed,0.7519994201642299,"[{'author_id': 12333, 'fullname': 'katherine miller', 'primary_org': 'buzzfeed'}]",2015-11-15 04:03:03,['PAC'],9608bd7e4c558c810706989bb1733bc8,2015-11-15 05:07:37.594310
" Hillary Clinton talked tough and played defense Saturday at the second Democratic presidential debate, as rivals questioned her record and plans to fight the Islamic State.A day after a terrorist attack in Paris, terrorism and foreign policy took center stage in the two-hour debate with questions from the moderator and criticisms from rivals often focusing on her record as secretary of state during President Barack Obama’s first four years in office.Clinton remains the Democrats’ clear front-runner, but the debate illustrated how she will have to answer for administration policy on terrorism and foreign policy. Clinton last month broke with the White House, urging a no-fly zone in Syria and doing more to help rebels there. But she can’t shed her ties to the administration, and Republicans are hitting her hard on her role.The debate also showed how Clinton retains considerable advantages. Sen. Bernie Sanders of Vermont and Martin O’Malley, the former governor of Maryland, can’t match her foreign policy experience or command of world politics. Perhaps most important, neither is drawing sharp distinctions with her on anti-terrorist policies.Highlights:The three opened with a moment of silence for the victims in Paris, then talked about their approach to the Islamic State terror group.“It cannot be contained. It must be defeated,” Clinton said, a slight jab at Obama who said just before the Paris attacks that ISIS had been contained.“But it cannot be an American fight,”she added. “This cannot be an American fight, although American leadership is essential.”Her two rivals were more assertive about U.S. leadership.“I would disagree with Secretary Clinton,” said O’Malley. “This actually is America’s fight. It cannot solely be America’s fight. ... America is best when we are actually standing up to evil in this world.“Together, leading the world, this country will rid our planet of ... ISIS,” said Sanders.Republicans complain that Democrats won’t use the words Muslim or Islam in describing terrorists.Saturday, the Democratic candidates appeared to rally to the term Jihadi or Jihadist, which derive from the word for a holy war by Muslims.Clinton Saturday referred to a “radical jihadist ideology.” “I don’t think we’re at war with Islam,” she added. “I don’t think we’re at war with all Muslims.”O’Malley used the term “radical jihadis,” but also warned against labeling terrorists with the broad term of Muslim, saying that would unfairly brand the majority of American Muslims who are needed to help fight back violent extremism.Said Sanders: “I don’t think the term is what’s important.”EDITORS: BEGIN OPTIONAL TRIMO’Malley proposed allowing 65,000 Syrian refugees into the country, more than the 10,000 proposed by Obama, though he said they need “proper screening.” Clinton also argued for a higher number, adding “I said we should go to 65, but only if we have as careful a screening and vetting process as we can imagine.”EDITORS: END OPTIONAL TRIMHillary Clinton: “I don’t think we’re at war with Islam, I don’t think we’re at war with all Muslims.”Bernie Sanders: “I’m not that much of a socialist compared to Eisenhower,” referring to the 91 percent top income tax rate in the 1950s.Martin O’Malley: “You will never heard this from that immigrant-bashing carnival barker Donald Trump”EDITORS: STORY CAN END HEREClintonClinton had to defend her years as secretary of state. Moderator John Dickerson asked if the Obama administration underestimated the Islamic State threat. Clinton didn’t answer at first, then tried to tie the current crisis to President George W. Bush’s decision to end American involvement in Iraq. Each time she was challenged, Clinton would launch into detailed histories of the region’s turmoil and American involvement. Backers will praise her command of detail; opponents will contend she’s avoiding responsibility for being part of a team that didn’t take the Islamic threat seriously enough.Sanders He got off to a rocky start. He only briefly touched on the Paris terrorist attacks in his opening remarks before turning to his standard speech assailing income inequality and the corrosive nature of money in politics. Viewers then watched as Clinton and O’Malley devoted their entire opening statement to the attacks. Viewers may also have been puzzled when Sanders said that climate change is the country’s greatest threat and a contributor to the spread of terrorism. He also failed to gain traction out of his criticism that Clinton had voted for the Iraq War that he opposed.O’Malley O’Malley, who has languished in single digits in the polls, performed ably, holding his own with the former Secretary of State and U.S. senator on foreign and domestic policy, including health care and taxes. How would he pay for his policies? He explained. Can a former governor lead the U.S. in a time of global terror? Yes, he said. But he needed a breakthrough performance to attract new attention and enthusiasm to his campaign and his performance fell short.EDITORS: STORY CAN END HEREWall Street. The term came up often, as Sanders and O’Malley challenged Clinton over her ties to the financial industry. Clinton had a different take on those ties, recalling how, as a U.S. senator from New York, she fought to help rebuild a part of the city devastated by terrorist attacks.",,"Not ‘at war with all Muslims,’ Clinton saysSanders, O’Malley challenge Clinton views on Islamic StateClinton front-runner status likely to continue…Click to Continue »",Clinton on the defensive as debate turns to terrorism,http://www.mcclatchydc.com/news/politics-government/election/article44966964.html,['foreign policy/national security'],"[u""Martin O'Malley"", 'John Dickerson', 'Hillary Clinton', 'Donald Trump', 'George W. Bush', 'Barack Obama', 'Bernie Sanders']",mcclatchy,0.8709015436480531,"[{'author_id': 33914, 'fullname': 'lesley clark', 'primary_org': 'mcclatchy'}, {'author_id': 33909, 'fullname': 'david lightman', 'primary_org': 'mcclatchy'}]",2015-11-15 03:59:40,[],9f635edae0ea64962999dd70b0e9c325,2015-11-15 04:02:00.944382
" (CNN)Hillary Clinton began the second Democratic debate by calling for the U.S. to bring the world together ""to root out the kind of radical jihadist ideology that motivates organizations like ISIS.""Clinton described ISIS, which has claimed responsibility for the terror attacks in Paris on Friday, as ""a barbaric, ruthless, violent, jihadist, terrorist group.""She did not use the term ""radical Islam"" during an early exchange with CBS News moderator John Dickerson, who asked if she was uncomfortable with it.""I don't think we are at war with Islam,"" Clinton said. ""I don't think we're at war with all Muslims. I think we're at war with jihadists.""The former secretary of state said it is ""not particularly helpful"" to use the term, given the U.S. government's need to manage relationships in the Middle East.President Barack Obama as roiled conservatives by not using strong language to characterize the terrorists. Donald Trump has been among his most vocal critical and he chimed in late tonight:Democratic hopeful Bernie Sanders said during the debate that the description of the terrorists isn't that important.",,"Hillary Clinton began the second Democratic debate by calling for the U.S. to bring the world together ""to root out the kind of radical jihadist ideology that motivates organizations like ISIS.""",Clinton calls out 'radical jihadist ideology',http://www.cnn.com/2015/11/14/politics/hillary-clinton-democratic-debate-radical-jihadist/index.html,['foreign policy/national security'],"['Donald Trump', 'Bernie Sanders', 'John Dickerson', 'Barack Obama', 'Hillary Clinton']",cnn,0.526594469831528,"[{'author_id': 44270, 'fullname': 'gregory krieg', 'primary_org': 'cnn'}]",2015-11-15 03:24:27,[],678abd4593ad9aa260fc0685ecbbbe83,2015-11-15 04:00:04.809897
